channelAvatar,title,link,channel,publishedAt,duration,views,likes,comments,shortDescription,tags,category,thumbnail,myCategory,playlistPosition
https://yt3.ggpht.com/eNsmIF7eK_Ubl5Br-yUyp8_SiS8IwsqsehUisYOude4uz6wbRHsm4qVwOWi9bvlI48JOtihU=s88-c-k-c0x00ffffff-no-rj,"ANYME FUIT FACE à L'URSSAF, HELYDIA se FAIT SCAM son OP - La Crème de Twitch #405",https://www.youtube.com/watch?v=p5Ls-xSBnOE,La Crème de Twitch,'11/10/2025 11:01,00:12:44,19517,515,50,"⚡Discord: https://discord.com/invite/H3wTVg56Cc
⚡T","TwitchFR, Twitch, BestofTwitch",22,https://i.ytimg.com/vi/p5Ls-xSBnOE/hqdefault.jpg,,40
https://yt3.ggpht.com/e8DYeGKwyaDgSc8AUmIvGdGsGU_c-_2ceQCb7qkbZZzZ7R5bppKMpL2vnlaIwS04O1Jx4kzd-Q=s88-c-k-c0x00ffffff-no-rj,TRIBUNAL DES BANNIS #5,https://www.youtube.com/watch?v=wqd37QfDQRI,Wankil Studio - Laink et Terracid,'05/10/2025 12:01,00:11:47,727051,50158,500,"Un tribunal des bannis avec le respect en moins
No","terracid, laink, wankil, tribunal des bannis, twitch, ban, react",23,https://i.ytimg.com/vi/wqd37QfDQRI/hqdefault.jpg,,50
https://yt3.ggpht.com/a1Dts5E7rANROZrxzmcqNQ2oeqwsTOB1NA7nrfgsX9FfhbYHSYUM4sDQhLKpfbGvDXSKvcRayg=s88-c-k-c0x00ffffff-no-rj,J'ai regardé l'ascension de l'Everest par Inoxtag...,https://www.youtube.com/watch?v=fS02ZZGnZQA,Sabine,'17/09/2024 17:42,00:15:20,97139,6720,992,"J'ai regardé Kaizen, le documentaire d'Inoxtag qui",,24,https://i.ytimg.com/vi/fS02ZZGnZQA/hqdefault.jpg,,51
https://yt3.ggpht.com/dRDSMjwDVMxp9cCvkFVvt2Ii76AZygzF_MxFgXBxdgg22DJtuPvNg3XfEwyrbf1K5X2_Zd1ileA=s88-c-k-c0x00ffffff-no-rj,Un jeu Steam vole ton argent ?,https://www.youtube.com/watch?v=41-_SJvXf3w,Hardisk TV,'29/09/2025 08:05,00:12:53,6987,320,22,🚀 Abonne-toi pour ne rien rater : http://bit.ly/Ha,"hardisk, live, vod, twitch, best of",24,https://i.ytimg.com/vi/41-_SJvXf3w/hqdefault.jpg,,64
https://yt3.ggpht.com/wP0QSNgo7duKo-cVZ_PMpsH3T2n56yCekSzyvp2f6gdoZ7E2U0cY14rrSqVlhWj8gh1zGePHNOQ=s88-c-k-c0x00ffffff-no-rj,Autopsie d'un échec : Star Wars Outlaws,https://www.youtube.com/watch?v=4qdFYYTOoEY,JeanBaptisteShow,'26/09/2025 19:05,00:17:10,300889,26921,1633,Star Wars Outlaws serait le plus gros échec commer,"Star Wars, jeux star wars, Outlaws, Star Wars Outlaws, Star Wars Outlaws test, Star Wars Outlaws review, Star Wars Outlaws switch, Star Wars Outlaws avis, Star Wars Outlaws fin, test, trailer, epic test, avis, review, meilleur jeu star wars, Open world, monde ouvert, Ubisoft, PS5, Switch, PC gameplay, Jean-Baptiste, JeanBaptisteShow, français, fr, Jean-Baptiste Show, jbshow",20,https://i.ytimg.com/vi/4qdFYYTOoEY/hqdefault.jpg,,69
https://yt3.ggpht.com/YOY2CmBga44F7Mja5HmH0exD6JTwAiETthp3OOrR9KgM4tsb04KzGroSw8cQ0Y30GL0uT85BCg=s88-c-k-c0x00ffffff-no-rj,Test iPhone Air - Je l'adore ! (mais...),https://www.youtube.com/watch?v=FGpHwlJzkG8,TheiCollection,'26/09/2025 15:45,00:12:09,111909,4143,337,Voici mon test et retour d'expérience sur l'iPhone,"iPhone Air, Test iPhone Air, iPhone Air Avis, Test Français iPhone Air, iPhone Air VS iPhone 17 Pro, iPhone Air VS iPhone 17, iPhone 17 Air, iPhone 17, Test iPhone 17 Air, Test iPhone 17, Comparatif iPhone, iPhone, TheiCollection iPhone, TheiCollection, Tech, HighTech, Technologie, JB, Jojol, Gentil, Garçon",28,https://i.ytimg.com/vi/FGpHwlJzkG8/hqdefault.jpg,,71
https://yt3.ggpht.com/YOY2CmBga44F7Mja5HmH0exD6JTwAiETthp3OOrR9KgM4tsb04KzGroSw8cQ0Y30GL0uT85BCg=s88-c-k-c0x00ffffff-no-rj,Je teste la meilleure montre connectée du moment ?! (HUAWEI Watch GT 6 Pro),https://www.youtube.com/watch?v=v4Dv_Xj8_L0,TheiCollection,'23/09/2025 16:55,00:10:01,38980,943,160,"Que vaut la nouvelle HUAWEI Watch GT 6 Pro ?
Insta","Huawei, Huawei Watch GT 6Pro, Huawei Watch, Apple Watch, montre connectée, montre connectée Huawei, Huawei Watch 2025, TheiCollection, Tech, HighTEch, Technologie, JB, Jojol, Gentil, Garçon, montre connectée pas chère, montre connectée Android",28,https://i.ytimg.com/vi/v4Dv_Xj8_L0/hqdefault.jpg,,79
https://yt3.ggpht.com/ytc/AIdro_nhTrNkfRe_XfrOawqxt27NmKDO2CzVfVvMl8p2c8h7U5M=s88-c-k-c0x00ffffff-no-rj,La face cachée de Mister V enfin dévoilée | Carte Blanche,https://www.youtube.com/watch?v=9X2Wn5pQ9kw,Konbini,'15/09/2025 18:02,00:15:50,279387,12394,306,Konbini lance son nouveau concept : Carte Blanche.,"konbini, kombini, news, actu, culture, rreportage",24,https://i.ytimg.com/vi/9X2Wn5pQ9kw/hqdefault.jpg,,82
https://yt3.ggpht.com/BvFQQoY71Zh47ZhhlbBzqGDjENGxeY1Dd-hAIlS6p4Gl0ws2WzAie5aXS9-cpkZtd7raSJYqmg=s88-c-k-c0x00ffffff-no-rj,Boîte de Nuit : Immersion dans l'ENFER des SOIRÉES de m*rde.,https://www.youtube.com/watch?v=aKMVR2Fhej4,TPZ,'14/09/2025 11:01,00:11:07,51379,3164,449,"Les fêtards ne cessent de dire que ""les soirées en","tpz, tpz enquete, boite de nuit, reportage, faire la fête, physio de boite de nuit, videur de boite, probleme boite de nuit, ou sortir en club, infiltration boite de nuit, immersion boite de nuit, enquete boite de nuit, discothèques, probleme discotheque france",24,https://i.ytimg.com/vi/aKMVR2Fhej4/hqdefault.jpg,,96
https://yt3.ggpht.com/T7ul9IiV5Q2bN2XiKY3jlN9_hXNDmdw8nHPcHa6xUk-F06kSVSbtWiDUiP2nG6DLs7GnjXIRLKE=s88-c-k-c0x00ffffff-no-rj,"Tibo InShape fait sa Propagande, Lives TikTok et un Tigre (Épisodes 323 à 329)",https://www.youtube.com/watch?v=WnmpiQQZPnI,SUSHI NIHILISTE,'15/03/2024 19:03,00:17:51,61957,2832,96,Compilation intégrale de mes vidéos de Février 202,,23,https://i.ytimg.com/vi/WnmpiQQZPnI/hqdefault.jpg,,110
https://yt3.ggpht.com/T7ul9IiV5Q2bN2XiKY3jlN9_hXNDmdw8nHPcHa6xUk-F06kSVSbtWiDUiP2nG6DLs7GnjXIRLKE=s88-c-k-c0x00ffffff-no-rj,"Multivers, Lasers Extra-Terrestres et un Complot de Beyoncé  (Épisodes 215 à 229)",https://www.youtube.com/watch?v=PJXN0IoqZr4,SUSHI NIHILISTE,'15/07/2023 16:00,00:19:40,62832,2583,114,Compilation intégrale de mes vidéos de Juin 2023 !,,23,https://i.ytimg.com/vi/PJXN0IoqZr4/hqdefault.jpg,,111
https://yt3.ggpht.com/T7ul9IiV5Q2bN2XiKY3jlN9_hXNDmdw8nHPcHa6xUk-F06kSVSbtWiDUiP2nG6DLs7GnjXIRLKE=s88-c-k-c0x00ffffff-no-rj,"500 000 Abonnés, le Diable est sur Terre et un Triangle Amoureux (Épisodes 113 à 125)",https://www.youtube.com/watch?v=irBuL3ZFvi4,SUSHI NIHILISTE,'31/10/2022 07:10,00:16:36,78463,3484,176,Compilation intégrale de mes vidéos de Septembre e,,22,https://i.ytimg.com/vi/irBuL3ZFvi4/hqdefault.jpg,,113
https://yt3.ggpht.com/T7ul9IiV5Q2bN2XiKY3jlN9_hXNDmdw8nHPcHa6xUk-F06kSVSbtWiDUiP2nG6DLs7GnjXIRLKE=s88-c-k-c0x00ffffff-no-rj,"Les Pyramides de Gims, le Flop d'Elon Musk et Marvel = Satan (Épisodes 185 à 199)",https://www.youtube.com/watch?v=qtb_vkNIkco,SUSHI NIHILISTE,'30/04/2023 16:00,00:16:38,81961,3252,167,Compilation intégrale de mes vidéos d'Avril 2023 !,,23,https://i.ytimg.com/vi/qtb_vkNIkco/hqdefault.jpg,,114
https://yt3.ggpht.com/T7ul9IiV5Q2bN2XiKY3jlN9_hXNDmdw8nHPcHa6xUk-F06kSVSbtWiDUiP2nG6DLs7GnjXIRLKE=s88-c-k-c0x00ffffff-no-rj,"La Mode des Mangas, Britney Spears est un Clone et un Charo (Épisodes 137 à 150)",https://www.youtube.com/watch?v=7ezMiOSdeZY,SUSHI NIHILISTE,'31/12/2022 17:39,00:16:44,83551,3587,146,Compilation intégrale de mes vidéos de Décembre 20,,22,https://i.ytimg.com/vi/7ezMiOSdeZY/hqdefault.jpg,,116
https://yt3.ggpht.com/T7ul9IiV5Q2bN2XiKY3jlN9_hXNDmdw8nHPcHa6xUk-F06kSVSbtWiDUiP2nG6DLs7GnjXIRLKE=s88-c-k-c0x00ffffff-no-rj,"La Fin du Monde, une IA sur Tinder et le Retour d'Akinator (Épisodes 169 à 184)",https://www.youtube.com/watch?v=iFljM75_g-Y,SUSHI NIHILISTE,'31/03/2023 16:00,00:17:55,95208,3967,117,Compilation intégrale de mes vidéos de Mars 2023 !,,23,https://i.ytimg.com/vi/iFljM75_g-Y/hqdefault.jpg,,117
https://yt3.ggpht.com/a_1U9tYmozHPhZhsLiqqQ_XcYbhlmG_X1fsTdBWAHBjLmRN0haiv1xa_owiit7p8xyKDlMF1LXw=s88-c-k-c0x00ffffff-no-rj,The Shady Truth about Amazon Basics,https://www.youtube.com/watch?v=l2p3fZyV254,Mrwhosetheboss,'06/09/2025 10:53,00:13:44,2521527,101320,4848,There's more going on on Amazon than you think... ,"amazon basics, tech, gadgets, scam",28,https://i.ytimg.com/vi/l2p3fZyV254/hqdefault.jpg,,118
https://yt3.ggpht.com/T7ul9IiV5Q2bN2XiKY3jlN9_hXNDmdw8nHPcHa6xUk-F06kSVSbtWiDUiP2nG6DLs7GnjXIRLKE=s88-c-k-c0x00ffffff-no-rj,"Adultère, Chats Violents et la Gen Z qui Pète les Plombs (Épisodes 200 à 214)",https://www.youtube.com/watch?v=4lOdAiS_8gE,SUSHI NIHILISTE,'31/05/2023 10:00,00:16:43,99395,3759,154,"Compilation intégrale de mes vidéos de Mai 2023 !
","sushi, nihiliste, vidéo, réaction, commentaire, tiktok, compilation, insta, instagram, humour, second, degré, café, mug, saison 2",23,https://i.ytimg.com/vi/4lOdAiS_8gE/hqdefault.jpg,,124
https://yt3.ggpht.com/YOY2CmBga44F7Mja5HmH0exD6JTwAiETthp3OOrR9KgM4tsb04KzGroSw8cQ0Y30GL0uT85BCg=s88-c-k-c0x00ffffff-no-rj,"C'est bon, j'ai trouvé le smartphone pliant parfait ! (Honor Magic V5)",https://www.youtube.com/watch?v=7Tqc5YE9hVg,TheiCollection,'28/08/2025 15:07,00:11:00,73715,1607,167,Voici mon test du nouveau Honor Magic V5 qui vient,"Honor Magic V5, Test Honor Magic V5, smartphone pliant, Honor pliant, nouveau smartphone HONOR, HONOR, Huawei, TheiCollection, smartphone, iPhone 17, Galaxy Z Fold 7, JB, Jojol, Gentil, Garçon, Review Honor Magic V5",28,https://i.ytimg.com/vi/7Tqc5YE9hVg/hqdefault.jpg,,126
https://yt3.ggpht.com/PEwQfVuhh5jO7_NDDufCq349q0W6MgZeYlgeMyW3OSRMxMx9W5yre5Fgbi4Bql56L1cPwoteOA=s88-c-k-c0x00ffffff-no-rj,Google Pixel 10/Pro/Fold Impressions: Magnets!,https://www.youtube.com/watch?v=269OsrzG3Ew,Marques Brownlee,'20/08/2025 16:01,00:15:41,5283306,140875,6776,"Pixel 10 is finally here - it's more flagship, but","Pixel 10, Pixel 10 Pro, Pixel 10 Pro XL, Pixel 10 Pro Fold, Pixel 10 impressions, MKBHD, Pixelsnap, Tensor G5, Tensor G5 vs, Pixel 10 vs, Qi2",28,https://i.ytimg.com/vi/269OsrzG3Ew/hqdefault.jpg,,130
https://yt3.ggpht.com/ytc/AIdro_lRY24xCKT9seH0TYW6LcBbDVcFW3unpSvqA5Ps9Qsi4q0=s88-c-k-c0x00ffffff-no-rj,Une émission Grandes Écoles pour changer ! (pas si simple en vrai),https://www.youtube.com/watch?v=QDPrkqxTdKE,Etoiles,'15/08/2025 15:00,00:17:34,98076,3881,76,Peu de lives en ce moment donc Nuit de la Culture ,"Etoiles, Etoile, culture, quiz, nuit de la culture, question pour un champion, samuel etienne, react, grandes écoles, spéciale",24,https://i.ytimg.com/vi/QDPrkqxTdKE/hqdefault.jpg,,133
https://yt3.ggpht.com/iBKTl0OpZcX2gPky0MGPMmvlstkNQDzlg-lP6Khje4DJx6z9u7EaPq1p3fLyDuscrrLP_GbJNA=s88-c-k-c0x00ffffff-no-rj,Comprendre Bref 2 grâce à Albert Camus,https://www.youtube.com/watch?v=C5rHDAkuMuQ,Cato Minor,'21/02/2025 14:00,00:12:40,149983,8485,239,La semaine dernière j'étais en train d'écrire une ,"albert, camus, albert camus, bref, chute, clamence, la chute, etranger, peste",24,https://i.ytimg.com/vi/C5rHDAkuMuQ/hqdefault.jpg,,139
https://yt3.ggpht.com/iBKTl0OpZcX2gPky0MGPMmvlstkNQDzlg-lP6Khje4DJx6z9u7EaPq1p3fLyDuscrrLP_GbJNA=s88-c-k-c0x00ffffff-no-rj,Le Comte de Monte Cristo vous a manipulé,https://www.youtube.com/watch?v=GEFETK2g7xY,Cato Minor,'14/12/2024 12:00,00:16:36,194543,7146,272,"C'est bientôt les fêtes, la période des films de N",,24,https://i.ytimg.com/vi/GEFETK2g7xY/hqdefault.jpg,,141
https://yt3.ggpht.com/iBKTl0OpZcX2gPky0MGPMmvlstkNQDzlg-lP6Khje4DJx6z9u7EaPq1p3fLyDuscrrLP_GbJNA=s88-c-k-c0x00ffffff-no-rj,Ce Biais Cognitif vous empêche de réussir,https://www.youtube.com/watch?v=Wzlpun1cf1Q,Cato Minor,'12/03/2025 19:13,00:13:42,486011,29512,854,Une vidéo un peu spéciale où je vous parle d’un su,"Rilke, Rainer Maria Rilke, Lettres, Poète, Création, Lettres à un Jeune Poète, Jeune Poète",24,https://i.ytimg.com/vi/Wzlpun1cf1Q/hqdefault.jpg,,142
https://yt3.ggpht.com/-CMgKaBdcjD72zIL0LCKfbgaOPXxOT9hcyvngb7aE1YgB2x4CUeTdT5D_DQ5llaJijSFuONc=s88-c-k-c0x00ffffff-no-rj,OUISTITI - PARTIE 2,https://www.youtube.com/watch?v=AZqlsJxUPRo,Studio Coquillettes,'30/07/2025 15:41,00:10:02,2338,254,18,"Une série de Boris Baroux et Jérémy Barrière 

Réa",,22,https://i.ytimg.com/vi/AZqlsJxUPRo/hqdefault.jpg,,145
https://yt3.ggpht.com/YOY2CmBga44F7Mja5HmH0exD6JTwAiETthp3OOrR9KgM4tsb04KzGroSw8cQ0Y30GL0uT85BCg=s88-c-k-c0x00ffffff-no-rj,Test Galaxy Z Fold 7 - Samsung a (enfin) plié le game ?,https://www.youtube.com/watch?v=Lm7LbUeAiuw,TheiCollection,'24/07/2025 17:16,00:14:37,193982,2673,258,Profitez des offres des Withings DAYS en cliquant ,"Test Galaxy Z Fold 7, Galaxy Z Fold 7, Z Fold 7, Samsugn pliant, Fold 7, Samsung Fold, Z Fold 6 VS Z fold 7, TheiCOllection, Tech, HighTech, Jojol, Gentil, Garçon, JB, Samsung, Z Flip 7, iPhone Fold, iPhone 17, Android 16, Galaxy pliant, Galaxy Z Flip 7, test Z fod 7 Français, Test Z Fold 7 france",28,https://i.ytimg.com/vi/Lm7LbUeAiuw/hqdefault.jpg,,150
https://yt3.ggpht.com/PEwQfVuhh5jO7_NDDufCq349q0W6MgZeYlgeMyW3OSRMxMx9W5yre5Fgbi4Bql56L1cPwoteOA=s88-c-k-c0x00ffffff-no-rj,My Nintendo Switch 2 Review (Doesn't Matter?),https://www.youtube.com/watch?v=-NNCca97v98,Marques Brownlee,'03/07/2025 19:44,00:13:17,2798480,69814,4452,The Switch 2 is pretty good. Also pricy. But it’s ,"Switch 2, Nintendo Switch 2, Nintendo Switch 2 review, Switch 2 review, MKBHD, Switch 2 vs, Switch 2 games",28,https://i.ytimg.com/vi/-NNCca97v98/hqdefault.jpg,,168
https://yt3.ggpht.com/TjEf3gcBpEzHqzCEn0Vkoyhbo40B7Z3nZDPhIjcUcg1APOUQ0Fwz9EmS_dHTh_H6vnv-wbq6fw=s88-c-k-c0x00ffffff-no-rj,Sécuriser sa maison connectée facilement ! (Écosystème Arlo),https://www.youtube.com/watch?v=Lfxp1BdT_oA,QUENTIN,'05/06/2025 16:27,00:11:23,7636,305,28,/ Et si la tech pouvait aussi nous apporter un peu,"Quentin, Quentin Cougniot, SETUP Ultime, High-Tech, Tech, Technologie, storytelling tech, histoire tech, ARLO, ARLO SECURE, ARLO écosystème, Arlo 2K, Arlo sonnette connectée, Arlo Pro 5, Arlo Pro 5S, Essential Indoor Camera, Arlo",28,https://i.ytimg.com/vi/Lfxp1BdT_oA/hqdefault.jpg,,182
https://yt3.ggpht.com/ytc/AIdro_lRY24xCKT9seH0TYW6LcBbDVcFW3unpSvqA5Ps9Qsi4q0=s88-c-k-c0x00ffffff-no-rj,"J'ai BATTU Emilien en Culture G ?! - Kculture ft Emilien, Hiro et Grimkujow",https://www.youtube.com/watch?v=mONxX9X0Wos,Etoiles,'01/06/2025 16:30,00:18:11,262759,12165,159,Kculture avec Emilien puis Hiro et Grim sont venus,"Etoiles, etoile, kculture, kameto, Emilien, 12 coups de midi, grimkujow, hiro, culture, quiz",24,https://i.ytimg.com/vi/mONxX9X0Wos/hqdefault.jpg,,186
https://yt3.ggpht.com/ytc/AIdro_lRDGpQ4uYJtdwyN8dSPN6MnihWZS3j_QPnXqzkpJEcjg=s88-c-k-c0x00ffffff-no-rj,MYNTHOS SUCEUR D'ÉCROUS (FFS PUBG avec Mynthos #1),https://www.youtube.com/watch?v=5uQYJ_LuwAU,Best Of Antoine Daniel,'31/05/2025 13:45,00:14:00,81137,3626,44,Retrouvez Antoine en live sur Twitch : https://www,"antoine daniel, antoine daniel best of, best of antoine daniel, antoine daniel twitch, twitch antoine daniel, best of twitch, best of twitch antoine daniel, antoine daniel twitch best of, jeux vidéo, pubg, ffs, zerator, pubg antoine daniel, ffs pubg, ffs duo, mynthos, mynthos antoine daniel, antoine daniel mynthos, écrous mynthos, mynthos pubg",20,https://i.ytimg.com/vi/5uQYJ_LuwAU/hqdefault.jpg,,188
https://yt3.ggpht.com/e8DYeGKwyaDgSc8AUmIvGdGsGU_c-_2ceQCb7qkbZZzZ7R5bppKMpL2vnlaIwS04O1Jx4kzd-Q=s88-c-k-c0x00ffffff-no-rj,IL CUISINE UNE GALETTE ET DES BURGERS MAIS C'EST UNE CATASTROPHE,https://www.youtube.com/watch?v=-pCB-luHrtc,Wankil Studio - Laink et Terracid,'07/05/2025 12:00,00:14:25,955876,59104,590,Direction la cuisine pour une bonne galette des ro,"terracid, laink, wankil, cuisine, repas, burger, galette, poulet",24,https://i.ytimg.com/vi/-pCB-luHrtc/hqdefault.jpg,,204
https://yt3.ggpht.com/ytc/AIdro_lRDGpQ4uYJtdwyN8dSPN6MnihWZS3j_QPnXqzkpJEcjg=s88-c-k-c0x00ffffff-no-rj,VIENS VOIR MES PELUCHES :3 ! (Pokérayou Academy #8),https://www.youtube.com/watch?v=SWui1Cg7qfo,Best Of Antoine Daniel,'05/05/2025 14:10,00:11:41,62218,3546,33,Retrouvez Antoine en live sur Twitch : https://www,"antoine daniel, best of antoine daniel, antoine daniel best of, best of twitch antoine daniel, antoine daniel twitch best of, best of live antoine daniel, minecraft, pokérayou academy, pokémon, antoine daniel minecraft, antoine daniel pokérayou, pokérayou, cobblemon, minecraft antoine daniel, pokérayou antoine daniel, pokérayou best of, M. Glaquette, glaquette, cobblemon antoine daniel, angledroit, naka, etoiles, #8, aypierre, sundae, lutti, jltomy, kada",20,https://i.ytimg.com/vi/SWui1Cg7qfo/hqdefault.jpg,,206
https://yt3.ggpht.com/HP9oIpL42ufzvCEBTLzxAtpZae1rfLzdte8tnlh-Qi0yjIprNPDqHXiR-XvxMe5eyFUC5Fensl0=s88-c-k-c0x00ffffff-no-rj,Comment créer une App avec l'IA et ChatGPT sans Coder,https://www.youtube.com/watch?v=knO5RT4-DGc,Ludo Salenne,'01/04/2025 15:00,00:16:37,43364,1250,100,ChatGPT 4o Image Generation est incroyable. Mais s,"chatgpt 4o image generation, chatgpt image generation, chatgpt 4o image, gpt 4o image, gpt 4o image generation, no code, outils no code, outil no code, no code gratuit, ia gratuit, outils ia, 4o image generation, chatgpt image, chatgpt 4o, chat gpt, chatgpt, tuto chatgpt, tuto no code, tuto chatgpt image, demo chatgpt image, formation chatgpt, chatgpt fr, chatgpt francais, chatgpt 4 image generation",28,https://i.ytimg.com/vi/knO5RT4-DGc/hqdefault.jpg,,220
https://yt3.ggpht.com/ytc/AIdro_nqwNilOaLIp6oLJCHkiVZFtej0oMunTQNh6Z9PCtt9RA=s88-c-k-c0x00ffffff-no-rj,"La Veillée #103 : La chute, par Morgan Segui",https://www.youtube.com/watch?v=TEEt0Inn_7A,La Veillée,'24/03/2025 17:00,00:10:25,10695,604,20,Prenez vos billets pour les 10 ans de la Veillée a,,22,https://i.ytimg.com/vi/TEEt0Inn_7A/hqdefault.jpg,,226
https://yt3.ggpht.com/ytc/AIdro_lRY24xCKT9seH0TYW6LcBbDVcFW3unpSvqA5Ps9Qsi4q0=s88-c-k-c0x00ffffff-no-rj,Un 4 à la suite IMPROBABLE (sauf pour les vieux...) - Nuit de la Culture,https://www.youtube.com/watch?v=Rop-AUs_1ww,Etoiles,'21/03/2025 18:00,00:17:10,90911,3768,61,Autre émission qu'on avait en stock pour vous fair,"Quiz, Culture, Etoiles, question pour un champion, Nuit de la culture, react, Etoile, Culture Clash, Super Champion, Jarno",24,https://i.ytimg.com/vi/Rop-AUs_1ww/hqdefault.jpg,,228
https://yt3.ggpht.com/v2D0WfvIE1yLmfHoUZdn2dwgPiDEqAbeK5ZBXdo-ZfbZ_8db-GO9qp49wp4KtadZdZvpCf8o=s88-c-k-c0x00ffffff-no-rj,L’erreur fatale qui a détruit l’empire Toys’R’Us,https://www.youtube.com/watch?v=dN2oMB8I9sI,Romain Lanéry,'13/10/2024 16:00,00:15:33,531123,15999,595,Toys'R'Us avait une position de force démentielle ,"Romain Lanéry, Toys R Us, histoire Toys R Us, Charles Lazarus, faillite Toys R Us, jouets emblématiques, nostalgie Toys R Us, géant du jouet, fermeture Toys R Us, Amazon et Toys R Us, industrie du jouet, magasins de jouets, baby-boom, e-commerce jouets, Toys R Us renaissance, collectionneurs de jouets, jouets des années 80, faillite entreprise, publicité Toys R Us, capital investissement, transformation marché du jouet, technologie, coulisses, business, Amazon, King Jouet",28,https://i.ytimg.com/vi/dN2oMB8I9sI/hqdefault.jpg,,229
https://yt3.ggpht.com/YOY2CmBga44F7Mja5HmH0exD6JTwAiETthp3OOrR9KgM4tsb04KzGroSw8cQ0Y30GL0uT85BCg=s88-c-k-c0x00ffffff-no-rj,Je découvre le nouveau Mercedes CLA 2025 ! (encore plus tech qu'un smartphone),https://www.youtube.com/watch?v=JJpb5KoQG7c,TheiCollection,'18/03/2025 19:28,00:10:41,50961,1420,79,"Voici le nouveau Mercedes CLA 2025, qui a comme pa","Mercedes CLA, Mercedes CLA 2025, Mercedes CLA IA, CLA 2025, Mercedes IA, Nouvelle mercedes CLA, Mercedes CLA 2025 essai, Test Mercedes CLA 2025, Apple, Google Gemini, IA, IA Mercedes CLA, iPhone, Essai Mercedes, voiture connectée, voiture Tech, TheiCollection, HighTech, JB, Jojol, Gentil, Garçon",28,https://i.ytimg.com/vi/JJpb5KoQG7c/hqdefault.jpg,,233
https://yt3.ggpht.com/ytc/AIdro_kcL_PnNz1KEjLIQ7veCTq_0Vv7tktG0oth4M0_NZp8PRw=s88-c-k-c0x00ffffff-no-rj,IL PENSE ÊTRE LE PLUS BEAU DU MONDE (C'est insupportable),https://www.youtube.com/watch?v=TfnEY25lNf0,Mastu,'17/07/2021 09:02,00:15:15,6016035,358782,6205,"Abonnez-vous si ça vous dérange pas trop... Svp

C","Mastu, Mastus, Redbox, Humour, Matsu, tellement vrai, mastu tellement vrai, mastu next, next",23,https://i.ytimg.com/vi/TfnEY25lNf0/hqdefault.jpg,,234
https://yt3.ggpht.com/ytc/AIdro_nqwNilOaLIp6oLJCHkiVZFtej0oMunTQNh6Z9PCtt9RA=s88-c-k-c0x00ffffff-no-rj,"La Veillée #97 : Projet Azur, par Anaëlle Marot",https://www.youtube.com/watch?v=eg_pkmfU9tg,La Veillée,'20/01/2025 17:00,00:15:23,9428,403,11,Prenez vos billets pour les 10 ans de la Veillée a,,22,https://i.ytimg.com/vi/eg_pkmfU9tg/hqdefault.jpg,,239
https://yt3.ggpht.com/ZE7hGh0rRZzPa56ZkuiOFnDqWItgKHjGFzHRkcNoC68vK6DzKEfOgkalzF8Wl1l8oUe6-_l6Uw=s88-c-k-c0x00ffffff-no-rj,Cet outil IA permet de créer des apps en 5 minutes... sans coder,https://www.youtube.com/watch?v=s6AAAovfC6w,theyo,'16/02/2025 17:00,00:15:08,57260,1197,94,⚡️ Rejoins-moi pour un Afterwork LIVE gratuit exce,"nocode, ia, intelligence artificielle, bubble.io, tutoriel bubble.io",27,https://i.ytimg.com/vi/s6AAAovfC6w/hqdefault.jpg,,243
https://yt3.ggpht.com/nzEa1ZH5mjxIVLo0jo0zrTQpXalXGV4aOhYTYVXkWdhaImvmDMnNGJqitLGf42hEWoEpfX-WCTM=s88-c-k-c0x00ffffff-no-rj,Je réponds sinon il me frappe !,https://www.youtube.com/watch?v=NhKX3fAHe_U,Thomas Combret,'06/10/2022 10:01,00:16:33,9733,1092,103,Le lien du Kiss kiss : https://www.kisskissbankban,"thomas, combret, mammouth, cornichon, humour, sketch, courts, métrages, court, metrage, drole, drôle, parodie, badnews, les acteurs, FAQ, QNA",23,https://i.ytimg.com/vi/NhKX3fAHe_U/hqdefault.jpg,,259
https://yt3.ggpht.com/ytc/AIdro_l5M7wAHM9QledrlSHNomrm8tV-pTAyzUiFtL7iSVFUIA=s88-c-k-c0x00ffffff-no-rj,Papy Grenier - STREET OF RAGE (avec un peu de Final fight),https://www.youtube.com/watch?v=4At7lfnT-40,Joueur Du Grenier,'18/11/2021 16:13,00:10:23,2772996,156822,4800,"Téléchargez Opera GX gratuitement ici : 
https://o","Joueur du grenier, JDG, bazar du grenier, Street of rage, beat them up, Final fight, Double dragon, papy grenier",24,https://i.ytimg.com/vi/4At7lfnT-40/hqdefault.jpg,,272
https://yt3.ggpht.com/ytc/AIdro_nqwNilOaLIp6oLJCHkiVZFtej0oMunTQNh6Z9PCtt9RA=s88-c-k-c0x00ffffff-no-rj,"La Veillée #96 : Lady, par Romain Tranchart",https://www.youtube.com/watch?v=EjePRSzMTFo,La Veillée,'13/01/2025 17:00,00:13:16,9011,264,6,Prenez vos billets pour les 10 ans de la Veillée a,,22,https://i.ytimg.com/vi/EjePRSzMTFo/hqdefault.jpg,,279
https://yt3.ggpht.com/ytc/AIdro_lRY24xCKT9seH0TYW6LcBbDVcFW3unpSvqA5Ps9Qsi4q0=s88-c-k-c0x00ffffff-no-rj,Aude se plaint de moi À LA TÉLÉ ??? - Nuit de la Culture : Spéciale Masters,https://www.youtube.com/watch?v=qDxPRn5Grvg,Etoiles,'29/12/2024 17:31,00:19:24,166440,7486,101,"On dirait que j'ai raté son message, elle me le fa","Quiz, Culture, Etoiles, question pour un champion, Nuit de la culture, react, Etoile, les masters, Culture Clash, Aude",24,https://i.ytimg.com/vi/qDxPRn5Grvg/hqdefault.jpg,,303
https://yt3.ggpht.com/ytc/AIdro_l5M7wAHM9QledrlSHNomrm8tV-pTAyzUiFtL7iSVFUIA=s88-c-k-c0x00ffffff-no-rj,PAPY GRENIER - CYBERPUNK 2077,https://www.youtube.com/watch?v=QrgAgh46Ct8,Joueur Du Grenier,'17/04/2021 18:31,00:12:23,2561320,114689,4254,Cette vidéo est sponsorisée par World of Tanks !  ,"Joueur du grenier, bazar du grenier, Papy Grenier, version censurée, cyberpunk 2077, jdg",23,https://i.ytimg.com/vi/QrgAgh46Ct8/hqdefault.jpg,,306
https://yt3.ggpht.com/ytc/AIdro_l5M7wAHM9QledrlSHNomrm8tV-pTAyzUiFtL7iSVFUIA=s88-c-k-c0x00ffffff-no-rj,Papy grenier - HITMAN,https://www.youtube.com/watch?v=OPQEo4nW860,Joueur Du Grenier,'03/07/2022 15:00,00:13:13,2702527,168732,4702,📱🔥 Pour découvrir les nouveaux Xiaomi 12 et 12 Pro,"Joueur du grenier, Bazar du grenier, Hitman, JDG, Humour, parodie",23,https://i.ytimg.com/vi/OPQEo4nW860/hqdefault.jpg,,307
https://yt3.ggpht.com/ytc/AIdro_nqwNilOaLIp6oLJCHkiVZFtej0oMunTQNh6Z9PCtt9RA=s88-c-k-c0x00ffffff-no-rj,"La Veillée #87 : La dualité onde-particule, par Célia Pelluet",https://www.youtube.com/watch?v=f8Z6LXFN59M,La Veillée,'28/10/2024 17:00,00:16:02,16747,664,16,Prenez vos billets pour les 10 ans de la Veillée a,,22,https://i.ytimg.com/vi/f8Z6LXFN59M/hqdefault.jpg,,320
https://yt3.ggpht.com/ytc/AIdro_nqwNilOaLIp6oLJCHkiVZFtej0oMunTQNh6Z9PCtt9RA=s88-c-k-c0x00ffffff-no-rj,"La Veillée #85 :  Ratatouille, par Johan Souply",https://www.youtube.com/watch?v=DiGbN4sjv2k,La Veillée,'14/10/2024 16:00,00:15:43,21404,1175,50,Prenez vos billets pour les 10 ans de la Veillée a,,22,https://i.ytimg.com/vi/DiGbN4sjv2k/hqdefault.jpg,,323
https://yt3.ggpht.com/J-PBRisLNGiSPLtAeoz7Tn1qR14HP9LwcZYuYqgraNfdMcaFPBgIS6w06do2buv09f4pNZRE0Q=s88-c-k-c0x00ffffff-no-rj,"Comment parler à n'importe qui, d'après un ancien timide.",https://www.youtube.com/watch?v=Fn17-ShhG60,Charlie Haid,'14/04/2024 08:41,00:12:24,503478,31921,596,"Pour en finir avec la peur du regard des autres. 
",,24,https://i.ytimg.com/vi/Fn17-ShhG60/hqdefault.jpg,,333
https://yt3.ggpht.com/-e7up0qHG1yPeLe8NBc-jGFS6OKaehw06N4Ad_AOy0WvDqKieGyh-uaKxKUyQN6vALyU-WG1PA=s88-c-k-c0x00ffffff-no-rj,IL S'EST PASSÉ CERTAINES CHOSES AU TOURNAGE DE MRBEAST,https://www.youtube.com/watch?v=VntFnD63ISs,Mastu Gear 2,'24/07/2024 15:02,00:15:12,1482808,89366,763,Y'a quelques anecdotes de tournage que vous n'avez,"mastu, mastutv, matsu, mastus, humour, mastu gear, mastu mrbeast, mrbeast, mrbeast mastu",24,https://i.ytimg.com/vi/VntFnD63ISs/hqdefault.jpg,,334
https://yt3.ggpht.com/lbLR2SXFU8w6W1vq7XWkh4eJ-3TkWi6GSFo_NEm4DXu11Mlay8QBxWXqXZZboKiIQ3HnOSpAMIs=s88-c-k-c0x00ffffff-no-rj,BOUCHON | Episode 8 | ARTE Séries,https://www.youtube.com/watch?v=2j1n3h14oZY,ARTE Séries,'30/04/2024 16:03,00:12:50,22034,953,73,Huitième épisode : C’est l’anniversaire de Jean-Pa,"ARTE, Autre, TV, série arte, série ARTE, arte serie, drame familial, cancer, relations familiales, premier role, anniversaire, émotions contradictoires, méditataion, podcasts, entrelacs sentimentaux, tokyo, emancipation, suisse, soutien familial, acceptation, croissance personnelle, bouchon arte, bouchon série, bouchon série arte, bouchon replay, bouchon streaming, bouchon arte série, eleonore costes",24,https://i.ytimg.com/vi/2j1n3h14oZY/hqdefault.jpg,,345
