channelAvatar,title,link,channel,publishedAt,duration,views,likes,comments,shortDescription,tags,category,thumbnail,myCategory,playlistPosition
https://yt3.ggpht.com/ytc/AIdro_lRDGpQ4uYJtdwyN8dSPN6MnihWZS3j_QPnXqzkpJEcjg=s88-c-k-c0x00ffffff-no-rj,LA SOUPE AUX CHOUX (PUBG : Battlegrounds),https://www.youtube.com/watch?v=_wh9B_yopQM,Best Of Antoine Daniel,'26/10/2025 15:01,00:21:21,12798,1200,30,Retrouvez Antoine en live sur Twitch : https://www,"antoine daniel, antoine daniel best of, best of antoine daniel, antoine daniel twitch, twitch antoine daniel, best of twitch, best of twitch antoine daniel, antoine daniel twitch best of, pubg, pubg antoine daniel, mynthos, mynthos antoine daniel, antoine daniel mynthos, mynthos pubg, rivenzi, rivenzi pubg, la soupe aux choux",20,https://i.ytimg.com/vi/_wh9B_yopQM/hqdefault.jpg,,1
https://yt3.ggpht.com/3djzVEm99BYPivZxKHOa2z4_rfoE_bcVCjOmDM10vgp2MGH0lh67Q3Tr4uhckvpHkBMjcXin=s88-c-k-c0x00ffffff-no-rj,Pourquoi l’ASMR détend des gens alors que c’est INSUP ?,https://www.youtube.com/watch?v=ydAc6mzxGLc,euuhhh,'20/10/2025 16:01,00:26:24,16931,561,121,"[Pub ""HOLY""] : Profitez de 5 euros de réduction su","react, réact, reactfr, react francais, react français, réct français, euh, euuhhh, roro, un créatif, twitch, stream, live, mascu, argent, entrepreneur, coach, complotiste, new age, société, dev perso, développement personnel, humour, divertissement",24,https://i.ytimg.com/vi/ydAc6mzxGLc/hqdefault.jpg,,24
https://yt3.ggpht.com/3djzVEm99BYPivZxKHOa2z4_rfoE_bcVCjOmDM10vgp2MGH0lh67Q3Tr4uhckvpHkBMjcXin=s88-c-k-c0x00ffffff-no-rj,Pour toutes les personnes qui ont des DADDY ISSUES,https://www.youtube.com/watch?v=14u1kEhXGJo,euuhhh,'16/10/2025 16:00,00:29:48,30956,891,120,"En stream tous les mardis, jeudis et dimanches dès","react, réact, reactfr, react francais, react français, réct français, euh, euuhhh, roro, un créatif, twitch, stream, live, mascu, argent, entrepreneur, coach, complotiste, new age, société, dev perso, développement personnel, humour, divertissement",24,https://i.ytimg.com/vi/14u1kEhXGJo/hqdefault.jpg,,33
https://yt3.ggpht.com/a1Dts5E7rANROZrxzmcqNQ2oeqwsTOB1NA7nrfgsX9FfhbYHSYUM4sDQhLKpfbGvDXSKvcRayg=s88-c-k-c0x00ffffff-no-rj,Pourquoi faire des trucs IRL est devenu cool,https://www.youtube.com/watch?v=C4gjPPOq9g8,Sabine,'15/10/2025 16:25,00:22:08,43675,2551,179,Merci encore à Ecosia de sponsoriser cette vidéo !,,24,https://i.ytimg.com/vi/C4gjPPOq9g8/hqdefault.jpg,,34
https://yt3.ggpht.com/3djzVEm99BYPivZxKHOa2z4_rfoE_bcVCjOmDM10vgp2MGH0lh67Q3Tr4uhckvpHkBMjcXin=s88-c-k-c0x00ffffff-no-rj,Est-ce si GRAVE d'être un NORMIE ?,https://www.youtube.com/watch?v=2ieDIy9nLUk,euuhhh,'13/10/2025 16:00,00:29:46,55578,1291,315,"[Pub ""HOLY""] : Profitez de 5 euros de réduction su","react, réact, reactfr, react francais, react français, réct français, euh, euuhhh, roro, un créatif, twitch, stream, live, mascu, argent, entrepreneur, coach, complotiste, new age, société, dev perso, développement personnel, humour, divertissement",24,https://i.ytimg.com/vi/2ieDIy9nLUk/hqdefault.jpg,,37
https://yt3.ggpht.com/ytc/AIdro_lRY24xCKT9seH0TYW6LcBbDVcFW3unpSvqA5Ps9Qsi4q0=s88-c-k-c0x00ffffff-no-rj,Je commence mon ENTRAINEMENT pour les 12 coups de midi ?!,https://www.youtube.com/watch?v=EdFv_wvhKpU,Etoiles,'10/10/2025 16:30,00:22:09,76120,2803,76,Petit Kculture pour me remettre à la culture après,"Etoiles, etoile, kculture, Emilien, 12 coups de midi, culture, quiz",24,https://i.ytimg.com/vi/EdFv_wvhKpU/hqdefault.jpg,,41
https://yt3.ggpht.com/3djzVEm99BYPivZxKHOa2z4_rfoE_bcVCjOmDM10vgp2MGH0lh67Q3Tr4uhckvpHkBMjcXin=s88-c-k-c0x00ffffff-no-rj,La MISÈRE SEXUELLE existe-t-elle vraiment ?,https://www.youtube.com/watch?v=rIWds0Q5PiQ,euuhhh,'07/10/2025 16:01,00:29:24,61687,1715,437,"En stream tous les mardis, jeudis et dimanches dès","react, réact, reactfr, react francais, react français, réct français, euh, euuhhh, roro, un créatif, twitch, stream, live, mascu, argent, entrepreneur, coach, complotiste, new age, société, dev perso, développement personnel, humour, divertissement",24,https://i.ytimg.com/vi/rIWds0Q5PiQ/hqdefault.jpg,,46
https://yt3.ggpht.com/a1Dts5E7rANROZrxzmcqNQ2oeqwsTOB1NA7nrfgsX9FfhbYHSYUM4sDQhLKpfbGvDXSKvcRayg=s88-c-k-c0x00ffffff-no-rj,J'ai ENQUÊTÉ sur le CORTISOL (et les conseils anti-stress),https://www.youtube.com/watch?v=dICASY3rCjc,Sabine,'30/10/2024 17:00,00:26:58,205631,9393,471,Merci encore à Odoo de sponsoriser cette vidéo ! P,,24,https://i.ytimg.com/vi/dICASY3rCjc/hqdefault.jpg,,52
https://yt3.ggpht.com/a1Dts5E7rANROZrxzmcqNQ2oeqwsTOB1NA7nrfgsX9FfhbYHSYUM4sDQhLKpfbGvDXSKvcRayg=s88-c-k-c0x00ffffff-no-rj,J'ai ENQUÊTÉ sur la loi de l'attraction (ft. @MétadeChoc),https://www.youtube.com/watch?v=izEbErTfOpk,Sabine,'10/12/2024 17:00,00:28:52,98635,5568,504,Merci à Ecosia de sponsoriser cette vidéo ! Téléch,,24,https://i.ytimg.com/vi/izEbErTfOpk/hqdefault.jpg,,53
https://yt3.ggpht.com/HP9oIpL42ufzvCEBTLzxAtpZae1rfLzdte8tnlh-Qi0yjIprNPDqHXiR-XvxMe5eyFUC5Fensl0=s88-c-k-c0x00ffffff-no-rj,Ce prompt révèle tout ce que ChatGPT sait sur vous (flippant),https://www.youtube.com/watch?v=HXkT2onNtik,Ludo Salenne,'03/10/2025 16:53,00:22:18,22483,809,80,Il y a 2 types de mémoire sur ChatGPT : la mémoire,"chatgpt mémoire, prompt chatgpt mémoire, chatgpt memory, chatgpt 5, chat gpt, gpt 5, prompt chatgpt, prompt chartgpt 5, prompt gpt 5, tuto chatgpt, formation chatgpt, cours chatgpt, comment utiliser chatgpt, tuto chat gpt, chatgpt français, prompts chatgpt, tutoriel chatgpt, tuto prompt chatgpt, bien utiliser chatgpt, chatgpt demo, chatgpt tuto, tuto chat gpt fr, tuto chat gpt en francais",28,https://i.ytimg.com/vi/HXkT2onNtik/hqdefault.jpg,,56
https://yt3.ggpht.com/T7ul9IiV5Q2bN2XiKY3jlN9_hXNDmdw8nHPcHa6xUk-F06kSVSbtWiDUiP2nG6DLs7GnjXIRLKE=s88-c-k-c0x00ffffff-no-rj,"La Guerre des Labubu, un Tsunami Quantique et des Riches (Épisodes 469 à 478)",https://www.youtube.com/watch?v=73DFphYu0uY,SUSHI NIHILISTE,'03/10/2025 16:00,00:24:04,55551,3342,167,Compilation intégrale de mes vidéos de Septembre 2,,23,https://i.ytimg.com/vi/73DFphYu0uY/hqdefault.jpg,,57
https://yt3.ggpht.com/ytc/AIdro_lRY24xCKT9seH0TYW6LcBbDVcFW3unpSvqA5Ps9Qsi4q0=s88-c-k-c0x00ffffff-no-rj,Un thème de RÊVE au 4 à la suite ! (trop facile ?),https://www.youtube.com/watch?v=P8YsNIIgr7I,Etoiles,'27/09/2025 16:00,00:25:30,44002,1551,18,Encore une petite nuit de la culture de Julien Lep,"Etoiles, Etoile, culture, quiz, nuit de la culture, question pour un champion, samuel etienne, react",24,https://i.ytimg.com/vi/P8YsNIIgr7I/hqdefault.jpg,,68
https://yt3.ggpht.com/ytc/AIdro_lRY24xCKT9seH0TYW6LcBbDVcFW3unpSvqA5Ps9Qsi4q0=s88-c-k-c0x00ffffff-no-rj,Pourquoi personne prend JAMAIS ce thème ??? (au lieu du cinéma...),https://www.youtube.com/watch?v=D4tVlNyDK1Q,Etoiles,'24/09/2025 16:15,00:20:24,43530,1765,16,Petites vacances d'Etoiles cette semaine donc on s,"Etoiles, Etoile, culture, quiz, nuit de la culture, question pour un champion, samuel etienne, react",24,https://i.ytimg.com/vi/D4tVlNyDK1Q/hqdefault.jpg,,77
https://yt3.ggpht.com/3djzVEm99BYPivZxKHOa2z4_rfoE_bcVCjOmDM10vgp2MGH0lh67Q3Tr4uhckvpHkBMjcXin=s88-c-k-c0x00ffffff-no-rj,Test FIABLE pour mesurer son niveau de R*CISME,https://www.youtube.com/watch?v=hFerFs-mFTU,euuhhh,'21/09/2025 16:01,00:27:54,49777,1470,272,"En stream tous les mardis, jeudis et dimanches dès","react, réact, reactfr, react francais, react français, réct français, euh, euuhhh, roro, un créatif, twitch, stream, live, mascu, argent, entrepreneur, coach, complotiste, new age, société, dev perso, développement personnel, humour, divertissement",24,https://i.ytimg.com/vi/hFerFs-mFTU/hqdefault.jpg,,80
https://yt3.ggpht.com/dRDSMjwDVMxp9cCvkFVvt2Ii76AZygzF_MxFgXBxdgg22DJtuPvNg3XfEwyrbf1K5X2_Zd1ileA=s88-c-k-c0x00ffffff-no-rj,Ils font la grève de la faim contre l'IA,https://www.youtube.com/watch?v=KgrQYRFtK7g,Hardisk TV,'20/09/2025 07:30,00:21:57,6760,319,64,"La chaine @defendOFF 
La chaine @BastiUi 
🚀 Abonne","hardisk, live, vod, twitch, best of",24,https://i.ytimg.com/vi/KgrQYRFtK7g/hqdefault.jpg,,83
https://yt3.ggpht.com/ytc/AIdro_lRY24xCKT9seH0TYW6LcBbDVcFW3unpSvqA5Ps9Qsi4q0=s88-c-k-c0x00ffffff-no-rj,J'ai JAMAIS VU ça en 5 ANS de Nuit de la Culture ?! (pour le meilleur et pour le pire),https://www.youtube.com/watch?v=ZeDayPyeoxg,Etoiles,'19/09/2025 16:30,00:24:20,76484,3317,64,Première Nuit de la culture depuis le passage de l,"Etoiles, Etoile, culture, quiz, nuit de la culture, question pour un champion, samuel etienne, react",24,https://i.ytimg.com/vi/ZeDayPyeoxg/hqdefault.jpg,,87
https://yt3.ggpht.com/HFfZisaVh7x0A_ZxfEObPrpAyDPqsuIJD0P4zE23jNL65Pdn58ixh7GsDaJcGw5797VChzybXQ=s88-c-k-c0x00ffffff-no-rj,Aaron Paul Gets Broken Bad While Eating Spicy Wings | Hot Ones,https://www.youtube.com/watch?v=h6jOXV131aQ,First We Feast,'22/05/2025 15:01,00:25:47,4007862,128807,5849,Aaron Paul is a three-time Emmy Award–winning acto,"aaron paul, hot ones, breaking bad, bryan cranston, sean evans, First we feast, fwf, firstwefeast, food, food porn, cook, cooking, chef, recipe, cocktail, bartender, craft beer, spicy food, foodie, burgers, food documentary, spicy, aaron paul price is right, dos hombres, eiza gonzalez",24,https://i.ytimg.com/vi/h6jOXV131aQ/hqdefault.jpg,,98
https://yt3.ggpht.com/HFfZisaVh7x0A_ZxfEObPrpAyDPqsuIJD0P4zE23jNL65Pdn58ixh7GsDaJcGw5797VChzybXQ=s88-c-k-c0x00ffffff-no-rj,Kai Cenat Calls Sean a Liar While Eating Spicy Wings | Hot Ones,https://www.youtube.com/watch?v=aDT5efihCcY,First We Feast,'10/07/2025 15:00,00:23:02,4060289,153186,11743,Kai Cenat is one of the world's biggest streamers—,"kai cenat, kai cenat live, hot ones, kai cenat interview, ishowspeed, sean evans, first we feast, streaming, streamer, First we feast, fwf, firstwefeast, food, food porn, cook, cooking, chef, recipe, cocktail, bartender, craft beer, spicy food, foodie, burgers, food documentary, kai cenat funny, kai cenat livestream",24,https://i.ytimg.com/vi/aDT5efihCcY/hqdefault.jpg,,99
https://yt3.ggpht.com/T7ul9IiV5Q2bN2XiKY3jlN9_hXNDmdw8nHPcHa6xUk-F06kSVSbtWiDUiP2nG6DLs7GnjXIRLKE=s88-c-k-c0x00ffffff-no-rj,"Les Mangas en France, la Valeur des Femmes et des Knacki (Épisodes 246 à 260)",https://www.youtube.com/watch?v=E_XTfKP3hLM,SUSHI NIHILISTE,'15/09/2023 16:00,00:20:21,57869,2203,83,"Compilation intégrale de mes vidéos d'Août 2023 !
",,23,https://i.ytimg.com/vi/E_XTfKP3hLM/hqdefault.jpg,,109
https://yt3.ggpht.com/T7ul9IiV5Q2bN2XiKY3jlN9_hXNDmdw8nHPcHa6xUk-F06kSVSbtWiDUiP2nG6DLs7GnjXIRLKE=s88-c-k-c0x00ffffff-no-rj,"Femme Handi, Macron fait du Dropshipping et un Divorce (Épisodes 289 à 303)",https://www.youtube.com/watch?v=0eXGEzTFTv4,SUSHI NIHILISTE,'15/12/2023 13:00,00:25:04,71401,2690,85,Compilation intégrale de mes vidéos de Novembre 20,,23,https://i.ytimg.com/vi/0eXGEzTFTv4/hqdefault.jpg,,112
https://yt3.ggpht.com/T7ul9IiV5Q2bN2XiKY3jlN9_hXNDmdw8nHPcHa6xUk-F06kSVSbtWiDUiP2nG6DLs7GnjXIRLKE=s88-c-k-c0x00ffffff-no-rj,"Barbie c'est Chaud, Twitter devient 𝕏 et des Communistes (Épisodes 230 à 245)",https://www.youtube.com/watch?v=DZtcnI-eJ4U,SUSHI NIHILISTE,'15/08/2023 08:00,00:21:31,85056,3078,134,Compilation intégrale de mes vidéos de Juillet 202,,23,https://i.ytimg.com/vi/DZtcnI-eJ4U/hqdefault.jpg,,115
https://yt3.ggpht.com/T7ul9IiV5Q2bN2XiKY3jlN9_hXNDmdw8nHPcHa6xUk-F06kSVSbtWiDUiP2nG6DLs7GnjXIRLKE=s88-c-k-c0x00ffffff-no-rj,L'Apocalypse des Bouchons en Plastique Paranormaux (Épisodes 363 à 371),https://www.youtube.com/watch?v=gtKXC1FLN-o,SUSHI NIHILISTE,'15/10/2024 19:04,00:20:42,67729,3037,183,"Compilation intégrale de mes vidéos d'Août 2024 !
",,23,https://i.ytimg.com/vi/gtKXC1FLN-o/hqdefault.jpg,,122
https://yt3.ggpht.com/T7ul9IiV5Q2bN2XiKY3jlN9_hXNDmdw8nHPcHa6xUk-F06kSVSbtWiDUiP2nG6DLs7GnjXIRLKE=s88-c-k-c0x00ffffff-no-rj,Sushi le Mâle Alpha Dissout l'Assemblée et part en Date (Épisodes 353 à 362),https://www.youtube.com/watch?v=ay1zjqvbi10,SUSHI NIHILISTE,'31/07/2024 12:00,00:21:41,68176,2862,114,Compilation intégrale de mes vidéos de Juin 2024 !,,23,https://i.ytimg.com/vi/ay1zjqvbi10/hqdefault.jpg,,123
https://yt3.ggpht.com/ytc/AIdro_lRY24xCKT9seH0TYW6LcBbDVcFW3unpSvqA5Ps9Qsi4q0=s88-c-k-c0x00ffffff-no-rj,Le niveau au Face à Face est EXTRAORDINAIRE ??? (enchainement de 4 points),https://www.youtube.com/watch?v=NQ8m5AU3AIM,Etoiles,'22/08/2025 17:15,00:21:09,60727,2426,34,Encore une Nuit de la Culture qu'on avait en stock,"Etoiles, Etoile, culture, quiz, nuit de la culture, question pour un champion, samuel etienne, react",24,https://i.ytimg.com/vi/NQ8m5AU3AIM/hqdefault.jpg,,131
https://yt3.ggpht.com/3djzVEm99BYPivZxKHOa2z4_rfoE_bcVCjOmDM10vgp2MGH0lh67Q3Tr4uhckvpHkBMjcXin=s88-c-k-c0x00ffffff-no-rj,Ils aiment bien se battre hein ces gens là,https://www.youtube.com/watch?v=Lb5s7nK_56c,euuhhh,'23/07/2025 16:00,00:27:31,71860,1924,622,"Chaine Twitch : https://www.twitch.tv/euuhhh__

Cr",,24,https://i.ytimg.com/vi/Lb5s7nK_56c/hqdefault.jpg,,152
https://yt3.ggpht.com/ytc/AIdro_lRY24xCKT9seH0TYW6LcBbDVcFW3unpSvqA5Ps9Qsi4q0=s88-c-k-c0x00ffffff-no-rj,Le 9 points gagnants était MIEUX avant ?! (en tout cas je préfère),https://www.youtube.com/watch?v=pzScQ8iBlLU,Etoiles,'22/07/2025 16:01,00:21:46,69434,2431,19,On a regardé une émission de 2017 il y a quelques ,"Etoiles, Etoile, culture, quiz, nuit de la culture, question pour un champion, samuel etienne, react",24,https://i.ytimg.com/vi/pzScQ8iBlLU/hqdefault.jpg,,154
https://yt3.ggpht.com/iBKTl0OpZcX2gPky0MGPMmvlstkNQDzlg-lP6Khje4DJx6z9u7EaPq1p3fLyDuscrrLP_GbJNA=s88-c-k-c0x00ffffff-no-rj,La tendance TikTok qui voulait humilier tout un pays,https://www.youtube.com/watch?v=Qcnd5aBkHRU,Cato Minor,'11/04/2025 15:00,00:20:03,466612,25465,1840,Une trend Tik Tok plus intéressante qu’il n’y para,"Bainville, Histoire, France, patriote, histoire de France, Jacques Bainville, FFL",24,https://i.ytimg.com/vi/Qcnd5aBkHRU/hqdefault.jpg,,156
https://yt3.ggpht.com/ytc/AIdro_kcL_PnNz1KEjLIQ7veCTq_0Vv7tktG0oth4M0_NZp8PRw=s88-c-k-c0x00ffffff-no-rj,ON ACCOSTE DES GENS EN VOITURE Feat @theodortytb #2,https://www.youtube.com/watch?v=m5FuEnR00jA,Mastu,'03/07/2021 09:02,00:27:12,14407707,531613,5000,"RENDEZ-VOUS DIMANCHE 4 JUILLET A 18H 
ABONNEZ-VOUS","Mastu, Mastus, Redbox, Humour, Matsu, mastu voiture, voiture mastu, theodort, Theodort mastu, mastu theodort, voiture, on accoste, on accoste des gens, accoste voiture",23,https://i.ytimg.com/vi/m5FuEnR00jA/hqdefault.jpg,,158
https://yt3.ggpht.com/ytc/AIdro_lRY24xCKT9seH0TYW6LcBbDVcFW3unpSvqA5Ps9Qsi4q0=s88-c-k-c0x00ffffff-no-rj,Grim a failli ME BATTRE en Kculture ??? (pas facile les questions),https://www.youtube.com/watch?v=h3iJUz1jPoA,Etoiles,'11/07/2025 16:45,00:21:29,102309,3930,70,"Encore une partie de Kculture avec Hiro, Emilien e","Etoiles, etoile, kculture, kameto, Emilien, 12 coups de midi, grimkujow, culture, quiz, Hiro",24,https://i.ytimg.com/vi/h3iJUz1jPoA/hqdefault.jpg,,159
https://yt3.ggpht.com/ytc/AIdro_lRY24xCKT9seH0TYW6LcBbDVcFW3unpSvqA5Ps9Qsi4q0=s88-c-k-c0x00ffffff-no-rj,Le Ciao Kombucha me permet de battre Emilien ???,https://www.youtube.com/watch?v=cUdc-ob7X-k,Etoiles,'07/07/2025 16:01,00:27:20,143678,6486,69,On a fait un BO3 Kculture avec Emilien il y a quel,"Etoiles, etoile, kculture, kameto, Emilien, 12 coups de midi, culture, quiz, Ciao Kombucha, Squeezie",24,https://i.ytimg.com/vi/cUdc-ob7X-k/hqdefault.jpg,,165
https://yt3.ggpht.com/3djzVEm99BYPivZxKHOa2z4_rfoE_bcVCjOmDM10vgp2MGH0lh67Q3Tr4uhckvpHkBMjcXin=s88-c-k-c0x00ffffff-no-rj,"Qui se souvient de ""DOMINO DAY"" ?!",https://www.youtube.com/watch?v=xx1xOLkp5j8,euuhhh,'01/07/2025 16:01,00:29:26,31199,654,60,"Chaine Twitch : https://www.twitch.tv/euuhhh__

[P",,24,https://i.ytimg.com/vi/xx1xOLkp5j8/hqdefault.jpg,,170
https://yt3.ggpht.com/v2D0WfvIE1yLmfHoUZdn2dwgPiDEqAbeK5ZBXdo-ZfbZ_8db-GO9qp49wp4KtadZdZvpCf8o=s88-c-k-c0x00ffffff-no-rj,Les secrets du succès Air Fryer Ninja | 20 minutes avec le CEO de SharkNinja,https://www.youtube.com/watch?v=QrW6o8ScJis,Romain Lanéry,'29/06/2025 08:00,00:27:52,36976,1927,25,"Aujourd'hui, on passe 20 minutes avec le CEO de Sh","romain lanéry, romain laneri, lanery, laneri, technewstests, technews, shark, ninja, airfryer, airfrier, air, frier, fryer, finance, business, interview, ceo, mark, barocas, barrocas, pdg, 20 minutes, 20 minutes avec",28,https://i.ytimg.com/vi/QrW6o8ScJis/hqdefault.jpg,,172
https://yt3.ggpht.com/3djzVEm99BYPivZxKHOa2z4_rfoE_bcVCjOmDM10vgp2MGH0lh67Q3Tr4uhckvpHkBMjcXin=s88-c-k-c0x00ffffff-no-rj,Un débat très IMPORTANT qui va diviser,https://www.youtube.com/watch?v=jm61Q8hK37w,euuhhh,'04/06/2025 16:01,00:27:31,60900,1544,176,"Chaine Twitch : https://www.twitch.tv/euuhhh__

[P",,24,https://i.ytimg.com/vi/jm61Q8hK37w/hqdefault.jpg,,183
https://yt3.ggpht.com/v2D0WfvIE1yLmfHoUZdn2dwgPiDEqAbeK5ZBXdo-ZfbZ_8db-GO9qp49wp4KtadZdZvpCf8o=s88-c-k-c0x00ffffff-no-rj,"""Tu peux maintenant créer ton entreprise en 10 minutes"" | 20 minutes avec le PDG de LegalPlace",https://www.youtube.com/watch?v=gU6zIelMEj8,Romain Lanéry,'01/06/2025 08:00,00:29:32,56209,1013,22,"Aujourd’hui, on passe 20 minutes avec Racem Flazi,","romain lanéry, romain laneri, lanery, laneri, technewstests, technews, legalplace, legal, place, interview, legaltechs, racem, flazi, flazy, tech, 20 minutes avec, 20 minutes, créer son entreprise, entreprise, entrepreneur, créer, fonder, france, erreurs, astuces, conseils",28,https://i.ytimg.com/vi/gU6zIelMEj8/hqdefault.jpg,,187
https://yt3.ggpht.com/ZsmiOA_7qianJlnzgnv657o6txt_wAC-Vw99yzAqfxjAPW9hojrQs_QMEHYTPR6tR3KJzYlUw2U=s88-c-k-c0x00ffffff-no-rj,On a INFILTRÉ la cuisine d’un hôtel de luxe,https://www.youtube.com/watch?v=fX1pfcbpTks,Maxime Biaggi,'22/05/2025 18:42,00:21:19,480530,24505,547,On a décroché notre premier contrat à Cannes avec ,"vlog, humour, cinéma, cannes, festival de cannes, maxime, maxime biaggi, elian, elian ventre, grim, grimkujow, ben haddad, theorus",24,https://i.ytimg.com/vi/fX1pfcbpTks/hqdefault.jpg,,196
https://yt3.ggpht.com/ytc/AIdro_ladyg5fV6ymBjPWBVtxYT06g8wSVa4-wnvez7kd9T-Ums=s88-c-k-c0x00ffffff-no-rj,Il faut qu’on parle du Vibe Coding.,https://www.youtube.com/watch?v=w9fauYVHldY,Benjamin Code,'14/05/2025 16:21,00:23:34,125036,5063,555,"Testez gratuitement les design Token de Penpot :
h","benjamin code, web developer, developer frontend, frontend, creative developer, aristide benoist, awwwards, learn how to code",27,https://i.ytimg.com/vi/w9fauYVHldY/hqdefault.jpg,,198
https://yt3.ggpht.com/ytc/AIdro_lRY24xCKT9seH0TYW6LcBbDVcFW3unpSvqA5Ps9Qsi4q0=s88-c-k-c0x00ffffff-no-rj,Il y a un VIEWER à chaque Émission ??? - Nuit de la Culture,https://www.youtube.com/watch?v=CJzdM2oNdcM,Etoiles,'12/04/2025 16:00,00:21:29,104094,3931,38,À chaque fois que je fais une nuit de la culture e,"Quiz, Culture, Etoiles, question pour un champion, Nuit de la culture, react, Etoile, Culture Clash",24,https://i.ytimg.com/vi/CJzdM2oNdcM/hqdefault.jpg,,215
https://yt3.ggpht.com/ytc/AIdro_lRY24xCKT9seH0TYW6LcBbDVcFW3unpSvqA5Ps9Qsi4q0=s88-c-k-c0x00ffffff-no-rj,Ah oui c'est pas comme QPUC ! - Nuit de la Culture : Hors-série,https://www.youtube.com/watch?v=IDodx2NR4TM,Etoiles,'07/04/2025 17:00,00:24:06,126481,4520,115,Petite nuit de la culture Hors-série où je regarde,"Quiz, Culture, Etoiles, question pour un champion, Nuit de la culture, react, Etoile, Culture Clash, tout le monde veut prendre sa place",24,https://i.ytimg.com/vi/IDodx2NR4TM/hqdefault.jpg,,217
https://yt3.ggpht.com/3djzVEm99BYPivZxKHOa2z4_rfoE_bcVCjOmDM10vgp2MGH0lh67Q3Tr4uhckvpHkBMjcXin=s88-c-k-c0x00ffffff-no-rj,Naturopathie = REDFLAG ?,https://www.youtube.com/watch?v=auDI548BQWw,euuhhh,'02/04/2025 16:00,00:29:31,58659,1430,317,"Chaine Twitch : https://www.twitch.tv/euuhhh__

[P",,24,https://i.ytimg.com/vi/auDI548BQWw/hqdefault.jpg,,219
https://yt3.ggpht.com/3djzVEm99BYPivZxKHOa2z4_rfoE_bcVCjOmDM10vgp2MGH0lh67Q3Tr4uhckvpHkBMjcXin=s88-c-k-c0x00ffffff-no-rj,Le SECRET pour avoir l'air SYMPA,https://www.youtube.com/watch?v=t7sjgOrPX1Q,euuhhh,'27/03/2025 17:01,00:27:05,39477,908,118,"Chaine Twitch : https://www.twitch.tv/euuhhh__

[P",,24,https://i.ytimg.com/vi/t7sjgOrPX1Q/hqdefault.jpg,,222
https://yt3.ggpht.com/3djzVEm99BYPivZxKHOa2z4_rfoE_bcVCjOmDM10vgp2MGH0lh67Q3Tr4uhckvpHkBMjcXin=s88-c-k-c0x00ffffff-no-rj,C'est bizarre les JUMEAUX non ? (si si),https://www.youtube.com/watch?v=jpljbDssC2U,euuhhh,'25/03/2025 17:00,00:29:02,25449,725,79,"Chaine Twitch : https://www.twitch.tv/euuhhh__

[P",,24,https://i.ytimg.com/vi/jpljbDssC2U/hqdefault.jpg,,224
https://yt3.ggpht.com/v2D0WfvIE1yLmfHoUZdn2dwgPiDEqAbeK5ZBXdo-ZfbZ_8db-GO9qp49wp4KtadZdZvpCf8o=s88-c-k-c0x00ffffff-no-rj,La face cachée du Tamagotchi qui a traumatisé des millions d'enfants...,https://www.youtube.com/watch?v=QSN5xei6SqM,Romain Lanéry,'23/03/2025 09:00,00:28:42,100796,3018,193,Vous vous souvenez de la première fois que votre T,"romain lanéry, romain laneri, lanery, laneri, technewstests, technews, tamagotchi, tamagotchy, tamagotchie, tamagoshi, tamagochi",28,https://i.ytimg.com/vi/QSN5xei6SqM/hqdefault.jpg,,227
https://yt3.ggpht.com/v2D0WfvIE1yLmfHoUZdn2dwgPiDEqAbeK5ZBXdo-ZfbZ_8db-GO9qp49wp4KtadZdZvpCf8o=s88-c-k-c0x00ffffff-no-rj,Steam : les secrets du logiciel qui a tué l'empire du CD-ROM,https://www.youtube.com/watch?v=0OYYSkOrcpc,Romain Lanéry,'23/02/2025 09:00,00:23:12,106960,4585,243,Comment Steam a tué l'empire du CD-ROM en 24 heure,"romain lanéry, gaben, steam, histoire, chronique, CD-ROM, cd, dvd, Gabe Logan Newell, gabe newell, jeu vidéo, jeux, vidéo, doc, documentaire, reportage",28,https://i.ytimg.com/vi/0OYYSkOrcpc/hqdefault.jpg,,231
https://yt3.ggpht.com/ytc/AIdro_lRY24xCKT9seH0TYW6LcBbDVcFW3unpSvqA5Ps9Qsi4q0=s88-c-k-c0x00ffffff-no-rj,Un GRAND CHAMPION aux Masters de 2016 - Nuit de la Culture,https://www.youtube.com/watch?v=Y-MlxOYHHvA,Etoiles,'10/03/2025 17:30,00:20:18,86778,3290,65,Petite vidéo de nuit de la culture qu'on a en stoc,"Quiz, Culture, Etoiles, question pour un champion, Nuit de la culture, react, Etoile, Culture Clash, Super Champion, masters, Khorêm",24,https://i.ytimg.com/vi/Y-MlxOYHHvA/hqdefault.jpg,,238
https://yt3.ggpht.com/3djzVEm99BYPivZxKHOa2z4_rfoE_bcVCjOmDM10vgp2MGH0lh67Q3Tr4uhckvpHkBMjcXin=s88-c-k-c0x00ffffff-no-rj,Les êtres SUPRAMENTAUX = l'évolution de l'humanité,https://www.youtube.com/watch?v=tp6DxQCGN6g,euuhhh,'09/02/2025 17:01,00:28:17,41733,997,117,"Chaine Twitch : https://www.twitch.tv/euuhhh__

[P",,24,https://i.ytimg.com/vi/tp6DxQCGN6g/hqdefault.jpg,,247
https://yt3.ggpht.com/ytc/AIdro_kcL_PnNz1KEjLIQ7veCTq_0Vv7tktG0oth4M0_NZp8PRw=s88-c-k-c0x00ffffff-no-rj,ON ACCOSTE DES GENS EN VOITURE (Avec Joyca),https://www.youtube.com/watch?v=0Q5K9IlTwlE,Mastu,'13/08/2022 09:02,00:28:21,8129268,511669,6524,"Nouvelle vidéo en voiture avec Joyca !

Contact pr","Mastu, Mastus, Redbox, Humour, Matsu, loat, mastu voiture, mastu joyca, joyca mastu, joyca, joyca voiture, mastu accoste, voiture",23,https://i.ytimg.com/vi/0Q5K9IlTwlE/hqdefault.jpg,,249
https://yt3.ggpht.com/3djzVEm99BYPivZxKHOa2z4_rfoE_bcVCjOmDM10vgp2MGH0lh67Q3Tr4uhckvpHkBMjcXin=s88-c-k-c0x00ffffff-no-rj,Je bois mon PIPI en direct LIVE (urinothérapie),https://www.youtube.com/watch?v=lo3rz1qfutA,euuhhh,'28/01/2025 17:00,00:27:25,27988,850,158,"Chaine Twitch : https://www.twitch.tv/euuhhh__

[P",,24,https://i.ytimg.com/vi/lo3rz1qfutA/hqdefault.jpg,,251
https://yt3.ggpht.com/3djzVEm99BYPivZxKHOa2z4_rfoE_bcVCjOmDM10vgp2MGH0lh67Q3Tr4uhckvpHkBMjcXin=s88-c-k-c0x00ffffff-no-rj,Apprenons la PRIÈRE en chantant avec le reuf François,https://www.youtube.com/watch?v=yiYU84zzNto,euuhhh,'21/05/2024 16:00,00:25:07,22575,821,189,Retrouvez toutes les rediffusions complètes des st,,24,https://i.ytimg.com/vi/yiYU84zzNto/hqdefault.jpg,,290
https://yt3.ggpht.com/3djzVEm99BYPivZxKHOa2z4_rfoE_bcVCjOmDM10vgp2MGH0lh67Q3Tr4uhckvpHkBMjcXin=s88-c-k-c0x00ffffff-no-rj,"Si tu HÉRITES, t'es une M*RDE !",https://www.youtube.com/watch?v=Ck6eDLloWZ4,euuhhh,'23/05/2024 16:00,00:27:25,33727,891,149,"Pub ""NORD VPN"" :  profitez dès maintenant de 4 moi",,24,https://i.ytimg.com/vi/Ck6eDLloWZ4/hqdefault.jpg,,291
https://yt3.ggpht.com/3djzVEm99BYPivZxKHOa2z4_rfoE_bcVCjOmDM10vgp2MGH0lh67Q3Tr4uhckvpHkBMjcXin=s88-c-k-c0x00ffffff-no-rj,Ce COACH a soigné ma DÉPRESSION,https://www.youtube.com/watch?v=Ph56H0NEi9I,euuhhh,'30/05/2024 16:00,00:27:37,36335,1057,159,Retrouvez toutes les rediffusions complètes des st,,24,https://i.ytimg.com/vi/Ph56H0NEi9I/hqdefault.jpg,,292
https://yt3.ggpht.com/3djzVEm99BYPivZxKHOa2z4_rfoE_bcVCjOmDM10vgp2MGH0lh67Q3Tr4uhckvpHkBMjcXin=s88-c-k-c0x00ffffff-no-rj,J'ai failli vivre en VAN (c'est réel),https://www.youtube.com/watch?v=eFdawzahyHY,euuhhh,'18/09/2024 16:00,00:23:50,27976,720,66,"Chaine Twitch : https://www.twitch.tv/euuhhh__

[P",,24,https://i.ytimg.com/vi/eFdawzahyHY/hqdefault.jpg,,294
https://yt3.ggpht.com/3djzVEm99BYPivZxKHOa2z4_rfoE_bcVCjOmDM10vgp2MGH0lh67Q3Tr4uhckvpHkBMjcXin=s88-c-k-c0x00ffffff-no-rj,"La ""MORPHOPSYCHOLOGIE"" (en gros c’est R*CISTE)",https://www.youtube.com/watch?v=dn30jOqIK3c,euuhhh,'23/09/2024 16:00,00:25:13,53680,1407,117,"[Pub ""HOLY""] : Profitez de 5 euros de réduction su",,24,https://i.ytimg.com/vi/dn30jOqIK3c/hqdefault.jpg,,295
https://yt3.ggpht.com/3djzVEm99BYPivZxKHOa2z4_rfoE_bcVCjOmDM10vgp2MGH0lh67Q3Tr4uhckvpHkBMjcXin=s88-c-k-c0x00ffffff-no-rj,Pour une FRANCE BIODYNAMIQUE !,https://www.youtube.com/watch?v=n9Z9EZAoNKM,euuhhh,'15/10/2024 16:00,00:22:50,28936,917,189,"Chaine Twitch : https://www.twitch.tv/euuhhh__

[P",,24,https://i.ytimg.com/vi/n9Z9EZAoNKM/hqdefault.jpg,,297
https://yt3.ggpht.com/3djzVEm99BYPivZxKHOa2z4_rfoE_bcVCjOmDM10vgp2MGH0lh67Q3Tr4uhckvpHkBMjcXin=s88-c-k-c0x00ffffff-no-rj,Les BIKERS sont des FLICS ?!,https://www.youtube.com/watch?v=y7nuLE1zSk4,euuhhh,'22/10/2024 16:00,00:23:16,24111,618,128,"Chaine Twitch : https://www.twitch.tv/euuhhh__

[P",,24,https://i.ytimg.com/vi/y7nuLE1zSk4/hqdefault.jpg,,299
