channelAvatar,title,link,channel,publishedAt,duration,views,likes,comments,shortDescription,tags,category,thumbnail,myCategory,playlistPosition
https://yt3.ggpht.com/ytc/AIdro_m8gETDSV_0VHErh636LThB0fJZqNLaBwGDXhm-K7D6RAI=s88-c-k-c0x00ffffff-no-rj,David Castello-Lopes nous raconte la passion du froid qui tourne à l’obsession | 28 minutes | ARTE,https://www.youtube.com/watch?v=YKRnqRc22Lc,28 minutes - ARTE,'17/10/2025 18:45,00:04:36,73957,2298,121,David Castello-Lopes s'intéresse à comment faire d,"Débat, 28 minutes, Arte, Élisabeth quin, actualité, international, Benjamin Sportouch, Le Monde des Choses, David Castello Lopes, froid, frigo, frigidaire, SIFA, salon international du froid et de ses applications",25,https://i.ytimg.com/vi/YKRnqRc22Lc/hqdefault.jpg,,30
https://yt3.ggpht.com/ytc/AIdro_m8gETDSV_0VHErh636LThB0fJZqNLaBwGDXhm-K7D6RAI=s88-c-k-c0x00ffffff-no-rj,David Castello-Lopes s’intéresse à la guerre des camions  | 28 minutes | ARTE,https://www.youtube.com/watch?v=ouUFFh2PzPc,28 minutes - ARTE,'26/09/2025 18:45,00:04:38,141085,3899,270,David Castello-Lopes est fasciné depuis sa plus te,"28 minutes, Arte, actualité, David Castello-Lopes, Camions, Le Mans, Courses, Enfants, Jouets",25,https://i.ytimg.com/vi/ouUFFh2PzPc/hqdefault.jpg,,70
https://yt3.ggpht.com/ytc/AIdro_m8gETDSV_0VHErh636LThB0fJZqNLaBwGDXhm-K7D6RAI=s88-c-k-c0x00ffffff-no-rj,David Castello-Lopes va à la pêche aux silures dans la Seine | 28 minutes | ARTE,https://www.youtube.com/watch?v=xXYhyBb9MNU,28 minutes - ARTE,'19/09/2025 18:45,00:04:32,72556,2116,136,David Castello-Lopes est parti à la pêche aux silu,"Débat, 28 minutes, Arte, Élisabeth quin, actualité, international, David Castello-Lopes, silures, poisson, pêche, Bill François",25,https://i.ytimg.com/vi/xXYhyBb9MNU/hqdefault.jpg,,84
https://yt3.ggpht.com/ytc/AIdro_kjbQEFDiUGUQMyo7ETYP4DZI4piL-3msIXiyhE8V9one8=s88-c-k-c0x00ffffff-no-rj,Slow Horses — Seasons 1-4 Recap | Apple TV,https://www.youtube.com/watch?v=osgVw3T82Gc,Apple TV,'08/09/2025 16:59,00:02:28,47662,698,35,"A compromised agent, a destabilized London, and a ","slow horses, recap, slow horses season recap, trailer, trailers, slow horses trailer, trailer slow horses, official trailer, slow horses official trailer, gary oldman, jack lowden, kristin scott thomas, chris reilly, saskia reeves, rosalind eleazar, christopher chung, hugo weaving, joanna scanlan, ruth bradley, jackson lamb, spy, spies, agent, mi5, british intelligence, series, show, apple tv, apple, tv, apple tv+, apple tv plus, apple tv app, apple original, thriller, comedy",24,https://i.ytimg.com/vi/osgVw3T82Gc/hqdefault.jpg,,104
https://yt3.ggpht.com/Xh9JEQHtgriFgfP4zJ7u63tyeN1b9QUAEl_m05PKEbbkyE7JG-1lM_dW4_AV_SuXuM4Do_fKHg=s88-c-k-c0x00ffffff-no-rj,Kemar - Libre ,https://www.youtube.com/watch?v=0o1pBRmfrKY,Kemar,'07/09/2025 14:46,00:04:19,55631,4132,347,"1 instant : 2 vies


Réalisé par Benjamin Sibioude",,23,https://i.ytimg.com/vi/0o1pBRmfrKY/hqdefault.jpg,,106
https://yt3.ggpht.com/X6kguruUc4JHySApVt9fRva4Wl8TV7KTmJPBKAUW6HEe576TwB39x3aJVC4tRZlCPQfgPXerTw=s88-c-k-c0x00ffffff-no-rj,The Network Effects of Uber: Under the Hood,https://www.youtube.com/watch?v=yEminPU_7cc,NFX,'20/12/2017 19:02,00:02:58,43519,621,7,To learn how to use the Network Effects Map for yo,"network effects, nfx, nfx guild, uber, case study, investors, investments, venture capital, funds, invest, marketplace, marketplace network effect, network effects map, map, nfx case study, san francisco, sf, silicon valley, tech, startup, strategy, success, magic, houdini",22,https://i.ytimg.com/vi/yEminPU_7cc/hqdefault.jpg,,121
https://yt3.ggpht.com/6Nro_o284NE8owgOZaNzChPdijwrVjQS93Bwp3ESccRTWofPcthJ3OZc4plxirmQvTFhjBO2iA=s88-c-k-c0x00ffffff-no-rj,Franjo : Entre Deux Escabeaux,https://www.youtube.com/watch?v=U9Eyd6PjKHk,billet réduc,'23/11/2024 13:40,00:03:45,7366,309,12,Merci à Franjo d’avoir eu la patience de discuter ,,22,https://i.ytimg.com/vi/U9Eyd6PjKHk/hqdefault.jpg,,135
https://yt3.ggpht.com/lBn7AF8kxnU7qijRluhSxlQuXCOPhVj__ialrcOH1IZMUpZ1AmuHhLadbl2HFGNOAgFjMzNGEw=s88-c-k-c0x00ffffff-no-rj,FLIPPÉ SAISON 2 #20 - L'OEIL DU CYCLONE,https://www.youtube.com/watch?v=xeofm-7xMUA,Studio Bagel,'30/07/2025 15:30,00:02:57,55759,2688,97,Après une discussion délicate qu'il a eue avec Aur,"studio bagel, studio, bagel, humour, comedie, drole, marrant, sketch, parodie, podcast",23,https://i.ytimg.com/vi/xeofm-7xMUA/hqdefault.jpg,,144
https://yt3.ggpht.com/XoPSuGDxwgLvhCATWsvXHbVJ3oN6KvK00k9Pc0IJm8vQcSbE1KVAQMGk8_d3Pfu6QOJHHoBSMn0=s88-c-k-c0x00ffffff-no-rj,"Skynet, l'inintelligence artificielle | Tu mourras moins bête avec ARTE",https://www.youtube.com/watch?v=9wfR4ApamN0,Tu mourras moins bête - ARTE,'28/07/2025 15:00,00:03:32,74494,4116,85,"Un robot peut-il remonter le temps ? 

Si les robo","ARTE, Série fiction, TV, tmmb, tu mourras moins bête, science, scientifique, saison 4, professeur moustache, Nathanaël, animation, humour, drôle, humouristique, apprentissage, saison, question, robot, ordinateur, terminator, Skynet, IA, intelligence artificielle, futur",1,https://i.ytimg.com/vi/9wfR4ApamN0/hqdefault.jpg,,147
https://yt3.ggpht.com/lBn7AF8kxnU7qijRluhSxlQuXCOPhVj__ialrcOH1IZMUpZ1AmuHhLadbl2HFGNOAgFjMzNGEw=s88-c-k-c0x00ffffff-no-rj,FLIPPÉ SAISON 2 #19 - LE JEU DES VÉRITÉS,https://www.youtube.com/watch?v=HGXnrBKdXF0,Studio Bagel,'23/07/2025 15:30,00:02:38,47701,3272,85,Théo et Auriane jouent à un jeu qui n'appartient q,"studio bagel, studio, bagel, humour, comedie, drole, marrant, sketch, parodie, podcast",23,https://i.ytimg.com/vi/HGXnrBKdXF0/hqdefault.jpg,,151
https://yt3.ggpht.com/ytc/AIdro_l-3C1Ty2tIjUA-nERqLsPVbIlUJitbqM7VWXaS7kDBNA=s88-c-k-c0x00ffffff-no-rj,CHICS TYPES EP.3 - Le mec parfait,https://www.youtube.com/watch?v=SWLbkiKFDs0,Yes vous aime,'04/07/2025 16:00,00:02:52,172439,9926,205,"CHICS TYPES Ep.3 : le mec parfait 🤖🦾🤵🏻‍♂️

Coucou ",,23,https://i.ytimg.com/vi/SWLbkiKFDs0/hqdefault.jpg,,167
https://yt3.ggpht.com/ytc/AIdro_m8gETDSV_0VHErh636LThB0fJZqNLaBwGDXhm-K7D6RAI=s88-c-k-c0x00ffffff-no-rj,Intéressant : pourquoi y a-t-il des pièces de 10 000 euros ? | 28 minutes | ARTE,https://www.youtube.com/watch?v=ygUlgNin1Qg,28 minutes - ARTE,'29/06/2025 10:01,00:02:38,100743,3206,206,"Vous connaissez les pièces de 5 centimes, de 10 ce","ARTE, Magazine, TV, Le club international, 28 minutes, intéressant, david castello-lopes, monnaie de paris, pièces",25,https://i.ytimg.com/vi/ygUlgNin1Qg/hqdefault.jpg,,173
https://yt3.ggpht.com/ytc/AIdro_m8gETDSV_0VHErh636LThB0fJZqNLaBwGDXhm-K7D6RAI=s88-c-k-c0x00ffffff-no-rj,Intéressant : pourquoi les chansons sont-elles de plus en plus courtes ? | 28 minutes | ARTE,https://www.youtube.com/watch?v=nDNJ_eq0rUI,28 minutes - ARTE,'22/06/2025 10:01,00:02:44,79166,2797,216,Si l’on écoute quelques-uns des succès musicaux mo,"ARTE, Magazine, TV, Le club international, 28 minutes, intéressant, david castello-lopes, chansons courtes, analyse, succès, charts",25,https://i.ytimg.com/vi/nDNJ_eq0rUI/hqdefault.jpg,,176
https://yt3.ggpht.com/ytc/AIdro_l-3C1Ty2tIjUA-nERqLsPVbIlUJitbqM7VWXaS7kDBNA=s88-c-k-c0x00ffffff-no-rj,CHICS TYPES - Ep.1 Le mâle alpha,https://www.youtube.com/watch?v=x2XLCUZe8-g,Yes vous aime,'20/06/2025 16:01,00:03:58,248358,20466,1051,"CHICS TYPES Ep.1 : le mâle alpha 💪 

Coucou les am",,23,https://i.ytimg.com/vi/x2XLCUZe8-g/hqdefault.jpg,,177
https://yt3.ggpht.com/ytc/AIdro_m8gETDSV_0VHErh636LThB0fJZqNLaBwGDXhm-K7D6RAI=s88-c-k-c0x00ffffff-no-rj,Intéressant : comment les koalas ont-ils survécu ? | 28 minutes | ARTE,https://www.youtube.com/watch?v=asFI4TrUtVk,28 minutes - ARTE,'15/06/2025 10:00,00:02:27,81365,3313,130,Le koala est un animal chelou et qui a l’air un pe,"ARTE, Magazine, TV, Le club international, 28 minutes, intéressant, david castello-lopes, koalas, survie, espèce, nature",25,https://i.ytimg.com/vi/asFI4TrUtVk/hqdefault.jpg,,178
https://yt3.ggpht.com/ytc/AIdro_m8gETDSV_0VHErh636LThB0fJZqNLaBwGDXhm-K7D6RAI=s88-c-k-c0x00ffffff-no-rj,Intéressant : Pourquoi le Manneken-Pis fait-il pipi ? | 28 minutes | ARTE,https://www.youtube.com/watch?v=LARpos3fLeo,28 minutes - ARTE,'08/06/2025 10:00,00:02:11,95489,2790,179,"Parmi toutes les statues belges, le Manneken-Pis s","Débat, 28 minutes, Arte, Élisabeth quin, actualité, international, Benjamin Sportouch, Le club international, intéressant, david castello-lopes, statue, Belgique, Bruxelles, Manneken Pis, enfant, monument national, culture, Pourquoi le Manneken-Pis fait-il pipi ?",25,https://i.ytimg.com/vi/LARpos3fLeo/hqdefault.jpg,,180
https://yt3.ggpht.com/ytc/AIdro_m8gETDSV_0VHErh636LThB0fJZqNLaBwGDXhm-K7D6RAI=s88-c-k-c0x00ffffff-no-rj,Intéressant : comment lutter contre les feux de forêt ? | 28 minutes | ARTE,https://www.youtube.com/watch?v=PGA1q5woJHw,28 minutes - ARTE,'25/05/2025 10:00,00:01:56,43982,1920,50,Et si on était capable de détecter les feux de for,"Débat, 28 minutes, Arte, Élisabeth quin, actualité, international, Le club international, intéressant, david castello-lopes, feux de forêt, incendies, détecteurs de fumée, Dryad Networks, pompiers, Renaud Dély",25,https://i.ytimg.com/vi/PGA1q5woJHw/hqdefault.jpg,,192
https://yt3.ggpht.com/ytc/AIdro_m8gETDSV_0VHErh636LThB0fJZqNLaBwGDXhm-K7D6RAI=s88-c-k-c0x00ffffff-no-rj,Intéressant : Que faire si vous tombez dans l’eau avec votre voiture ? | 28 minutes | ARTE,https://www.youtube.com/watch?v=FqXRgVMD5vQ,28 minutes - ARTE,'11/05/2025 10:00,00:02:40,247073,9007,415,"Chaque année, des milliers de voitures tombent dan","ARTE, Magazine, TV, Le club international, 28 minutes, intéressant, david castello-lopes, accident de voiture, eau, submersion, décès, sécurité routière, conseil, survie, noyade",25,https://i.ytimg.com/vi/FqXRgVMD5vQ/hqdefault.jpg,,199
https://yt3.ggpht.com/EJS0EQk3qmAOgwvbW_tQt2ZzSzV4jnBWj7x4V2oQtLbWKfzDE60iKjL2h4J4dke9kIYRodaDpw=s88-c-k-c0x00ffffff-no-rj,Bande-annonce 2 de Grand Theft Auto VI,https://www.youtube.com/watch?v=XAFwsIfSf5k,Rockstar Games France,'06/05/2025 14:27,00:02:47,487224,16821,1121,"Vice City, États-Unis.

Jason et Lucia ont toujour",,20,https://i.ytimg.com/vi/XAFwsIfSf5k/hqdefault.jpg,,205
https://yt3.ggpht.com/ytc/AIdro_m8gETDSV_0VHErh636LThB0fJZqNLaBwGDXhm-K7D6RAI=s88-c-k-c0x00ffffff-no-rj,Intéressant : Pourquoi utilise-t-on encore de vieilles bandes magnétiques ? | 28 minutes | ARTE,https://www.youtube.com/watch?v=lDLKp3uUg0k,28 minutes - ARTE,'04/05/2025 10:00,00:02:29,109802,4827,213,"Il y avait le plaisir de les rembobiner à la main,","ARTE, Magazine, TV, Le club international, 28 minutes, intéressant, david castello-lopes, bande magnétique, données, Google, stockage, piratage, data, Netflix, plateformes de streaming",25,https://i.ytimg.com/vi/lDLKp3uUg0k/hqdefault.jpg,,208
https://yt3.ggpht.com/ytc/AIdro_m8gETDSV_0VHErh636LThB0fJZqNLaBwGDXhm-K7D6RAI=s88-c-k-c0x00ffffff-no-rj,Intéressant : D’où viennent les ours en peluche ? | 28 minutes | ARTE,https://www.youtube.com/watch?v=bosj7h4pJtE,28 minutes - ARTE,'06/04/2025 10:00,00:02:33,69047,2943,43,L’ours est l’un des animaux les plus puissants de ,"ARTE, Magazine, TV, Le club international, 28 minutes, intéressant, david castello-lopes, ours en peluche, ours, enfance",25,https://i.ytimg.com/vi/bosj7h4pJtE/hqdefault.jpg,,218
https://yt3.ggpht.com/ytc/AIdro_m8gETDSV_0VHErh636LThB0fJZqNLaBwGDXhm-K7D6RAI=s88-c-k-c0x00ffffff-no-rj,Intéressant : Peut-on transmettre des saveurs par Internet ? | 28 minutes | ARTE,https://www.youtube.com/watch?v=-XrvmjvUKzg,28 minutes - ARTE,'30/03/2025 10:00,00:02:37,47594,1886,48,"PAF, vous prenez un selfie, vous l’envoyez et vos ","ARTE, Magazine, TV, Le club international, 28 minutes, intéressant, david castello-lopes, saveurs, internet, envoi, transmission, technologie, comment envoyer des saveurs ?, goût",25,https://i.ytimg.com/vi/-XrvmjvUKzg/hqdefault.jpg,,221
https://yt3.ggpht.com/ytc/AIdro_m8gETDSV_0VHErh636LThB0fJZqNLaBwGDXhm-K7D6RAI=s88-c-k-c0x00ffffff-no-rj,Intéressant : À qui appartient l’épave la plus précieuse du monde ? | 28 minutes | ARTE,https://www.youtube.com/watch?v=MZO31OzlmQ0,28 minutes - ARTE,'16/03/2025 11:00,00:02:38,81625,2800,153,"Le 8 juin 1708, au large de Carthagène, le navire ","ARTE, Magazine, TV, Le club international, 28 minutes, intéressant, david castello-lopes, trésor, épave, San José, Histoire, chasse au trésor, Royaume-uni, Espagne, Colonisation, Carthagène, Amérique",25,https://i.ytimg.com/vi/MZO31OzlmQ0/hqdefault.jpg,,235
https://yt3.ggpht.com/ytc/AIdro_m8gETDSV_0VHErh636LThB0fJZqNLaBwGDXhm-K7D6RAI=s88-c-k-c0x00ffffff-no-rj,Intéressant : Pourquoi cette chaise est-elle partout ? | 28 minutes | ARTE,https://www.youtube.com/watch?v=-5jOtZY-aoE,28 minutes - ARTE,'02/03/2025 11:00,00:01:58,115242,3485,80,La chaise en polyester blanche est partout : en Ma,"Débat, 28 minutes, Arte, Élisabeth quin, actualité, international, Benjamin Sportouch, Le club international, intéressant, symbole, chaise, polyester, blanche, monde moderne, David Castello-Lopes",25,https://i.ytimg.com/vi/-5jOtZY-aoE/hqdefault.jpg,,242
https://yt3.ggpht.com/UxP2Qij38E73jP88W61YtpQNNCz43Snn6EYblIGK5rCgweI2TRyXdzJgexuDYdFVXhljJaRQ_hk=s88-c-k-c0x00ffffff-no-rj,3 épreuves cachées à déjouer pour réussir votre entretien d’embauche,https://www.youtube.com/watch?v=b-jJ1wSmt78,Welcome to the Jungle Media,'27/02/2025 18:17,00:02:03,9933,117,15,"Prêt.e pour votre prochain entretien d'embauche ?
","entretien d'embauche, bien préparer un entretien, préparer un entretien d'embauche, cv, recrutement, recherche d'emploi, chercher un job, chercher un travail, conseils entretien, conseil entretien d'embauche, changer d'emploi, changer de travail, changer de job",22,https://i.ytimg.com/vi/b-jJ1wSmt78/hqdefault.jpg,,244
https://yt3.ggpht.com/nzEa1ZH5mjxIVLo0jo0zrTQpXalXGV4aOhYTYVXkWdhaImvmDMnNGJqitLGf42hEWoEpfX-WCTM=s88-c-k-c0x00ffffff-no-rj,SALE TCHOIN (Meilleure Réalisation 48HFP Paris 2021),https://www.youtube.com/watch?v=caOVov1k3PM,Thomas Combret,'09/01/2022 16:01,00:04:56,36368,4250,210,"Ce court métrage a été fait de A à Z en 48 heures,","thomas, combret, mammouth, cornichon, humour, sketch, courts, métrages, court, metrage, drole, drôle, parodie, badnews, culture z, les acteurs, les actrices, 48, 48h",23,https://i.ytimg.com/vi/caOVov1k3PM/hqdefault.jpg,,255
https://yt3.ggpht.com/UxP2Qij38E73jP88W61YtpQNNCz43Snn6EYblIGK5rCgweI2TRyXdzJgexuDYdFVXhljJaRQ_hk=s88-c-k-c0x00ffffff-no-rj,Entretien d'embauche : comment persuader (et non convaincre) un recruteur ?,https://www.youtube.com/watch?v=m8ZHppo8rsc,Welcome to the Jungle Media,'26/01/2025 18:48,00:03:41,46631,1107,9,Vous avez un entretien d’embauche à venir ? Pas de,"entretien dembauche, conseil entretien dembauche, convaincre en entretien dembauche, préparer un entretien d'embauche, astuces entretien d'embauche, recherche d'emploi, conseils recherche d'emploi, trouver un travail, bien préparer un entretien, bien préparer un entretien d'embauche",22,https://i.ytimg.com/vi/m8ZHppo8rsc/hqdefault.jpg,,261
https://yt3.ggpht.com/ytc/AIdro_m8gETDSV_0VHErh636LThB0fJZqNLaBwGDXhm-K7D6RAI=s88-c-k-c0x00ffffff-no-rj,Intéressant : Pourquoi n’y a-t-il toujours pas de jetpacks ? | 28 minutes | ARTE,https://www.youtube.com/watch?v=PeomowW5za4,28 minutes - ARTE,'19/01/2025 11:00,00:02:37,136574,4659,160,Le jetpack devait être le futur. James Bond en a u,"ARTE, Magazine, TV, Le club international, 28 minutes, jetpack, transports, intéressant, david castello-lopes, Intéressant 28 minutes, mer, James Bond, Michael Jackson",25,https://i.ytimg.com/vi/PeomowW5za4/hqdefault.jpg,,266
https://yt3.ggpht.com/m0_qOEKcW-_BFf6_UN0TR3Jhxob-VXldFC9VKDCMQyx5JJ_uiHENTa5Kef3CyTHVK0QEUdMqSw=s88-c-k-c0x00ffffff-no-rj,How to Never Run Out of Things To Say...,https://www.youtube.com/watch?v=e72WoGOhghE,brinyheart.,'02/09/2024 13:00,00:04:38,4733520,281534,3232,➳ Make Conversation Out of Thin Air in 7 Day: http,"charisma, rizz, dating, listening, communication, how to, magnetic, make friends, become more charismatic, people skills, skills, social skills, job, psychology, therapy",27,https://i.ytimg.com/vi/e72WoGOhghE/hqdefault.jpg,,339
https://yt3.ggpht.com/YOY2CmBga44F7Mja5HmH0exD6JTwAiETthp3OOrR9KgM4tsb04KzGroSw8cQ0Y30GL0uT85BCg=s88-c-k-c0x00ffffff-no-rj,Test MacBook Pro (M5) - Tout pour la puissance !,https://www.youtube.com/watch?v=heiuHGMh9dg,TheiCollection,'26/10/2025 16:43,00:08:16,4379,822,62,"Le nouveau MacBook Pro M5 est arrivé, que vaut-il ","MacBook Pro, MacBook Pro M5, MacBook Pro M5 Pro, MacBook Pro M5 Max, M5, Apple M5, Test MacBook Pro M5, Avis MacBook Pro M5, Comparatif Mac, Quel Mac choisir 2025, MacBook Pro 2025, Mac M5, Apple Mac M5, Apple Mac, Mac M5 Apple, TheiCollection, Tech, HighTech, Technologie, JB, Jojol, Gentil, Garçon",28,https://i.ytimg.com/vi/heiuHGMh9dg/hqdefault.jpg,,2
https://yt3.ggpht.com/eNsmIF7eK_Ubl5Br-yUyp8_SiS8IwsqsehUisYOude4uz6wbRHsm4qVwOWi9bvlI48JOtihU=s88-c-k-c0x00ffffff-no-rj,"MAXIME BIAGGI STREAM sur la MAUVAISE CHAINE, HORTY la BOOMEUSE - La Crème de Twitch #420",https://www.youtube.com/watch?v=WANKGIyATE4,La Crème de Twitch,'26/10/2025 12:00,00:08:42,8662,320,34,"⚡Discord: https://discord.com/invite/H3wTVg56Cc
⚡T","TwitchFR, Twitch, BestofTwitch",22,https://i.ytimg.com/vi/WANKGIyATE4/hqdefault.jpg,,6
https://yt3.ggpht.com/TlZNxPHmJD4I9Y60jliQ_JmCbxsHjB6qfetd5ZVsQXHP-X9Rirl-tAq9RraJSiFl98c3bE24=s88-c-k-c0x00ffffff-no-rj,Tu crois que t’as rien à cacher sur Internet ?,https://www.youtube.com/watch?v=-h0QuyVG_-c,Dis Cyril,'31/08/2025 15:30,00:08:32,90480,8445,450,"Si vous êtes intéressés par CyberGhost VPN, bénéfi",,28,https://i.ytimg.com/vi/-h0QuyVG_-c/hqdefault.jpg,,11
https://yt3.ggpht.com/TlZNxPHmJD4I9Y60jliQ_JmCbxsHjB6qfetd5ZVsQXHP-X9Rirl-tAq9RraJSiFl98c3bE24=s88-c-k-c0x00ffffff-no-rj,"UberXXX : Le s*xe, en livraison.",https://www.youtube.com/watch?v=ZnSmpl5yUSI,Dis Cyril,'24/03/2025 16:28,00:09:57,199960,16653,1029,Et si le s*xe devenait un simple service de livrai,,28,https://i.ytimg.com/vi/ZnSmpl5yUSI/hqdefault.jpg,,12
https://yt3.ggpht.com/eNsmIF7eK_Ubl5Br-yUyp8_SiS8IwsqsehUisYOude4uz6wbRHsm4qVwOWi9bvlI48JOtihU=s88-c-k-c0x00ffffff-no-rj,"DOMINGO & JIRAYA en ENFER, MASTU LANCE son LIVE HARDCORE - La Crème de Twitch #419",https://www.youtube.com/watch?v=ZRxSRp7Lv_s,La Crème de Twitch,'25/10/2025 11:01,00:08:41,15820,396,19,"⚡Discord: https://discord.com/invite/H3wTVg56Cc
⚡T","TwitchFR, Twitch, BestofTwitch",22,https://i.ytimg.com/vi/ZRxSRp7Lv_s/hqdefault.jpg,,13
https://yt3.ggpht.com/YOY2CmBga44F7Mja5HmH0exD6JTwAiETthp3OOrR9KgM4tsb04KzGroSw8cQ0Y30GL0uT85BCg=s88-c-k-c0x00ffffff-no-rj,Test iPad Pro (M5) - Bien plus qu'un iPad !,https://www.youtube.com/watch?v=TQEjPLkiYKs,TheiCollection,'22/10/2025 18:20,00:08:22,69859,3327,177,"Le nouvel iPad Pro M5 est arrivé, on fait le point","iPad Pro, iPad Pro M5, iPad Pro 2025, iPad M5, iPad Pro M4, iPad Pro VS Mac, iPad VS Mac, iPadOS 26, Test iPadOS 26, Avis iPadOS 26, iPadOS 26 Français, Apple, TheiCollection, Tech, Technologie, JB, Jojol, Gentil, Garçon, iPad Air",28,https://i.ytimg.com/vi/TQEjPLkiYKs/hqdefault.jpg,,19
https://yt3.ggpht.com/c--lELNYgWqiCWmZsdNwHVn7vj0IecE6RM_MLEnFopPnfMuE4MO0OCPyTD12cNmEvgeKdDJVew=s88-c-k-c0x00ffffff-no-rj,UN VIEWER À LA DEMANDE TRÈS PARTICULIÈRE ! (Le Rewind avec Donald Reignoux),https://www.youtube.com/watch?v=iyuzQcHIiA8,Popcorn,'22/10/2025 13:09,00:08:56,164255,7509,127,Donald vient reprendre du service ! Le meilleur du,,24,https://i.ytimg.com/vi/iyuzQcHIiA8/hqdefault.jpg,,20
https://yt3.ggpht.com/eNsmIF7eK_Ubl5Br-yUyp8_SiS8IwsqsehUisYOude4uz6wbRHsm4qVwOWi9bvlI48JOtihU=s88-c-k-c0x00ffffff-no-rj,"MISTER MV se FAIT POUCAVE, SAKOR HALLUCINE des LOCAUX GENTLE MATES - La Crème de Twitch #416",https://www.youtube.com/watch?v=cMZln9wD8Xw,La Crème de Twitch,'22/10/2025 11:01,00:09:12,19863,505,44,"⚡Discord: https://discord.com/invite/H3wTVg56Cc
⚡T","TwitchFR, Twitch, BestofTwitch",22,https://i.ytimg.com/vi/cMZln9wD8Xw/hqdefault.jpg,,21
https://yt3.ggpht.com/NrKSNekPuOgFc9RWLknI-FcJQNngJ3KDSLpr81AwMZ9Zct7LKSl4He4LrN7oDXr1BGvO3s6TQjU=s88-c-k-c0x00ffffff-no-rj,Les erreurs du nouveau player de YouTube,https://www.youtube.com/watch?v=oJjXmXfD1kw,Basti Sans MS,'22/10/2025 08:30,00:09:20,32210,3682,212,"YouTube change de player, d'icônes et de couleurs ","ui, ux, design, web, twitch, youtube, clip, figma, logo, basti, bastiui, redesign, actu, tech, branding, ia, ai",28,https://i.ytimg.com/vi/oJjXmXfD1kw/hqdefault.jpg,,22
https://yt3.ggpht.com/eNsmIF7eK_Ubl5Br-yUyp8_SiS8IwsqsehUisYOude4uz6wbRHsm4qVwOWi9bvlI48JOtihU=s88-c-k-c0x00ffffff-no-rj,"SAMUEL ETIENNE DEFEND HELYDIA, KAMETO PARLE de son FUTUR - La Crème de Twitch #414",https://www.youtube.com/watch?v=s6Lkeoy9tKo,La Crème de Twitch,'20/10/2025 11:01,00:09:34,27998,623,194,"⚡Discord: https://discord.com/invite/H3wTVg56Cc
⚡T","TwitchFR, Twitch, BestofTwitch",22,https://i.ytimg.com/vi/s6Lkeoy9tKo/hqdefault.jpg,,26
https://yt3.ggpht.com/c--lELNYgWqiCWmZsdNwHVn7vj0IecE6RM_MLEnFopPnfMuE4MO0OCPyTD12cNmEvgeKdDJVew=s88-c-k-c0x00ffffff-no-rj,IL TROUVE SA COPIE CONFORME !🪞(Rewind),https://www.youtube.com/watch?v=3GiLDRe7v1w,Popcorn,'14/10/2025 20:30,00:06:40,131802,5606,73,Le meilleur du meilleur de ce qui s'est passé cett,,24,https://i.ytimg.com/vi/3GiLDRe7v1w/hqdefault.jpg,,35
https://yt3.ggpht.com/eNsmIF7eK_Ubl5Br-yUyp8_SiS8IwsqsehUisYOude4uz6wbRHsm4qVwOWi9bvlI48JOtihU=s88-c-k-c0x00ffffff-no-rj,"DOMINGO DARONNED chez WEBEDIA, KAMETO REVIENT sur la FIN de GAME ONE - La Crème de Twitch #404",https://www.youtube.com/watch?v=lehg8LeFjBA,La Crème de Twitch,'10/10/2025 11:01,00:08:25,26062,584,61,"⚡Discord: https://discord.com/invite/H3wTVg56Cc
⚡T","TwitchFR, Twitch, BestofTwitch",22,https://i.ytimg.com/vi/lehg8LeFjBA/hqdefault.jpg,,43
https://yt3.ggpht.com/PEwQfVuhh5jO7_NDDufCq349q0W6MgZeYlgeMyW3OSRMxMx9W5yre5Fgbi4Bql56L1cPwoteOA=s88-c-k-c0x00ffffff-no-rj,Google Pixel Pro Fold Review: Not Compatible!,https://www.youtube.com/watch?v=Tl8RS0sR-qA,Marques Brownlee,'08/10/2025 17:00,00:08:11,4417359,66217,2891,"I love using this phone, but also Pixel and foldab","Pixel Pro Fold, Pixel Fold, Pixel 10 Pro Fold, MKBHD, Pixel Fold review, Pixel Fold vs",28,https://i.ytimg.com/vi/Tl8RS0sR-qA/hqdefault.jpg,,45
https://yt3.ggpht.com/s5hlNKKDDQWjFGzYNnh8UeOW2j2w6id-cZGx7GdAA3d5Fu7zEi7ZMXEyslysuQUKigXNxtAB=s88-c-k-c0x00ffffff-no-rj,The Underdogs: BSOD (Blue Screen of Death) | Apple at Work,https://www.youtube.com/watch?v=6K4eUO53-UE,Apple,'07/10/2025 12:00,00:08:15,29871342,25323,0,The Underdogs are ready for their first-ever trade,"Mac, Mac mini, MacBook Pro, MacBook Air, Studio Display, iPhone, iPad, Apple Watch, AirPods Pro, Gatekeeper, XProtect, FileVault, Secure Enclave, end-to-end encryption, Touch ID, Keynote, AirDrop, Mail, Messages, emoji, Memoji, Genmoj, stickers, text effects, FaceTime, double tap, Safari, Maps, Find My, Apple Music, Apple TV+, Wallet, Auto Unlock, Screen Mirroring, Priority Notifications, Dynamic Island, Smart Reply, Siri, iCal, Excel",28,https://i.ytimg.com/vi/6K4eUO53-UE/hqdefault.jpg,,47
https://yt3.ggpht.com/ytc/AIdro_m8gETDSV_0VHErh636LThB0fJZqNLaBwGDXhm-K7D6RAI=s88-c-k-c0x00ffffff-no-rj,"David Castello-Lopes nous emmène à Modène, découvrir le vinaigre balsamique | 28 minutes | ARTE",https://www.youtube.com/watch?v=1lwj3flgukw,28 minutes - ARTE,'03/10/2025 18:45,00:05:03,148267,3880,133,David Castello-Lopes adore le vinaigre balsamique.,"Débat, 28 minutes, Arte, Élisabeth quin, actualité, international, Benjamin Sportouch, David Castello-Lopes, Modène, Balsamique, Vinaigre, Italie, Le Monde des choses",25,https://i.ytimg.com/vi/1lwj3flgukw/hqdefault.jpg,,55
https://yt3.ggpht.com/IBgiJOen7sXZxskS-BNsDVr_T5WLHSD4-jsvPRtmb_g1BkMSigXjv0uQyySxiF3Sq0BDriJfjcc=s88-c-k-c0x00ffffff-no-rj,iOS 26.0.1 Released - What's New?,https://www.youtube.com/watch?v=8DzDRP81Mgo,Brandon Butch,'29/09/2025 23:15,00:08:18,190115,4444,528,iOS 26.0.1 Released - What's New? | iOS 26.0.1 Fea,"Brandon butch, iphone, ios, apple, iOS 17, iPhone 15, iPhone 16, iOS 18",28,https://i.ytimg.com/vi/8DzDRP81Mgo/hqdefault.jpg,,62
https://yt3.ggpht.com/eNsmIF7eK_Ubl5Br-yUyp8_SiS8IwsqsehUisYOude4uz6wbRHsm4qVwOWi9bvlI48JOtihU=s88-c-k-c0x00ffffff-no-rj,"L'ÉNORME CHANCE de NICO, MICHOU RACONTE son AGRESSION - La Crème de Twitch #394",https://www.youtube.com/watch?v=ZJBkrRgCxOE,La Crème de Twitch,'28/09/2025 11:01,00:08:57,22570,501,17,"⚡Discord: https://discord.com/invite/H3wTVg56Cc
⚡T","TwitchFR, Twitch, BestofTwitch",22,https://i.ytimg.com/vi/ZJBkrRgCxOE/hqdefault.jpg,,65
https://yt3.ggpht.com/YOY2CmBga44F7Mja5HmH0exD6JTwAiETthp3OOrR9KgM4tsb04KzGroSw8cQ0Y30GL0uT85BCg=s88-c-k-c0x00ffffff-no-rj,Test Apple Watch Ultra 3 - Encore plus Ultra !,https://www.youtube.com/watch?v=LtE5EWTxYNM,TheiCollection,'27/09/2025 14:58,00:08:11,84943,2732,184,Voici mon retour d''expérience sur l'Apple Watch U,"Apple Watch, Apple Watch Ultra 3, Apple Watch Ultra 3 Français, Test Apple Watch Ultra 3, Test Apple Watch Ultra, Apple Watch Ultra 2 VS Apple Watch Ultra 3, Avis Apple Watch Ultra 3, Ski Apple Watch, Test Apple Watch, TheiCollection, Tech, HighTech, JB, Jojol, Gentil, Garçon, iPhone 17, iPhone 17 Pro, iPhone Air",28,https://i.ytimg.com/vi/LtE5EWTxYNM/hqdefault.jpg,,67
https://yt3.ggpht.com/3djzVEm99BYPivZxKHOa2z4_rfoE_bcVCjOmDM10vgp2MGH0lh67Q3Tr4uhckvpHkBMjcXin=s88-c-k-c0x00ffffff-no-rj,Un des micro-trottoirs les plus CRINGE qu'on a jamais vu,https://www.youtube.com/watch?v=Jtwi2rGkVcE,euuhhh,'25/09/2025 16:00,00:07:39,26552,737,118,"En stream tous les mardis, jeudis et dimanches dès","react, réact, reactfr, react francais, react français, réct français, euh, euuhhh, roro, un créatif, twitch, stream, live, mascu, argent, entrepreneur, coach, complotiste, new age, société, dev perso, développement personnel, humour, divertissement",24,https://i.ytimg.com/vi/Jtwi2rGkVcE/hqdefault.jpg,,73
