channelAvatar,title,link,channel,publishedAt,duration,views,likes,comments,shortDescription,tags,category,thumbnail,myCategory,playlistPosition
https://yt3.ggpht.com/ytc/AIdro_l5M7wAHM9QledrlSHNomrm8tV-pTAyzUiFtL7iSVFUIA=s88-c-k-c0x00ffffff-no-rj,Papy Grenier - MASS EFFECT,https://www.youtube.com/watch?v=V34x1CxlAZ0,Joueur Du Grenier,'26/02/2015 19:12,00:09:03,7696462,111599,5383,Fin Synthèse : https://www.youtube.com/watch?v=8PN,"Joueur du Grenier, papy Grenier, mass effect, cul de miranda, Grenier, Humour, gaming, retrogaming, Shepard, Ashley, Kaidan, vidéo interactive",20,https://i.ytimg.com/vi/V34x1CxlAZ0/hqdefault.jpg,,522
https://yt3.ggpht.com/ytc/AIdro_l5M7wAHM9QledrlSHNomrm8tV-pTAyzUiFtL7iSVFUIA=s88-c-k-c0x00ffffff-no-rj,Papy Grenier - Resident Evil,https://www.youtube.com/watch?v=oWHGaNDKqgk,Joueur Du Grenier,'14/07/2013 09:55,00:07:02,6806537,116164,7509,5eme épisode de Papy Grenier ! Je me souviens de R,"Papy Grenier, Joueur du Grenier, Resident Evil, Humour, Parodie",20,https://i.ytimg.com/vi/oWHGaNDKqgk/hqdefault.jpg,,523
https://yt3.ggpht.com/ytc/AIdro_m_C9l-Daju_CSGESNHRuzF6Bsaukk0Jmi9gz40CT8hJg=s88-c-k-c0x00ffffff-no-rj,"Jira, à quoi tu sers ?!? 😭",https://www.youtube.com/watch?v=ZyUGYASYv00,"Scrum Life - Lean, Agile, Kanban",'11/11/2024 16:00,00:08:13,8214,126,16,🎁 Le guide du Leader Agile compétent 👉 https://sl.,"Scrum Life, agile, scrum, agile scrum, lean, lean management, jira, trello, azure devops, management visuel, visual management, asana, notion, gestion de projet, project management, agile project management, gestion de projet agile, gestion de projet scrum, backlog, product backlog, kanban, atlassian, atlassian jira, confluence, atlassian confluence, outil de gestion de projet, jira admin, administrateur jira, ifuckinghatejira.com, azdo, clickup, excel, jira project, projet jira",27,https://i.ytimg.com/vi/ZyUGYASYv00/hqdefault.jpg,,581
https://yt3.ggpht.com/ItAHPEVsaBFOtdyimEDMBAH8VHIpyBnxgp-1YQBwQXkUseme3Br1vWSLhZDw9dgBBS1WVBhc4g=s88-c-k-c0x00ffffff-no-rj,Tesla Présente le Cybercab et le Robovan (100% Autonome),https://www.youtube.com/watch?v=H1LklY0ZzNw,Tech Now France,'11/10/2024 14:00,00:06:14,40733,722,72,"Tesla Présente le Cybercab et le Robovan

Découvre","Tesla, Elon Musk, Cybercab, Robovan, robotaxi, Optimus robot, transport autonome, véhicules autonomes, Tesla futur, innovation Tesla, robot humanoïde, Tesla Optimus, voiture autonome, AI Tesla, Cybertruck, transport public, Tesla Robotaxi, Tesla Cybercab, Roven, Robo Van, technologies de transport, futur du transport, conduite autonome, Tesla AI, futuriste, transport intelligent, Tesla news, événement Tesla, transport de masse, voitures électriques",2,https://i.ytimg.com/vi/H1LklY0ZzNw/hqdefault.jpg,,590
https://yt3.ggpht.com/SRqFlL5kiwbCBL79Avek49hMXAn9LAyO0RLjevX9OsE9iww9hDBzEvz4Pq_4lyvPc3kd25fIlA=s88-c-k-c0x00ffffff-no-rj,Le jeu où on plante des sapins,https://www.youtube.com/watch?v=vqYpaVoiymo,TheGreatReview,'06/10/2024 12:01,00:06:56,1045707,82884,1366,"je suis dorénavant un youtuber formats courts

J'a",,20,https://i.ytimg.com/vi/vqYpaVoiymo/hqdefault.jpg,,593
https://yt3.ggpht.com/DJTdhVuGuyUvDxzLXJrLeXGNqfM3UuST04rTvI0mUlSx1JPRspbGX6QQz7EBL5RLWAOBvmE6Eg=s88-c-k-c0x00ffffff-no-rj,Comment la NASA code sans bug,https://www.youtube.com/watch?v=wTZcGN4N334,V2F,'30/06/2024 16:00,00:08:29,613441,31514,721,Crée ton site facilement avec Hostinger en utilisa,"code, programmation, nasa, v2f, espace",28,https://i.ytimg.com/vi/wTZcGN4N334/hqdefault.jpg,,600
https://yt3.ggpht.com/ytc/AIdro_m_C9l-Daju_CSGESNHRuzF6Bsaukk0Jmi9gz40CT8hJg=s88-c-k-c0x00ffffff-no-rj,2 JOURS de Formation Agile Scrum OFFERTS par Scrum Life ! (on t'explique en vidéo),https://www.youtube.com/watch?v=HCgAGSu52IE,"Scrum Life - Lean, Agile, Kanban",'08/02/2024 07:45,00:05:10,747,27,6,Réserve ta place ! https://scrumlife.tv/leaderagil,"agile, agile scrum, certification, coach agile, csm scrum alliance, csm scrum master, développeur, formation, formation agile, formation agile scrum, formation scrum, formation scrum agile, formation scrum master, formation scrum product owner, gestion de projet, méthode agile, product backlog, product owner, projet agile scrum, psm1, psm1 certification, psm2, scrum, scrum life, scrum life formation, scrum life formation en français, scrum life formation en ligne, scrum master",27,https://i.ytimg.com/vi/HCgAGSu52IE/hqdefault.jpg,,610
https://yt3.ggpht.com/ytc/AIdro_m_C9l-Daju_CSGESNHRuzF6Bsaukk0Jmi9gz40CT8hJg=s88-c-k-c0x00ffffff-no-rj,Scrum ne serait pas agile ? 🤔,https://www.youtube.com/watch?v=5LbCw1BJjlo,"Scrum Life - Lean, Agile, Kanban",'15/01/2024 16:00,00:08:54,2347,81,18,🎁 Le guide du Scrum Master compétent 👉 https://sl.,"agile, agile safe, agile scrum, agile vs scrum, backlog, design thinking, framework scrum, gestion de projet, méthode agile, méthode agile définition, méthode agile scrum, méthode agile scrum exemple, methode agile xp, méthode scrum, product backlog, product owner, projet, retour d'expérience, rudy onfroy, scrum, scrum agile, scrum but, scrum life, scrum master, scrum pour les nuls, sprint, sprint backlog, sprint planning, sprint review, transcender scrum, user story",27,https://i.ytimg.com/vi/5LbCw1BJjlo/hqdefault.jpg,,615
https://yt3.ggpht.com/ytc/AIdro_m_C9l-Daju_CSGESNHRuzF6Bsaukk0Jmi9gz40CT8hJg=s88-c-k-c0x00ffffff-no-rj,Product Owner AGILE / Scrum vs Product Manager,https://www.youtube.com/watch?v=8805RljnUIE,"Scrum Life - Lean, Agile, Kanban",'30/01/2023 16:00,00:09:49,6757,172,22,‎‏‎🚨 Live exclusif le 10 septembre à 12h30 : comme,"agile, agile à l'échelle safe, agile at scale, agile at scale frameworks, agile at scale safe, agile methodology, agile product owner, agile project management, agilité à l'échelle, product manager, product manager vs product owner, product owner agile, product owner chef de produit, product owner role, product owner roles and responsibilities, product owner scrum, product owner training, product owner tutorial, scrum, scrum guide, scrum guide 2020, who is a product owner",27,https://i.ytimg.com/vi/8805RljnUIE/hqdefault.jpg,,619
https://yt3.ggpht.com/ytc/AIdro_m_C9l-Daju_CSGESNHRuzF6Bsaukk0Jmi9gz40CT8hJg=s88-c-k-c0x00ffffff-no-rj,Product Backlog : les OUTILS que TU DOIS CONNAITRE pour faire un BON PRODUIT,https://www.youtube.com/watch?v=gkxd5KH6HdM,"Scrum Life - Lean, Agile, Kanban",'16/07/2020 12:00,00:08:26,27810,656,11,‎‏‎🚨 Live exclusif le 10 septembre à 12h30 : comme,,27,https://i.ytimg.com/vi/gkxd5KH6HdM/hqdefault.jpg,,621
https://yt3.ggpht.com/ytc/AIdro_m_C9l-Daju_CSGESNHRuzF6Bsaukk0Jmi9gz40CT8hJg=s88-c-k-c0x00ffffff-no-rj,Product Owner (PO) et Product Manager (PM) : quelle différence ? - Scrum Life 28,https://www.youtube.com/watch?v=pSIYgV8_j9E,"Scrum Life - Lean, Agile, Kanban",'03/05/2018 21:18,00:08:58,27360,550,30,‎‏‎🚨 Live exclusif le 10 septembre à 12h30 : comme,,27,https://i.ytimg.com/vi/pSIYgV8_j9E/hqdefault.jpg,,623
https://yt3.ggpht.com/ytc/AIdro_m_C9l-Daju_CSGESNHRuzF6Bsaukk0Jmi9gz40CT8hJg=s88-c-k-c0x00ffffff-no-rj,5 leçons inestimables pour tout Scrum Master (Spéciale Noël 🎄),https://www.youtube.com/watch?v=nCdxBQ8s8XA,"Scrum Life - Lean, Agile, Kanban",'16/12/2024 16:00,00:09:51,2188,147,8,🎁 Le guide du Leader Agile compétent 👉 https://sl.,"Scrum Life, Scrum Master, agile, agilité, méthodologie agile, développement d'équipe, coaching agile, gestion de projet, scrum master tips, leadership agile, product owner, scrum multi-équipes, conseils scrum master, metrics agile, leçons scrum master, agile coaching, management agile, best practices agile, apprendre scrum, erreurs scrum master, spécial Noël Scrum Life, lean, lean agile, agile scrum, scrum agile, scrum, Scrum Master débutant, formation Scrum Master, Noël",27,https://i.ytimg.com/vi/nCdxBQ8s8XA/hqdefault.jpg,,625
https://yt3.ggpht.com/VSKAVOePHjconr8LVJcC2XEBZXaE-jCKUsuD-yBROvRsaa9m9ttwIW7vILa4GPljoDW2QyyiQA=s88-c-k-c0x00ffffff-no-rj,SUPERPOSITION (Quantum Horror Film),https://www.youtube.com/watch?v=PjuBUjtTvw8,Corridor Digital,'15/12/2024 16:45,00:05:49,464481,47858,2105,GRAYMATTER (ep 1) ►https://www.youtube.com/watch?v,,24,https://i.ytimg.com/vi/PjuBUjtTvw8/hqdefault.jpg,,627
https://yt3.ggpht.com/ytc/AIdro_kEBmI-2d_wEmEEV3CH2_SGaymCVtdy3eqhrJHxHcYXK2o=s88-c-k-c0x00ffffff-no-rj,Pankisi Ensemble | A Take Away Show at #WOMEX24,https://www.youtube.com/watch?v=9u_pnVCiR7c,Blogothèque,'05/12/2024 17:00,00:08:10,2638,106,7,"A Take Away Show with Pankisi Ensemble
In collabor","blogotheque, Take Away Show, Session, Live, Music, Reprise, Concert à emporter, Musique, France, Paris, Live Sessions, Acoustique, acoustic, Live music, Clip",10,https://i.ytimg.com/vi/9u_pnVCiR7c/hqdefault.jpg,,635
https://yt3.ggpht.com/HHkLcIooMYsJnhwnVHw794z7rZAXBmB1scphSjUuZlfSa9_p7-sDPFAeXqkyMZzUDq5jcMki=s88-c-k-c0x00ffffff-no-rj,The Rings Of Power Pitch Meeting,https://www.youtube.com/watch?v=zhsGVs6auq0,Pitch Meeting,'02/12/2022 20:15,00:06:46,3253618,140886,8182,Step inside the Pitch Meeting that led to The Lord,"Rings of power, amazon, amazon studios, galadriel, gandalf, hobbits, ice troll, middle earth, pitch meeting, ring, ryan george, sauron, screen rant, super easy barely an inconvenience, the lord of the rings, the stranger, tolkien",24,https://i.ytimg.com/vi/zhsGVs6auq0/hqdefault.jpg,,653
https://yt3.ggpht.com/HHkLcIooMYsJnhwnVHw794z7rZAXBmB1scphSjUuZlfSa9_p7-sDPFAeXqkyMZzUDq5jcMki=s88-c-k-c0x00ffffff-no-rj,The Batman Pitch Meeting,https://www.youtube.com/watch?v=6F1B7fdT5H8,Pitch Meeting,'10/03/2022 20:45,00:07:16,3777674,160666,6760,Step inside the pitch meeting that led to The Batm,"The batman, alfred, batcave, batman, batmobile, bruce wayne, catwoman, colin farrell, dc, falcone, funny, joker, matt reeves, new channel, penguin, pitch meeting, robert pattinson, ryan george, screen rant, super easy barely an inconvenience, twilight, zoe kravitz",24,https://i.ytimg.com/vi/6F1B7fdT5H8/hqdefault.jpg,,654
https://yt3.ggpht.com/1xaohldFQ1Adjly_DxpS11SnIbkJGCe6uIN7GUKNWPVK_bA2pMNH2_dHAtKGTvc7kOODQBQs3A=s88-c-k-c0x00ffffff-no-rj,I made The Milky Way the size of the US - to see how big we are,https://www.youtube.com/watch?v=VsRmyY3Db1Y,Epic Spaceman,'20/05/2023 23:55,00:07:25,1928861,120373,8763,This is a journey into the scale of the galaxy we ,"space, universe, milkyway, cosmos, scale, scale of the universe, milky way, galaxy, science",28,https://i.ytimg.com/vi/VsRmyY3Db1Y/hqdefault.jpg,,659
https://yt3.ggpht.com/5Sa5EN8bXQe-aDdZupws5foSTFd7W-5OmpJI2rcNR6gp2TGxUA6CIsKa8tYIMVnm377dIu-H6RQ=s88-c-k-c0x00ffffff-no-rj,Nino Arial – Le harcèlement de rue,https://www.youtube.com/watch?v=y6Eg8qSKsgg,Montreux Comedy,'20/11/2024 17:00,00:08:23,509979,18816,293,"𝙀𝙉𝙑𝙄𝙀 𝘿'𝙀𝙉𝘾𝙊𝙍𝙀 𝙋𝙇𝙐𝙎 𝘿𝙀 𝙍𝙄𝙍𝙀𝙎 ?

😂 𝙉𝙤𝙨 𝙨𝙠𝙚𝙩𝙘𝙝𝙨 : Re","montreux comedy festival, montreux, comedy, festival, humour, stand-up, Montreux Comedy, humoriste, sketch, sketch drôle, humoriste français, humour francophone, Humour Suisse, Humour Belge, dycoco comedy club, lillarious festival, gf productions, Montreux Comedy Encore, Exclam montréal, Nino Arial, harcèlement de rue, agression, dominique",23,https://i.ytimg.com/vi/y6Eg8qSKsgg/hqdefault.jpg,,667
https://yt3.ggpht.com/c--lELNYgWqiCWmZsdNwHVn7vj0IecE6RM_MLEnFopPnfMuE4MO0OCPyTD12cNmEvgeKdDJVew=s88-c-k-c0x00ffffff-no-rj,Lâche pas la manette Gota... Le Rewind de Twitch #181,https://www.youtube.com/watch?v=rJSifucc2zM,Popcorn,'05/11/2024 21:23,00:06:18,209530,11669,54,🎙️ Retrouvez l'émission tous les mardis à 20h sur ,,24,https://i.ytimg.com/vi/rJSifucc2zM/hqdefault.jpg,,684
https://yt3.ggpht.com/3-bjDL31J1thvLgO6R7mN-s-pCiPi_uJRW6ELan1KiadkU-1VuveM5d1JcF9Lx3Z5mM4PvoYcg=s88-c-k-c0x00ffffff-no-rj,395. Comment devenir celui à qui tout le monde veut parler ?,https://www.youtube.com/watch?v=f9p1M9L_45A,Caroline Mignaux ,'17/06/2024 03:23,00:08:17,1881,87,9,Résumé & Bonus 🧨🤫  (https://www.lessecretsdumarket,"Solopreneur, caroline mignaux, communication, digital marketing, entrepreneur, entrepreneure, growth, growth hacking, growth marketing, inbound, linkedin marketing, marketing, marketing digital, marque personnelle, personal branding, reseaux sociaux, réseaux sociaux, sales, social media, tendances marketing",27,https://i.ytimg.com/vi/f9p1M9L_45A/hqdefault.jpg,,694
https://yt3.ggpht.com/3-bjDL31J1thvLgO6R7mN-s-pCiPi_uJRW6ELan1KiadkU-1VuveM5d1JcF9Lx3Z5mM4PvoYcg=s88-c-k-c0x00ffffff-no-rj,Écrire de meilleurs posts : les techniques que tu ne liras pas ailleurs,https://www.youtube.com/watch?v=T5pm6r5ysgo,Caroline Mignaux ,'10/06/2024 05:30,00:06:36,2738,164,29,"Marketeurs, Entrepreneurs et Créateurs : cette cha","business model, caroline mignaux, co-marketing, maddyness, marketing, partenariat, reachmaker, social media",27,https://i.ytimg.com/vi/T5pm6r5ysgo/hqdefault.jpg,,696
https://yt3.ggpht.com/3-bjDL31J1thvLgO6R7mN-s-pCiPi_uJRW6ELan1KiadkU-1VuveM5d1JcF9Lx3Z5mM4PvoYcg=s88-c-k-c0x00ffffff-no-rj,CES 100 CONTACTS VONT PROPULSER TA MARQUE !,https://www.youtube.com/watch?v=tE1jWZmO58Q,Caroline Mignaux ,'04/10/2024 04:00,00:09:38,3697,175,23,🔴 1 stratégie par jour pour faire décoller ta noto,"réseaux sociaux, marketing digital, personal branding, growth hacking, content marketing, entrepreneuriat, influence marketing, stratégie digitale, social media marketing, stratégie de marque, marketing viral, branding personnel, stratégie de communication, tendances marketing, stratégie de médias sociaux, growth marketing, Dream 100, Génération de leads, Partenaires, Partenariat, client, Networking, reseau, réseau, réseautage, entrepreneurs, solopreneurs, freelances, indépendant, network",27,https://i.ytimg.com/vi/tE1jWZmO58Q/hqdefault.jpg,,705
https://yt3.ggpht.com/YOY2CmBga44F7Mja5HmH0exD6JTwAiETthp3OOrR9KgM4tsb04KzGroSw8cQ0Y30GL0uT85BCg=s88-c-k-c0x00ffffff-no-rj,48h avec les META Ray-Ban Display !,https://www.youtube.com/watch?v=CoJYPp-eH14,TheiCollection,'02/10/2025 16:32,00:14:05,29477,1613,98,Je viens de passer 48h avec les nouvelles META Ray,"RayBan, RayBan Display, RayBan META, META, lunettes connectées, lunettes RayBan connectée, lunettes avec écran, Meta RayBan Display, Meta RayBan Display Français, META RayBan Display France, test RayBan Dsiplay, TheiCollection, Tech, HighTech, Technologie, JB, Jojol, Gentil, Garçon, lunettes IA",28,https://i.ytimg.com/vi/CoJYPp-eH14/hqdefault.jpg,,7
https://yt3.ggpht.com/eNsmIF7eK_Ubl5Br-yUyp8_SiS8IwsqsehUisYOude4uz6wbRHsm4qVwOWi9bvlI48JOtihU=s88-c-k-c0x00ffffff-no-rj,"L'INCROYABLE EXPLOIT de GENTLE MATES, MISTER MV CLASH ETOILES - La Crème de Twitch #396",https://www.youtube.com/watch?v=8N5IU05PhQQ,La Crème de Twitch,'30/09/2025 11:00,00:11:33,20798,557,42,"⚡Discord: https://discord.com/invite/H3wTVg56Cc
⚡T","TwitchFR, Twitch, BestofTwitch",22,https://i.ytimg.com/vi/8N5IU05PhQQ/hqdefault.jpg,,14
https://yt3.ggpht.com/e1R4RHhrssqLswRYGo3yQGU2X9P8qz5SZNElNTMMK7seIwEsQGI0_Ij6E_czYn1ytX_kyvAy=s88-c-k-c0x00ffffff-no-rj,Mon portefeuille Trade Republic : Bilan Septembre - DCA challenge EP10 🎯,https://www.youtube.com/watch?v=Ugcy_nfPt_A,Julien - Investir en Bourse,'29/09/2025 18:01,00:14:48,6470,320,42,🎁 Ouvrir un compte Trade Republic gratuitement : h,,27,https://i.ytimg.com/vi/Ugcy_nfPt_A/hqdefault.jpg,,21
https://yt3.ggpht.com/ytc/AIdro_kHpdiJr7dnFXdEm-Jn852vGIGoFRgnBjjZi5euC1tn1w=s88-c-k-c0x00ffffff-no-rj,Les 11 meilleurs ETF PEA en 2025 (analyse complète),https://www.youtube.com/watch?v=bgSKRPIA-fM,Baguette Finance,'29/09/2025 15:44,00:18:21,6004,450,55,"Téléchargez Sumeria, faites un achat avec la carte","ETF, ETF PEA, meilleur ETF PEA, ETF 2025, investir en bourse, ETF CAC40, ETF S&P500, ETF Nasdaq, ETF MSCI World, ETF Stoxx 600, ETF Euro Stoxx 50, ETF émergents, ETF Inde, ETF sectoriels, ETF long terme, PEA débutant, investir PEA, ETF capitalisant, bourse pour débutant, comment investir en ETF",27,https://i.ytimg.com/vi/bgSKRPIA-fM/hqdefault.jpg,,23
https://yt3.ggpht.com/dRDSMjwDVMxp9cCvkFVvt2Ii76AZygzF_MxFgXBxdgg22DJtuPvNg3XfEwyrbf1K5X2_Zd1ileA=s88-c-k-c0x00ffffff-no-rj,Un jeu Steam vole ton argent ?,https://www.youtube.com/watch?v=41-_SJvXf3w,Hardisk TV,'29/09/2025 08:05,00:12:53,6069,298,20,🚀 Abonne-toi pour ne rien rater : http://bit.ly/Ha,"hardisk, live, vod, twitch, best of",24,https://i.ytimg.com/vi/41-_SJvXf3w/hqdefault.jpg,,27
https://yt3.ggpht.com/n6kUKg24HSZ8xnCqzTeilGJnrOJRTMl7YICoUxs0F7L_OBUTTDu-uIF5OBSLjyk9BH3MWy0j=s88-c-k-c0x00ffffff-no-rj,iPhone 17: A Photographer's Review,https://www.youtube.com/watch?v=KIwKEIMjBLM,Tyler Stalman,'17/09/2025 21:17,00:19:18,1860549,50135,1735,"In depth review of the cameras on the iPhone 17, f",Tyler Stalman,28,https://i.ytimg.com/vi/KIwKEIMjBLM/hqdefault.jpg,,36
https://yt3.ggpht.com/wP0QSNgo7duKo-cVZ_PMpsH3T2n56yCekSzyvp2f6gdoZ7E2U0cY14rrSqVlhWj8gh1zGePHNOQ=s88-c-k-c0x00ffffff-no-rj,Autopsie d'un échec : Star Wars Outlaws,https://www.youtube.com/watch?v=4qdFYYTOoEY,JeanBaptisteShow,'26/09/2025 19:05,00:17:10,251504,24364,1498,Star Wars Outlaws serait le plus gros échec commer,"Star Wars, jeux star wars, Outlaws, Star Wars Outlaws, Star Wars Outlaws test, Star Wars Outlaws review, Star Wars Outlaws switch, Star Wars Outlaws avis, Star Wars Outlaws fin, test, trailer, epic test, avis, review, meilleur jeu star wars, Open world, monde ouvert, Ubisoft, PS5, Switch, PC gameplay, Jean-Baptiste, JeanBaptisteShow, français, fr, Jean-Baptiste Show, jbshow",20,https://i.ytimg.com/vi/4qdFYYTOoEY/hqdefault.jpg,,37
https://yt3.ggpht.com/YOY2CmBga44F7Mja5HmH0exD6JTwAiETthp3OOrR9KgM4tsb04KzGroSw8cQ0Y30GL0uT85BCg=s88-c-k-c0x00ffffff-no-rj,Test iPhone Air - Je l'adore ! (mais...),https://www.youtube.com/watch?v=FGpHwlJzkG8,TheiCollection,'26/09/2025 15:45,00:12:09,98981,3910,324,Voici mon test et retour d'expérience sur l'iPhone,"iPhone Air, Test iPhone Air, iPhone Air Avis, Test Français iPhone Air, iPhone Air VS iPhone 17 Pro, iPhone Air VS iPhone 17, iPhone 17 Air, iPhone 17, Test iPhone 17 Air, Test iPhone 17, Comparatif iPhone, iPhone, TheiCollection iPhone, TheiCollection, Tech, HighTech, Technologie, JB, Jojol, Gentil, Garçon",28,https://i.ytimg.com/vi/FGpHwlJzkG8/hqdefault.jpg,,40
https://yt3.ggpht.com/3-bjDL31J1thvLgO6R7mN-s-pCiPi_uJRW6ELan1KiadkU-1VuveM5d1JcF9Lx3Z5mM4PvoYcg=s88-c-k-c0x00ffffff-no-rj,"Comment utiliser l’IA pour convertir, former ses collaborateurs et éviter la fraude ? ",https://www.youtube.com/watch?v=YXi2Mo8qhWY,Caroline Mignaux ,'26/09/2025 10:40,00:16:14,2333,96,20,Abonne-toi 🛎 1 stratégie / jour pour progresser → ,"réseaux sociaux, marketing digital, personal branding, growth hacking, content marketing, entrepreneuriat, influence marketing, stratégie digitale, marketing de contenu, social media marketing, marketing d'influence, création de contenu, coaching en entrepreneuriat, stratégie de marque, marketing viral, marketing B2B, stratégie de communication, tendances marketing, stratégie de médias sociaux, growth marketing, vente, influence, business, marque personnelle",27,https://i.ytimg.com/vi/YXi2Mo8qhWY/hqdefault.jpg,,44
https://yt3.ggpht.com/_0aCR_brd1AV3pGH0nK77DUQ1Upgdlcv_4Pk8ZdqyTj23ATN9mDgeaq0IjVQrZOpM1UQPLp12A=s88-c-k-c0x00ffffff-no-rj,Stop! You’re Not Using CarPlay to Its Full Potential,https://www.youtube.com/watch?v=RjkgalAtM4A,HotshotTek,'25/09/2025 22:38,00:15:42,88264,2499,77,Unlock the BEST CarPlay settings & hidden features,"carplay ios 26, carplay hidden features, carplay settings ios 26, ios 26 carplay tips, ios 26 carplay tricks, apple carplay 2025, apple carplay ios 26, best carplay settings, best carplay features, carplay ios 26 update, ios 26 hidden features, ios 26 tips and tricks, apple carplay guide, carplay customization, carplay widgets ios 26, apple maps carplay offline, google maps carplay tips, carplay siri hidden tricks, carplay ios 26 tutorial",28,https://i.ytimg.com/vi/RjkgalAtM4A/hqdefault.jpg,,45
https://yt3.ggpht.com/a_1U9tYmozHPhZhsLiqqQ_XcYbhlmG_X1fsTdBWAHBjLmRN0haiv1xa_owiit7p8xyKDlMF1LXw=s88-c-k-c0x00ffffff-no-rj,Xiaomi 17 Pro Max review - Apple are you seeing this!?,https://www.youtube.com/watch?v=0jHtyF_rCqU,Mrwhosetheboss,'26/09/2025 00:00,00:12:57,9306714,236510,12481,Xiaomi 17 Pro and Pro Max review - the second scre,"xiaomi, xiaomi 17 pro, xiaomi 17 pro max, cool phones",28,https://i.ytimg.com/vi/0jHtyF_rCqU/hqdefault.jpg,,46
https://yt3.ggpht.com/QNQKH06vHzPRwiOVEiuFAH93OwKsv39EkVsXY_SAG6aDCADIk46b5P3_60O7CRunDh66StAIlpw=s88-c-k-c0x00ffffff-no-rj,La Chute de L'EMPIRE du V-TUBING Américain,https://www.youtube.com/watch?v=LaDe07L2aDw,PolyHeart,'24/09/2025 15:21,00:18:24,88232,5293,143,Merci à Echo Rosen et Tilt Guy d'avoir relu le tex,,20,https://i.ytimg.com/vi/LaDe07L2aDw/hqdefault.jpg,,52
https://yt3.ggpht.com/YOY2CmBga44F7Mja5HmH0exD6JTwAiETthp3OOrR9KgM4tsb04KzGroSw8cQ0Y30GL0uT85BCg=s88-c-k-c0x00ffffff-no-rj,Je teste la meilleure montre connectée du moment ?! (HUAWEI Watch GT 6 Pro),https://www.youtube.com/watch?v=v4Dv_Xj8_L0,TheiCollection,'23/09/2025 16:55,00:10:01,28012,814,142,"Que vaut la nouvelle HUAWEI Watch GT 6 Pro ?
Insta","Huawei, Huawei Watch GT 6Pro, Huawei Watch, Apple Watch, montre connectée, montre connectée Huawei, Huawei Watch 2025, TheiCollection, Tech, HighTEch, Technologie, JB, Jojol, Gentil, Garçon, montre connectée pas chère, montre connectée Android",28,https://i.ytimg.com/vi/v4Dv_Xj8_L0/hqdefault.jpg,,57
https://yt3.ggpht.com/IBgiJOen7sXZxskS-BNsDVr_T5WLHSD4-jsvPRtmb_g1BkMSigXjv0uQyySxiF3Sq0BDriJfjcc=s88-c-k-c0x00ffffff-no-rj,iOS 26.1 Beta 1 Released - What's New?,https://www.youtube.com/watch?v=JQfwDqrl0uI,Brandon Butch,'22/09/2025 20:32,00:12:49,243724,6050,792,iOS 26.1 Beta 1 Released - What's New? | iOS 26 Fe,"Brandon butch, iphone, ios, apple, iOS 17, iPhone 15, iPhone 16, iOS 18",28,https://i.ytimg.com/vi/JQfwDqrl0uI/hqdefault.jpg,,58
https://yt3.ggpht.com/e1R4RHhrssqLswRYGo3yQGU2X9P8qz5SZNElNTMMK7seIwEsQGI0_Ij6E_czYn1ytX_kyvAy=s88-c-k-c0x00ffffff-no-rj,🚨 Trade Republic x Private Equity : attention au 12% ! ⚠️ Mon analyse détaillée,https://www.youtube.com/watch?v=TxTAO3PuI84,Julien - Investir en Bourse,'21/09/2025 16:41,00:14:09,7557,409,120,🎁 Ouvrir un compte Trade Republic gratuitement : h,"trade republic private equity, private equity trade republic, investir private equity trade republic, avis trade republic, trade republic, trade republic avis, trade republic private equity avis",27,https://i.ytimg.com/vi/TxTAO3PuI84/hqdefault.jpg,,62
https://yt3.ggpht.com/eNsmIF7eK_Ubl5Br-yUyp8_SiS8IwsqsehUisYOude4uz6wbRHsm4qVwOWi9bvlI48JOtihU=s88-c-k-c0x00ffffff-no-rj,"SQUEEZIE se fait BAN de TWITCH, ZERATOR TACLE ANTOINE DANIEL - La Crème de Twitch #387",https://www.youtube.com/watch?v=_JdpN1xqLB8,La Crème de Twitch,'21/09/2025 11:00,00:11:56,32888,739,44,"⚡Discord: https://discord.com/invite/H3wTVg56Cc
⚡T","TwitchFR, Twitch, BestofTwitch",22,https://i.ytimg.com/vi/_JdpN1xqLB8/hqdefault.jpg,,65
https://yt3.ggpht.com/ytc/AIdro_nhTrNkfRe_XfrOawqxt27NmKDO2CzVfVvMl8p2c8h7U5M=s88-c-k-c0x00ffffff-no-rj,La face cachée de Mister V enfin dévoilée | Carte Blanche,https://www.youtube.com/watch?v=9X2Wn5pQ9kw,Konbini,'15/09/2025 18:02,00:15:50,240701,11345,291,Konbini lance son nouveau concept : Carte Blanche.,"konbini, kombini, news, actu, culture, rreportage",24,https://i.ytimg.com/vi/9X2Wn5pQ9kw/hqdefault.jpg,,69
https://yt3.ggpht.com/ytc/AIdro_l4RP19H6KxmMXT9nsgUendqx8h4O0hZKHIxZrSirN_h-4=s88-c-k-c0x00ffffff-no-rj,"iPhone Air, ça va flop ? (prise en main)",https://www.youtube.com/watch?v=F9xc2j5CajE,Nowtech,'20/09/2025 06:05,00:15:35,105084,4872,627,Que vaut ce tout nouveau modèle d’iPhone super fin,"iphone air, prise en main, iphone, apple, prise en main iphone, prise en main iphone air, nouvel iphone, quel iphone choisir, meilleur iphone, iphone 2025, iphone 2026, nouveau modèle iphone, iphone super fin, iphone fin, test iphone air, test iphone, meilleurs iphone, quel est le meilleur iphone, iphone guide d'achat, quel iphone acheter, iphone 17, iphone 17 air, iphone 17 pro, test iphone 17 air, prise en main iphone 17 air, nouveau iphone, nouveaux iphone",28,https://i.ytimg.com/vi/F9xc2j5CajE/hqdefault.jpg,,70
https://yt3.ggpht.com/IBgiJOen7sXZxskS-BNsDVr_T5WLHSD4-jsvPRtmb_g1BkMSigXjv0uQyySxiF3Sq0BDriJfjcc=s88-c-k-c0x00ffffff-no-rj,iOS 26 - 30+ Best HIDDEN Features!,https://www.youtube.com/watch?v=aXAZx6-eF3g,Brandon Butch,'19/09/2025 13:15,00:18:51,646081,13668,616,iOS 26 - 30+ Best HIDDEN Features! | iOS 26 Hidden,"Brandon butch, iphone, ios, apple, iOS 17, iPhone 15, iPhone 16, iOS 18",28,https://i.ytimg.com/vi/aXAZx6-eF3g/hqdefault.jpg,,76
https://yt3.ggpht.com/NrKSNekPuOgFc9RWLknI-FcJQNngJ3KDSLpr81AwMZ9Zct7LKSl4He4LrN7oDXr1BGvO3s6TQjU=s88-c-k-c0x00ffffff-no-rj,Illustrator cache une option 3D hallucinante !,https://www.youtube.com/watch?v=pLVKqlfwIC4,Basti Sans MS,'19/09/2025 08:30,00:11:46,9007,540,27,❤️ Abonnez-vous pour me soutenir et atteindre les ,"ui, ux, design, web, twitch, youtube, clip, figma, logo, basti, bastiui, redesign, actu, tech",28,https://i.ytimg.com/vi/pLVKqlfwIC4/hqdefault.jpg,,81
https://yt3.ggpht.com/ytc/AIdro_kcL_PnNz1KEjLIQ7veCTq_0Vv7tktG0oth4M0_NZp8PRw=s88-c-k-c0x00ffffff-no-rj,CE QUE JE VOIS EST HONTEUX... (Tutos DIY & Astuces),https://www.youtube.com/watch?v=kPbtsS311Ao,Mastu,'04/04/2020 09:01,00:14:21,4234640,325495,5836,"Contact pro : Contact.mastu@gmail.com

S'abonner","Mastu, Mastus, Redbox, Humour, Matsu",23,https://i.ytimg.com/vi/kPbtsS311Ao/hqdefault.jpg,,83
