channelAvatar,title,link,channel,publishedAt,duration,views,likes,comments,shortDescription,tags,category,thumbnail,myCategory,playlistPosition
https://yt3.ggpht.com/3djzVEm99BYPivZxKHOa2z4_rfoE_bcVCjOmDM10vgp2MGH0lh67Q3Tr4uhckvpHkBMjcXin=s88-c-k-c0x00ffffff-no-rj,Le CAMP pour hommes ALPHA,https://www.youtube.com/watch?v=9rPEyPxDwzU,euuhhh,'24/10/2024 16:00,00:25:20,122847,2948,304,"[Pub ""CYBERGHOST VPN""] : Bénéficiez de 4 mois offe",,24,https://i.ytimg.com/vi/9rPEyPxDwzU/hqdefault.jpg,,300
https://yt3.ggpht.com/nzEa1ZH5mjxIVLo0jo0zrTQpXalXGV4aOhYTYVXkWdhaImvmDMnNGJqitLGf42hEWoEpfX-WCTM=s88-c-k-c0x00ffffff-no-rj,Mon nouveau sketch show ! - SANS ALCOOL 1,https://www.youtube.com/watch?v=1PRzsHQzZpY,Thomas Combret,'26/12/2022 11:15,00:26:43,27393,3248,285,Pour soutenir le projet sur Utip : https://utip.io,"thomas, combret, mammouth, cornichon, humour, sketch, courts, métrages, court, metrage, drole, drôle, parodie, badnews, les acteurs",23,https://i.ytimg.com/vi/1PRzsHQzZpY/hqdefault.jpg,,302
https://yt3.ggpht.com/ytc/AIdro_lRY24xCKT9seH0TYW6LcBbDVcFW3unpSvqA5Ps9Qsi4q0=s88-c-k-c0x00ffffff-no-rj,Xavier parle de CULTURE CLASH à la télé ?! - Nuit de la Culture : Spéciale Masters,https://www.youtube.com/watch?v=tyECEGG4L-E,Etoiles,'24/12/2024 17:00,00:21:58,196041,8106,75,"L'émission tant attendue, celle de Xavier le grand","Quiz, Culture, Etoiles, question pour un champion, Nuit de la culture, react, Etoile, les masters, Xavier, Culture Clash",24,https://i.ytimg.com/vi/tyECEGG4L-E/hqdefault.jpg,,308
https://yt3.ggpht.com/3djzVEm99BYPivZxKHOa2z4_rfoE_bcVCjOmDM10vgp2MGH0lh67Q3Tr4uhckvpHkBMjcXin=s88-c-k-c0x00ffffff-no-rj,VASECTOMIE : Les mascus le détestent,https://www.youtube.com/watch?v=t9fvsnJUd8Y,euuhhh,'19/12/2024 17:01,00:25:41,51347,1521,299,"Chaine Twitch : https://www.twitch.tv/euuhhh__

[P",,24,https://i.ytimg.com/vi/t9fvsnJUd8Y/hqdefault.jpg,,309
https://yt3.ggpht.com/3djzVEm99BYPivZxKHOa2z4_rfoE_bcVCjOmDM10vgp2MGH0lh67Q3Tr4uhckvpHkBMjcXin=s88-c-k-c0x00ffffff-no-rj,La respiration HOLOTROPIQUE (hé mais ça bez un max),https://www.youtube.com/watch?v=RJx1WqA6iLs,euuhhh,'11/12/2024 17:00,00:24:36,21881,549,34,"Chaine Twitch : https://www.twitch.tv/euuhhh__

[P",,24,https://i.ytimg.com/vi/RJx1WqA6iLs/hqdefault.jpg,,310
https://yt3.ggpht.com/3djzVEm99BYPivZxKHOa2z4_rfoE_bcVCjOmDM10vgp2MGH0lh67Q3Tr4uhckvpHkBMjcXin=s88-c-k-c0x00ffffff-no-rj,La biorésonance quantique sur CHEVAL,https://www.youtube.com/watch?v=8bzYfBr0xEU,euuhhh,'18/11/2024 17:00,00:26:10,20152,645,100,"[Pub ""HOLY""] : Profitez de 5 euros de réduction su",,24,https://i.ytimg.com/vi/8bzYfBr0xEU/hqdefault.jpg,,311
https://yt3.ggpht.com/3djzVEm99BYPivZxKHOa2z4_rfoE_bcVCjOmDM10vgp2MGH0lh67Q3Tr4uhckvpHkBMjcXin=s88-c-k-c0x00ffffff-no-rj,Ils témoignent : “Trop dur d’être blanc”,https://www.youtube.com/watch?v=Ifj5KtNdILw,euuhhh,'12/11/2024 17:00,00:27:54,81271,2838,567,"Chaine Twitch : https://www.twitch.tv/euuhhh__

[P",,24,https://i.ytimg.com/vi/Ifj5KtNdILw/hqdefault.jpg,,312
https://yt3.ggpht.com/3djzVEm99BYPivZxKHOa2z4_rfoE_bcVCjOmDM10vgp2MGH0lh67Q3Tr4uhckvpHkBMjcXin=s88-c-k-c0x00ffffff-no-rj,STOP les téléphones et les écrans là,https://www.youtube.com/watch?v=FVdJh71myIE,euuhhh,'28/10/2024 17:00,00:26:06,46176,1063,85,"[Pub ""HOLY""] : Profitez de 5 euros de réduction su",,24,https://i.ytimg.com/vi/FVdJh71myIE/hqdefault.jpg,,314
https://yt3.ggpht.com/3djzVEm99BYPivZxKHOa2z4_rfoE_bcVCjOmDM10vgp2MGH0lh67Q3Tr4uhckvpHkBMjcXin=s88-c-k-c0x00ffffff-no-rj,J’arrête le STREAM et j'ouvre mon FOODTRUCK ?,https://www.youtube.com/watch?v=7i5W4HOCG-k,euuhhh,'06/10/2024 16:00,00:26:25,38336,856,50,"Chaine Twitch : https://www.twitch.tv/euuhhh__

[P",,24,https://i.ytimg.com/vi/7i5W4HOCG-k/hqdefault.jpg,,315
https://yt3.ggpht.com/3djzVEm99BYPivZxKHOa2z4_rfoE_bcVCjOmDM10vgp2MGH0lh67Q3Tr4uhckvpHkBMjcXin=s88-c-k-c0x00ffffff-no-rj,Je ne suis pas très KAIZEN (je ne sais pas ce que c'est mais c'est lié à la montagne je crois),https://www.youtube.com/watch?v=K2ENLXk9HEM,euuhhh,'30/09/2024 16:00,00:28:09,40929,884,96,"[Pub ""HOLY""] : Profitez de 5 euros de réduction su",,24,https://i.ytimg.com/vi/K2ENLXk9HEM/hqdefault.jpg,,318
https://yt3.ggpht.com/v2D0WfvIE1yLmfHoUZdn2dwgPiDEqAbeK5ZBXdo-ZfbZ_8db-GO9qp49wp4KtadZdZvpCf8o=s88-c-k-c0x00ffffff-no-rj,Jony Ive : les secrets et l'histoire de l'homme qui a dessiné l’iPhone,https://www.youtube.com/watch?v=E-aI8Q1tmRQ,Romain Lanéry,'27/10/2024 17:00,00:26:18,70977,3030,133,Si tu aimes Apple ou bien que tu détestes cette ma,"romain lanéry, jony ive, histoire, chronique, apple, Steve jobs, Tim cook, secte, romain lanery, que sont-ils devenus, entrepreneur, norman foster, toysrus, iPod, Design, iMac, iPhone, Apple Park",28,https://i.ytimg.com/vi/E-aI8Q1tmRQ/hqdefault.jpg,,321
https://yt3.ggpht.com/ytc/AIdro_kIK55ia3jcirb-DE9ihqU6MlvadGlT1Dq9JBzgMcGc=s88-c-k-c0x00ffffff-no-rj,Pourquoi Hollywood déteste les entrepreneurs,https://www.youtube.com/watch?v=o-wSeUFfgAo,Marketing Mania,'23/10/2024 12:01,00:25:07,51269,2321,259,Gagner votre vie avec le copywriting : https://mar,"marketing mania, stan leloup, stanislas leloup, comment convaincre, influence, manipulation, influence et manipulation, marketing, webmarketing, techniques de persuasion, persuasion, Hollywood contre les entrepreneurs, séries sur les entrepreneurs, entrepreneurs et conglomérats au cinéma, pourquoi Hollywood critique les riches, entrepreneurs détestés par Hollywood, films sur les entrepreneurs corrompus",27,https://i.ytimg.com/vi/o-wSeUFfgAo/hqdefault.jpg,,322
https://yt3.ggpht.com/HP9oIpL42ufzvCEBTLzxAtpZae1rfLzdte8tnlh-Qi0yjIprNPDqHXiR-XvxMe5eyFUC5Fensl0=s88-c-k-c0x00ffffff-no-rj,J'ai automatisé mes E-mails avec ChatGPT o1 et Bolt — TUTO,https://www.youtube.com/watch?v=vE9adtV6MZw,Ludo Salenne,'06/12/2024 15:21,00:23:29,38297,973,84,"Ce matin, j'en ai eu assez → passer des heures à t","email automatisation, email chatgpt, e-mail chatgpt, automatiser e-mail, automatiser chatgpt, chatgpt o1, chatgpt o1 pro, o1 pro mode, ChatGPT Pro, Bolt, Bolt IA, automatiser Bolt, chatgpt bolt, automatiser email chatgpt, automatisation, make, make com, make.com, tuto chatgpt, rédiger email chatgpt, répondre email chatgpt, no code, bolt ai, tuto bolt, bolt français, bolt fr, bolt chatgpt, ia no code, automatisation make",28,https://i.ytimg.com/vi/vE9adtV6MZw/hqdefault.jpg,,325
https://yt3.ggpht.com/ytc/AIdro_kcL_PnNz1KEjLIQ7veCTq_0Vv7tktG0oth4M0_NZp8PRw=s88-c-k-c0x00ffffff-no-rj,INTERROGATOIRE SOUS DÉTECTEUR DE MENSONGES #2 (Avec Inoxtag),https://www.youtube.com/watch?v=wHEqDtnHyck,Mastu,'02/07/2022 09:31,00:24:51,13966832,813493,7092,On se pose des questions ULTRA GENANTES avec Inoxt,"Mastu, Mastus, Redbox, Humour, Matsu, loat, Detecteur de mensonge, Mastu mensonge, Mastu inox, Inox, Inoxtag, Mastu inoxtag",23,https://i.ytimg.com/vi/wHEqDtnHyck/hqdefault.jpg,,338
https://yt3.ggpht.com/uOw2e6SJwIsvq2j8rVi3vaTzGXAsgaOcnN2ixb3Sb6TKSOU3LbGhEt_glNOQJE7XHrvIsdOdCb8=s88-c-k-c0x00ffffff-no-rj,"On a fait LE FILM d'horreur de l'année (ft Max, Djilsi, Billy, Theorus, Grim)",https://www.youtube.com/watch?v=IN7XUpFolPE,Elian Ventre,'26/10/2025 10:30,00:36:09,89239,12771,239,Merci aux frérots de chez Revolut d'avoir sponsori,,22,https://i.ytimg.com/vi/IN7XUpFolPE/hqdefault.jpg,,7
https://yt3.ggpht.com/HP9oIpL42ufzvCEBTLzxAtpZae1rfLzdte8tnlh-Qi0yjIprNPDqHXiR-XvxMe5eyFUC5Fensl0=s88-c-k-c0x00ffffff-no-rj,SORA 2 : Comment générer des vidéos IA indétectables ?,https://www.youtube.com/watch?v=XyAFuSX_jnU,Ludo Salenne,'16/10/2025 18:00,00:34:59,18547,665,96,SORA 2 vient de sortir et voici le tuto complet po,"sora 2, tuto sora 2, test sora 2, sora 2 français, sora 2 fr, demo sora 2, formation sora 2, code sora 2, comment utiliser sora 2, sora 2 tutoriel, générer vidéo ia, vidéo ia gratuit, ia vidéo, exemples vidéos ia, vidéo intelligence artificielle, faire des vidéos avec ia, sora 2 pro, sora 2 guide, sora openai, chatgpt sora, chat gpt sora",28,https://i.ytimg.com/vi/XyAFuSX_jnU/hqdefault.jpg,,32
https://yt3.ggpht.com/QlqvWfuwKRzbBiDYqN0oFvBfITo43Bwd764zxYkJPahA6GKT0i_32Cp29roHcYvkKKSOIZVA=s88-c-k-c0x00ffffff-no-rj,La traque de l'homme le plus cruel d'Internet,https://www.youtube.com/watch?v=cO2S3kyj8_c,Simon Puech,'08/10/2025 15:01,00:31:35,997303,44728,1088,💶 Pour essayer Trade Republic : https://trade.re/S,"hack, histoire vraie, htp, lizard squad, micode, vastaamo, dark net, hacking, julius kivimaki",24,https://i.ytimg.com/vi/cO2S3kyj8_c/hqdefault.jpg,,39
https://yt3.ggpht.com/HP9oIpL42ufzvCEBTLzxAtpZae1rfLzdte8tnlh-Qi0yjIprNPDqHXiR-XvxMe5eyFUC5Fensl0=s88-c-k-c0x00ffffff-no-rj,J’ai passé 300h sur GPT-5 – Voici comment bien l’utiliser !,https://www.youtube.com/watch?v=jJe5DHTLBvM,Ludo Salenne,'10/10/2025 15:07,00:31:24,23942,1036,82,J’utilise ChatGPT 5 tous les jours depuis sa sorti,"gpt 5, gpt5, chatgpt 5, chat gpt 5, tuto gpt 5, prompts gpt 5, prompts chatgpt, tuto chatgpt, demo gpt 5, formation chatgpt, comment utiliser chatgpt, tuto chatgpt 5, comment utiliser gpt 5, comment utiliser chatgpt 5",28,https://i.ytimg.com/vi/jJe5DHTLBvM/hqdefault.jpg,,42
https://yt3.ggpht.com/3djzVEm99BYPivZxKHOa2z4_rfoE_bcVCjOmDM10vgp2MGH0lh67Q3Tr4uhckvpHkBMjcXin=s88-c-k-c0x00ffffff-no-rj,On s'occupe de notre ENFANT INTÉRIEUR,https://www.youtube.com/watch?v=ESEmHQB1-wI,euuhhh,'06/10/2025 16:00,00:31:03,19925,516,77,"[Pub ""HOLY""] : Profitez de 5 euros de réduction su","react, réact, reactfr, react francais, react français, réct français, euh, euuhhh, roro, un créatif, twitch, stream, live, mascu, argent, entrepreneur, coach, complotiste, new age, société, dev perso, développement personnel, humour, divertissement",24,https://i.ytimg.com/vi/ESEmHQB1-wI/hqdefault.jpg,,48
https://yt3.ggpht.com/v2D0WfvIE1yLmfHoUZdn2dwgPiDEqAbeK5ZBXdo-ZfbZ_8db-GO9qp49wp4KtadZdZvpCf8o=s88-c-k-c0x00ffffff-no-rj,"""Je joue au Monopoly dans la vraie vie"" | 20 minutes avec un gestionnaire de patrimoine",https://www.youtube.com/watch?v=X2D_CktOXzE,Romain Lanéry,'06/10/2025 17:01,00:33:52,35840,1604,23,"Aujourd’hui, on passe 20 minutes avec Guillaume Be","romain lanéry, romain laneri, lanery, laneri, technewstests, technews, sofidy, sofidi, gestionnaire, patrimoine, argent, investissement, imo, immo, immobilier, centre commercial, immeuble, paris, interview, 20min, minutes, 20 minutes avec, podcast",28,https://i.ytimg.com/vi/X2D_CktOXzE/hqdefault.jpg,,49
https://yt3.ggpht.com/a1Dts5E7rANROZrxzmcqNQ2oeqwsTOB1NA7nrfgsX9FfhbYHSYUM4sDQhLKpfbGvDXSKvcRayg=s88-c-k-c0x00ffffff-no-rj,J'ai enquêté sur l'ADDICTION au SUCRE,https://www.youtube.com/watch?v=q2oWkPLx-Wk,Sabine,'11/06/2025 14:59,00:33:27,55086,3666,234,Merci encore à Odoo de sponsoriser cette vidéo ! P,"sucre, addict au sucre, glucose revolution",24,https://i.ytimg.com/vi/q2oWkPLx-Wk/hqdefault.jpg,,54
https://yt3.ggpht.com/3djzVEm99BYPivZxKHOa2z4_rfoE_bcVCjOmDM10vgp2MGH0lh67Q3Tr4uhckvpHkBMjcXin=s88-c-k-c0x00ffffff-no-rj,Les 7 pouvoirs des FEMMES (le 6ème va vous étonner),https://www.youtube.com/watch?v=EWZQtoYJSnU,euuhhh,'02/10/2025 16:00,00:30:17,43573,1146,202,"En stream tous les mardis, jeudis et dimanches dès","react, réact, reactfr, react francais, react français, réct français, euh, euuhhh, roro, un créatif, twitch, stream, live, mascu, argent, entrepreneur, coach, complotiste, new age, société, dev perso, développement personnel, humour, divertissement",24,https://i.ytimg.com/vi/EWZQtoYJSnU/hqdefault.jpg,,59
https://yt3.ggpht.com/ytc/AIdro_kIK55ia3jcirb-DE9ihqU6MlvadGlT1Dq9JBzgMcGc=s88-c-k-c0x00ffffff-no-rj,Les arnaqueurs sont devenus beaucoup trop forts,https://www.youtube.com/watch?v=eDn6cy6Y1CU,Marketing Mania,'01/10/2025 12:01,00:36:23,101499,3680,358,Téléchargez le PDF qui résume toutes les technique,"marketing mania, stan leloup, stanislas leloup, comment convaincre, influence, manipulation, influence et manipulation, marketing, webmarketing, techniques de persuasion, persuasion, arnaques en ligne, psychologie des arnaques, scam psychologie, comment marchent les arnaques, comprendre les scams, pourquoi les arnaques marchent, arnaques 2025, escroqueries en ligne, manipulation mentale, psychologie criminelle, scam en ligne, scam psychologie humaine, Anne Brad Pitt",27,https://i.ytimg.com/vi/eDn6cy6Y1CU/hqdefault.jpg,,61
https://yt3.ggpht.com/3djzVEm99BYPivZxKHOa2z4_rfoE_bcVCjOmDM10vgp2MGH0lh67Q3Tr4uhckvpHkBMjcXin=s88-c-k-c0x00ffffff-no-rj,Ils CONTRÔLENT le vent par la PENSÉE,https://www.youtube.com/watch?v=TL7eO6bpk8I,euuhhh,'24/09/2025 16:01,00:31:27,35508,800,93,"En stream tous les mardis, jeudis et dimanches dès","react, réact, reactfr, react francais, react français, réct français, euh, euuhhh, roro, un créatif, twitch, stream, live, mascu, argent, entrepreneur, coach, complotiste, new age, société, dev perso, développement personnel, humour, divertissement",24,https://i.ytimg.com/vi/TL7eO6bpk8I/hqdefault.jpg,,76
https://yt3.ggpht.com/9waBvH5yP5jTNSGZ-n9Na5ldf3vnzmFOEjv6PUEuCiaRkfffk50GpF6nkDleoapVrR22Uupm8Lc=s88-c-k-c0x00ffffff-no-rj,DANS LA PEAU DE MCWALTER (Making Of / Partie 1),https://www.youtube.com/watch?v=rm5SG1AtCvw,Mister V,'20/09/2025 12:01,00:32:30,432165,20595,477,"Petit making of en bien ... partie 2 bientôt ...

","misterv, yvick, humour, blagues, comique, facecam, states, making of, mcwalter, bulgarie, documentaire, film, prime video, comedie, thomas cadoux, simon astier",23,https://i.ytimg.com/vi/rm5SG1AtCvw/hqdefault.jpg,,81
https://yt3.ggpht.com/QlqvWfuwKRzbBiDYqN0oFvBfITo43Bwd764zxYkJPahA6GKT0i_32Cp29roHcYvkKKSOIZVA=s88-c-k-c0x00ffffff-no-rj,Un Yakuza m'a confié ses crimes,https://www.youtube.com/watch?v=MvprlFFLyac,Simon Puech,'16/09/2025 15:07,00:31:47,203700,11905,238,💶 Pour essayer Trade Republic : https://trade.re/S,"yakuza, japon, gang, mafia, crime, true crime, interview, charles villa, louis san, mitsu, tev, ici japon, tokyo",24,https://i.ytimg.com/vi/MvprlFFLyac/hqdefault.jpg,,93
https://yt3.ggpht.com/F5R-8dCR4OsDu1Rs_2RE20e6LUNFDJW6VemSqToit8XvdfoSj1DXJXb0Dc4aT_YEv-5TsFCF=s88-c-k-c0x00ffffff-no-rj,24H POUR RÉALISER 3 TRICKS !,https://www.youtube.com/watch?v=OcCNH9gjJ1o,JOYCA,'14/09/2025 11:09,00:39:42,3683981,185709,1743,Téléchargez REVOLUT gratuitement avec ce lien  👉 h,"Joyca, video, reaction, Français, solo leveling jeu, carte bancaire, credit card, motivation à travailler, training vidéo",24,https://i.ytimg.com/vi/OcCNH9gjJ1o/hqdefault.jpg,,97
https://yt3.ggpht.com/3djzVEm99BYPivZxKHOa2z4_rfoE_bcVCjOmDM10vgp2MGH0lh67Q3Tr4uhckvpHkBMjcXin=s88-c-k-c0x00ffffff-no-rj,PSYCHOPATHE : ils se cachent parmi vos PROCHES,https://www.youtube.com/watch?v=BVlzubK8CGE,euuhhh,'27/08/2025 16:00,00:36:01,42825,1322,171,"En stream tous les mardis, jeudis et dimanches dès","react, réact, reactfr, react francais, react français, réct français, euh, euuhhh, roro, un créatif, twitch, stream, live, mascu, argent, entrepreneur, coach, complotiste, new age, société, dev perso, développement personnel, humour, divertissement",24,https://i.ytimg.com/vi/BVlzubK8CGE/hqdefault.jpg,,127
https://yt3.ggpht.com/3djzVEm99BYPivZxKHOa2z4_rfoE_bcVCjOmDM10vgp2MGH0lh67Q3Tr4uhckvpHkBMjcXin=s88-c-k-c0x00ffffff-no-rj,Le MEILLEUR tuto de SURVIE (TW : blackface),https://www.youtube.com/watch?v=WolESfNcZLQ,euuhhh,'26/08/2025 16:01,00:35:55,31018,1136,115,"En stream tous les mardis, jeudis et dimanches dès","react, réact, reactfr, react francais, react français, réct français, euh, euuhhh, roro, un créatif, twitch, stream, live, mascu, argent, entrepreneur, coach, complotiste, new age, société, dev perso, développement personnel, humour, divertissement",24,https://i.ytimg.com/vi/WolESfNcZLQ/hqdefault.jpg,,128
https://yt3.ggpht.com/iBKTl0OpZcX2gPky0MGPMmvlstkNQDzlg-lP6Khje4DJx6z9u7EaPq1p3fLyDuscrrLP_GbJNA=s88-c-k-c0x00ffffff-no-rj,Le scandale philosophique derrière Fight Club,https://www.youtube.com/watch?v=IAz3GSeJaHg,Cato Minor,'23/05/2025 15:00,00:31:35,280348,12675,628,"Un classique du cinéma, son livre d’origine, un au","Camus, Nietzsche, Descartes, solipsisme, philosophie, philo, absurde, Sartre, schizophrène",24,https://i.ytimg.com/vi/IAz3GSeJaHg/hqdefault.jpg,,140
https://yt3.ggpht.com/3djzVEm99BYPivZxKHOa2z4_rfoE_bcVCjOmDM10vgp2MGH0lh67Q3Tr4uhckvpHkBMjcXin=s88-c-k-c0x00ffffff-no-rj,Ses COU*LLES PLEINES ont une MEILLEURE VIE que NOUS,https://www.youtube.com/watch?v=wG2TlCnYwoE,euuhhh,'31/07/2025 16:01,00:39:13,67273,1861,412,"En stream tous les mardis, jeudis et dimanches dès","react, réact, reactfr, react francais, react français, réct français, euh, euuhhh, roro, un créatif, twitch, stream, live, mascu, argent, entrepreneur, coach, complotiste, new age, société, dev perso, développement personnel, humour, divertissement",24,https://i.ytimg.com/vi/wG2TlCnYwoE/hqdefault.jpg,,143
https://yt3.ggpht.com/3djzVEm99BYPivZxKHOa2z4_rfoE_bcVCjOmDM10vgp2MGH0lh67Q3Tr4uhckvpHkBMjcXin=s88-c-k-c0x00ffffff-no-rj,Le DOWNFALL de la POÉSIE,https://www.youtube.com/watch?v=kq-eJiP8AnM,euuhhh,'28/07/2025 16:01,00:36:26,34074,914,244,"[Pub ""HOLY""] : Profitez de 5 euros de réduction su","react, réact, reactfr, react francais, react français, réct français, euh, euuhhh, roro, un créatif, twitch, stream, live, mascu, argent, entrepreneur, coach, complotiste, new age, société, dev perso, développement personnel, humour, divertissement",24,https://i.ytimg.com/vi/kq-eJiP8AnM/hqdefault.jpg,,148
https://yt3.ggpht.com/3djzVEm99BYPivZxKHOa2z4_rfoE_bcVCjOmDM10vgp2MGH0lh67Q3Tr4uhckvpHkBMjcXin=s88-c-k-c0x00ffffff-no-rj,LIBERLAND : Le premier PAYS pour les CRYPTOBROS,https://www.youtube.com/watch?v=E1o3SYbg8HA,euuhhh,'22/07/2025 16:00,00:35:56,54839,1470,230,"Chaine Twitch : https://www.twitch.tv/euuhhh__

Cr",,24,https://i.ytimg.com/vi/E1o3SYbg8HA/hqdefault.jpg,,153
https://yt3.ggpht.com/3djzVEm99BYPivZxKHOa2z4_rfoE_bcVCjOmDM10vgp2MGH0lh67Q3Tr4uhckvpHkBMjcXin=s88-c-k-c0x00ffffff-no-rj,Ils veulent quitter la France : POURQUOI ?,https://www.youtube.com/watch?v=IZUuALqgArI,euuhhh,'15/07/2025 16:00,00:39:22,44969,1144,394,"Chaine Twitch : https://www.twitch.tv/euuhhh__

Cr",,24,https://i.ytimg.com/vi/IZUuALqgArI/hqdefault.jpg,,157
https://yt3.ggpht.com/3djzVEm99BYPivZxKHOa2z4_rfoE_bcVCjOmDM10vgp2MGH0lh67Q3Tr4uhckvpHkBMjcXin=s88-c-k-c0x00ffffff-no-rj,On découvre le YouTube des COMPLOTISTES,https://www.youtube.com/watch?v=tsnk7An0YCU,euuhhh,'09/07/2025 16:01,00:39:14,108474,2242,335,"Chaine Twitch : https://www.twitch.tv/euuhhh__

[P",,24,https://i.ytimg.com/vi/tsnk7An0YCU/hqdefault.jpg,,163
https://yt3.ggpht.com/3djzVEm99BYPivZxKHOa2z4_rfoE_bcVCjOmDM10vgp2MGH0lh67Q3Tr4uhckvpHkBMjcXin=s88-c-k-c0x00ffffff-no-rj,LE SEXY GOUROU EXCITE MÊME LES CLÉBARDS,https://www.youtube.com/watch?v=O7xO9bikrbM,euuhhh,'08/07/2025 16:00,00:36:22,66316,2205,381,"Chaine Twitch : https://www.twitch.tv/euuhhh__

[P",,24,https://i.ytimg.com/vi/O7xO9bikrbM/hqdefault.jpg,,164
https://yt3.ggpht.com/3djzVEm99BYPivZxKHOa2z4_rfoE_bcVCjOmDM10vgp2MGH0lh67Q3Tr4uhckvpHkBMjcXin=s88-c-k-c0x00ffffff-no-rj,Est-ce que les jeunes entrepreneurs vont bien ?,https://www.youtube.com/watch?v=i_SQnzneSwU,euuhhh,'02/07/2025 16:01,00:30:13,59858,1786,319,"Chaine Twitch : https://www.twitch.tv/euuhhh__

[P",,24,https://i.ytimg.com/vi/i_SQnzneSwU/hqdefault.jpg,,169
https://yt3.ggpht.com/3djzVEm99BYPivZxKHOa2z4_rfoE_bcVCjOmDM10vgp2MGH0lh67Q3Tr4uhckvpHkBMjcXin=s88-c-k-c0x00ffffff-no-rj,"Le pote à ""SDF to Millionnaire"" est devenu un GOUROU",https://www.youtube.com/watch?v=I6cFTXtb-5w,euuhhh,'29/06/2025 16:00,00:36:20,83050,1876,240,"Chaine Twitch : https://www.twitch.tv/euuhhh__

[P",,24,https://i.ytimg.com/vi/I6cFTXtb-5w/hqdefault.jpg,,171
https://yt3.ggpht.com/3djzVEm99BYPivZxKHOa2z4_rfoE_bcVCjOmDM10vgp2MGH0lh67Q3Tr4uhckvpHkBMjcXin=s88-c-k-c0x00ffffff-no-rj,Une RETRAITE SPIRITUELLE pour apprendre à AIMER L'ARGENT,https://www.youtube.com/watch?v=KJbxkE56xTk,euuhhh,'11/06/2025 16:00,00:33:23,44528,1007,115,"Chaine Twitch : https://www.twitch.tv/euuhhh__

[P",,24,https://i.ytimg.com/vi/KJbxkE56xTk/hqdefault.jpg,,179
https://yt3.ggpht.com/3djzVEm99BYPivZxKHOa2z4_rfoE_bcVCjOmDM10vgp2MGH0lh67Q3Tr4uhckvpHkBMjcXin=s88-c-k-c0x00ffffff-no-rj,Il paie 5.000 € pour la PIRE journée de sa vie (le pauvre),https://www.youtube.com/watch?v=yDxEFN-80vo,euuhhh,'03/06/2025 16:01,00:30:52,86525,2021,189,"Chaine Twitch : https://www.twitch.tv/euuhhh__

[P",,24,https://i.ytimg.com/vi/yDxEFN-80vo/hqdefault.jpg,,184
https://yt3.ggpht.com/3djzVEm99BYPivZxKHOa2z4_rfoE_bcVCjOmDM10vgp2MGH0lh67Q3Tr4uhckvpHkBMjcXin=s88-c-k-c0x00ffffff-no-rj,Ils s’empêchent de MANGER et BOIRE (dangereux),https://www.youtube.com/watch?v=FsahsH8PXRM,euuhhh,'02/06/2025 16:00,00:30:09,56765,1436,246,"[Pub ""HOLY""] : Profitez de 5 euros de réduction su",,24,https://i.ytimg.com/vi/FsahsH8PXRM/hqdefault.jpg,,185
https://yt3.ggpht.com/HP9oIpL42ufzvCEBTLzxAtpZae1rfLzdte8tnlh-Qi0yjIprNPDqHXiR-XvxMe5eyFUC5Fensl0=s88-c-k-c0x00ffffff-no-rj,GOOGLE AI ULTRA ! (la fin de ChatGPT... ?) – Test Complet,https://www.youtube.com/watch?v=A87bE7dbBdg,Ludo Salenne,'22/05/2025 15:37,00:33:37,55966,1459,188,Google vient de frapper un grand coup dans le mond,"Google AI Ultra, Google Gemini, Gemini 2.5 pro, Gemini 2.5 flash, Test Google AI Ultra, Test Google Gemini, Imagen 4, whisk google, flow google, AI Mode Google, Google Search, Google Chrome, IA Google, Outils Google, Outils IA, Gemini Ultra, Tuto Google Gemini, Demo Google Gemini, Demo Google AI Ultra, google gemini fr, gemini vs chatgpt, google gemini ai, google vs openai, google gemini 2.5, google gemini live, agent ia google",28,https://i.ytimg.com/vi/A87bE7dbBdg/hqdefault.jpg,,195
https://yt3.ggpht.com/3djzVEm99BYPivZxKHOa2z4_rfoE_bcVCjOmDM10vgp2MGH0lh67Q3Tr4uhckvpHkBMjcXin=s88-c-k-c0x00ffffff-no-rj,Elles sont FANS de croisières alors que c'est NUL,https://www.youtube.com/watch?v=DbCrgboK8WE,euuhhh,'19/05/2025 16:00,00:35:23,77797,1499,182,"[Pub ""HOLY""] : Profitez de 5 euros de réduction su",,24,https://i.ytimg.com/vi/DbCrgboK8WE/hqdefault.jpg,,197
https://yt3.ggpht.com/HP9oIpL42ufzvCEBTLzxAtpZae1rfLzdte8tnlh-Qi0yjIprNPDqHXiR-XvxMe5eyFUC5Fensl0=s88-c-k-c0x00ffffff-no-rj,Ma nouvelle méthode pour gagner 5H/JOUR avec l'IA et CHATGPT,https://www.youtube.com/watch?v=UwooV2349PA,Ludo Salenne,'07/05/2025 14:29,00:35:39,52056,1884,130,Il y a un gros piège avec ChatGPT et les outils d',"chatgpt, chat gpt, outils ia, outils intelligence artificielle, chatgpt deep research, google ai studio, google ai, notebook lm, notebooklm, google gemini, gemini 2.5 pro, gens park, genspark, genspark ai, genspark chatgpt, gemini chatgpt, tuto ia, tuto chatgpt, productivité, être plus productif, être plus productif au travail, productivité chatgpt, outils productivité, application productivité, cours chatgpt, travailler plus vite, travailler plus efficacement",28,https://i.ytimg.com/vi/UwooV2349PA/hqdefault.jpg,,202
https://yt3.ggpht.com/3djzVEm99BYPivZxKHOa2z4_rfoE_bcVCjOmDM10vgp2MGH0lh67Q3Tr4uhckvpHkBMjcXin=s88-c-k-c0x00ffffff-no-rj,Babylon Musk tombe dans les griffes de l'arnaqueur d'Egypte,https://www.youtube.com/watch?v=NqGP-EJJjRg,euuhhh,'07/05/2025 16:00,00:37:01,42691,965,121,"Chaine Twitch : https://www.twitch.tv/euuhhh__

[P",,24,https://i.ytimg.com/vi/NqGP-EJJjRg/hqdefault.jpg,,203
https://yt3.ggpht.com/3djzVEm99BYPivZxKHOa2z4_rfoE_bcVCjOmDM10vgp2MGH0lh67Q3Tr4uhckvpHkBMjcXin=s88-c-k-c0x00ffffff-no-rj,Il a très PEUR du regard des AUTRES,https://www.youtube.com/watch?v=SpQfAo2sSQI,euuhhh,'21/04/2025 16:00,00:30:20,48789,1079,107,"[Pub ""HOLY""] : Profitez de 5 euros de réduction su",,24,https://i.ytimg.com/vi/SpQfAo2sSQI/hqdefault.jpg,,211
https://yt3.ggpht.com/3djzVEm99BYPivZxKHOa2z4_rfoE_bcVCjOmDM10vgp2MGH0lh67Q3Tr4uhckvpHkBMjcXin=s88-c-k-c0x00ffffff-no-rj,Avez-vous l'air d'un PRÉDATEUR ?,https://www.youtube.com/watch?v=stl3MzJIub4,euuhhh,'08/04/2025 16:01,00:32:31,54202,1370,258,"Chaine Twitch : https://www.twitch.tv/euuhhh__

[P",,24,https://i.ytimg.com/vi/stl3MzJIub4/hqdefault.jpg,,216
https://yt3.ggpht.com/3djzVEm99BYPivZxKHOa2z4_rfoE_bcVCjOmDM10vgp2MGH0lh67Q3Tr4uhckvpHkBMjcXin=s88-c-k-c0x00ffffff-no-rj,On vous a MENTI à propos de PARIS,https://www.youtube.com/watch?v=0na0DEqxERk,euuhhh,'24/03/2025 17:00,00:38:55,84526,1762,284,"[Pub ""HOLY""] : Profitez de 5 euros de réduction su",,24,https://i.ytimg.com/vi/0na0DEqxERk/hqdefault.jpg,,225
https://yt3.ggpht.com/v2D0WfvIE1yLmfHoUZdn2dwgPiDEqAbeK5ZBXdo-ZfbZ_8db-GO9qp49wp4KtadZdZvpCf8o=s88-c-k-c0x00ffffff-no-rj,"""À 27 ans j'ai créé une banque"" | 20 minutes avec le PDG de Trade Republic",https://www.youtube.com/watch?v=Z4F6Ei2iYIs,Romain Lanéry,'24/11/2024 17:07,00:34:49,44053,1586,89,Christian Hecker a créé une banque de A à Z en moi,"romain lanéry, Trade Republic, Christian Hecker, investissement, épargne, finance personnelle, éducation financière, banque numérique, croissance économique, marché boursier, intérêts composés, entrepreneuriat, services bancaires, stratégie d'investissement, ETF, dividendes, cryptomonnaie, interview, 20 minutes avec",27,https://i.ytimg.com/vi/Z4F6Ei2iYIs/hqdefault.jpg,,230
https://yt3.ggpht.com/3djzVEm99BYPivZxKHOa2z4_rfoE_bcVCjOmDM10vgp2MGH0lh67Q3Tr4uhckvpHkBMjcXin=s88-c-k-c0x00ffffff-no-rj,Donc les MICHTOS existent ?,https://www.youtube.com/watch?v=tm-CsPxa0gI,euuhhh,'05/03/2025 17:01,00:36:05,80194,1706,294,"Chaine Twitch : https://www.twitch.tv/euuhhh__

[P",,24,https://i.ytimg.com/vi/tm-CsPxa0gI/hqdefault.jpg,,240
