channelAvatar,title,link,channel,publishedAt,duration,views,likes,comments,shortDescription,tags,category,thumbnail,myCategory,playlistPosition
https://yt3.ggpht.com/MopgmVAFV9BqlzOJ-UINtmutvEPcNe5IbKMmP_4vZZo3vnJXcZGtybUBsXaEVxkmxKyGqX9R=s88-c-k-c0x00ffffff-no-rj,Turning contracts into searchable data at OpenAI,https://www.youtube.com/watch?v=i-O37AtVkp0,OpenAI,'29/09/2025 20:59,00:01:54,22791,516,0,OpenAI built DocuGPT to turn messy contract files ,,28,https://i.ytimg.com/vi/i-O37AtVkp0/hqdefault.jpg,,16
https://yt3.ggpht.com/MopgmVAFV9BqlzOJ-UINtmutvEPcNe5IbKMmP_4vZZo3vnJXcZGtybUBsXaEVxkmxKyGqX9R=s88-c-k-c0x00ffffff-no-rj,Driving sales productivity and customer success at OpenAI,https://www.youtube.com/watch?v=JLsZoR_3-J8,OpenAI,'29/09/2025 20:59,00:01:47,10740,267,0,Sales teams at OpenAI use GTM Assistant to work sm,,28,https://i.ytimg.com/vi/JLsZoR_3-J8/hqdefault.jpg,,17
https://yt3.ggpht.com/MopgmVAFV9BqlzOJ-UINtmutvEPcNe5IbKMmP_4vZZo3vnJXcZGtybUBsXaEVxkmxKyGqX9R=s88-c-k-c0x00ffffff-no-rj,Empowering teams to unlock insights faster at OpenAI,https://www.youtube.com/watch?v=hzpPKuaJISk,OpenAI,'29/09/2025 21:00,00:02:07,6708,139,0,"Millions of support tickets, research notes, and p",,28,https://i.ytimg.com/vi/hzpPKuaJISk/hqdefault.jpg,,18
https://yt3.ggpht.com/MopgmVAFV9BqlzOJ-UINtmutvEPcNe5IbKMmP_4vZZo3vnJXcZGtybUBsXaEVxkmxKyGqX9R=s88-c-k-c0x00ffffff-no-rj,Improving support with every interaction at OpenAI,https://www.youtube.com/watch?v=Up7LFjsH6aU,OpenAI,'29/09/2025 21:00,00:02:21,7700,157,0,Great support is about speed and quality. See how ,,28,https://i.ytimg.com/vi/Up7LFjsH6aU/hqdefault.jpg,,19
https://yt3.ggpht.com/MopgmVAFV9BqlzOJ-UINtmutvEPcNe5IbKMmP_4vZZo3vnJXcZGtybUBsXaEVxkmxKyGqX9R=s88-c-k-c0x00ffffff-no-rj,Converting inbound leads into customers at OpenAI,https://www.youtube.com/watch?v=mWeVr6f50V0,OpenAI,'29/09/2025 21:00,00:02:33,30227,558,0,"Turning inbound leads into customers takes quick, ",,28,https://i.ytimg.com/vi/mWeVr6f50V0/hqdefault.jpg,,20
https://yt3.ggpht.com/ytc/AIdro_m8gETDSV_0VHErh636LThB0fJZqNLaBwGDXhm-K7D6RAI=s88-c-k-c0x00ffffff-no-rj,David Castello-Lopes s’intéresse à la guerre des camions  | 28 minutes | ARTE,https://www.youtube.com/watch?v=ouUFFh2PzPc,28 minutes - ARTE,'26/09/2025 18:45,00:04:38,95017,2905,222,David Castello-Lopes est fasciné depuis sa plus te,"28 minutes, Arte, actualité, David Castello-Lopes, Camions, Le Mans, Courses, Enfants, Jouets",25,https://i.ytimg.com/vi/ouUFFh2PzPc/hqdefault.jpg,,38
https://yt3.ggpht.com/ytc/AIdro_lkVaNhageaI16bK9I-PdBoVCGM53UUUBP9Nd7sBJ-tCGY=s88-c-k-c0x00ffffff-no-rj,How to share your Apple Vision Pro with Guest User | Apple Support,https://www.youtube.com/watch?v=hP6Mt_LVJA0,Apple Support,'26/09/2025 16:12,00:03:29,8762,263,10,Turn on Guest User when someone else wants to expe,"Vision pro guest mode, apple vision pro guest mode, guest user vision pro, vision pro guest",27,https://i.ytimg.com/vi/hP6Mt_LVJA0/hqdefault.jpg,,42
https://yt3.ggpht.com/ytc/AIdro_l-3C1Ty2tIjUA-nERqLsPVbIlUJitbqM7VWXaS7kDBNA=s88-c-k-c0x00ffffff-no-rj,La Fille Magique Ep3,https://www.youtube.com/watch?v=Ui5B9megJJo,Yes vous aime,'24/09/2025 16:00,00:04:54,31243,3331,127,"💖La Fille Magique 💖


Réalisation : Moustafa Benaï",,23,https://i.ytimg.com/vi/Ui5B9megJJo/hqdefault.jpg,,53
https://yt3.ggpht.com/XoPSuGDxwgLvhCATWsvXHbVJ3oN6KvK00k9Pc0IJm8vQcSbE1KVAQMGk8_d3Pfu6QOJHHoBSMn0=s88-c-k-c0x00ffffff-no-rj,"In your face, père Noël ! | Tu mourras moins bête | ARTE",https://www.youtube.com/watch?v=wr6qF90s9Ts,Tu mourras moins bête - ARTE,'22/09/2025 15:01,00:03:30,39893,2647,60,"In your face, père Noël ! 

Il existe des cherche","ARTE, Série fiction, TV, santa, tmmb, tu mourras moins bête, science, scientifique, saison 4, épisode, professeur moustache, Nathanaël, animation, humour, drôle, humouristique, apprentissage, saison, question, Père Noël, Noël",1,https://i.ytimg.com/vi/wr6qF90s9Ts/hqdefault.jpg,,60
https://yt3.ggpht.com/ytc/AIdro_m8gETDSV_0VHErh636LThB0fJZqNLaBwGDXhm-K7D6RAI=s88-c-k-c0x00ffffff-no-rj,David Castello-Lopes va à la pêche aux silures dans la Seine | 28 minutes | ARTE,https://www.youtube.com/watch?v=xXYhyBb9MNU,28 minutes - ARTE,'19/09/2025 18:45,00:04:32,60724,1812,128,David Castello-Lopes est parti à la pêche aux silu,"Débat, 28 minutes, Arte, Élisabeth quin, actualité, international, David Castello-Lopes, silures, poisson, pêche, Bill François",25,https://i.ytimg.com/vi/xXYhyBb9MNU/hqdefault.jpg,,72
https://yt3.ggpht.com/ytc/AIdro_kD-uOjJ71ZHwOBUKxfovzXcIVd-K-ufaRvN2kZWuObvks=s88-c-k-c0x00ffffff-no-rj,iPhone 17 Pro | Le Pro par excellence | Apple,https://www.youtube.com/watch?v=tbuEpf8dmqk,Apple France,'19/09/2025 10:02,00:00:31,2136696,592,0,Voici lʼiPhone 17 Pro. Avec son design résistant e,"Apple, Apple France",28,https://i.ytimg.com/vi/tbuEpf8dmqk/hqdefault.jpg,,77
https://yt3.ggpht.com/s5hlNKKDDQWjFGzYNnh8UeOW2j2w6id-cZGx7GdAA3d5Fu7zEi7ZMXEyslysuQUKigXNxtAB=s88-c-k-c0x00ffffff-no-rj,iPhone 17 Pro | The Ultimate Pro | Apple,https://www.youtube.com/watch?v=h6CwwHyQxKI,Apple,'19/09/2025 00:00,00:01:06,3746598,9668,0,This is iPhone 17 Pro. With a durable design and 4,"iPhone 17 Pro, iPhone, Apple, 8x zoom, Ceramic Shield",28,https://i.ytimg.com/vi/h6CwwHyQxKI/hqdefault.jpg,,79
https://yt3.ggpht.com/ytc/AIdro_l-3C1Ty2tIjUA-nERqLsPVbIlUJitbqM7VWXaS7kDBNA=s88-c-k-c0x00ffffff-no-rj,La Fille Magique Ep2,https://www.youtube.com/watch?v=3M1V0D-tdpY,Yes vous aime,'17/09/2025 16:02,00:04:28,42550,4943,212,"💖La Fille Magique 💖


Réalisation : Moustafa Benaï",,23,https://i.ytimg.com/vi/3M1V0D-tdpY/hqdefault.jpg,,88
https://yt3.ggpht.com/XoPSuGDxwgLvhCATWsvXHbVJ3oN6KvK00k9Pc0IJm8vQcSbE1KVAQMGk8_d3Pfu6QOJHHoBSMn0=s88-c-k-c0x00ffffff-no-rj,Bavissimo ! | Tu mourras moins bête | ARTE,https://www.youtube.com/watch?v=8XM4eMWrwdU,Tu mourras moins bête - ARTE,'15/09/2025 15:00,00:03:27,79493,3891,61,"Bavissimo !

Est-ce une bonne idée d’utiliser sa ","ARTE, Série fiction, TV, tmmb, tu mourras moins bête, science, scientifique, saison 4, épisode, professeur moustache, Nathanaël, animation, humour, drôle, humouristique, apprentissage, saison, question, Légendes, salive, nettoyer, propre, sale, langue, bouche",1,https://i.ytimg.com/vi/8XM4eMWrwdU/hqdefault.jpg,,98
https://yt3.ggpht.com/Cqpev-jwI2T93yVHNiY0iHTLeD6Q1BZjSh7UntPGAJ288xNSdtbqhuK5VPscZuP9B_ASZI8nog=s88-c-k-c0x00ffffff-no-rj,Rilès - DON'T CRY MY LOVE,https://www.youtube.com/watch?v=wCyomfcgx-o,Rilès,'15/09/2025 16:00,00:03:23,611508,19330,646,"ON TOUR: https://shtgn.live/artist/0riles 

http:/","Rilès - DON'T CRY MY LOVE, riles dont cry my love, Don't cry my love clip rilès, rilès, dont cry my love, survival, dont cry my heart",10,https://i.ytimg.com/vi/wCyomfcgx-o/hqdefault.jpg,,99
https://yt3.ggpht.com/s5hlNKKDDQWjFGzYNnh8UeOW2j2w6id-cZGx7GdAA3d5Fu7zEi7ZMXEyslysuQUKigXNxtAB=s88-c-k-c0x00ffffff-no-rj,Catch up quick | Apple September event highlights,https://www.youtube.com/watch?v=31MbUHX7W8k,Apple,'09/09/2025 18:34,00:02:35,2220941,44578,0,Here’s a quick recap of the good things coming you,"Apple, Apple Event, Apple Keynote, Apple special event, September 2025, 2025, keynote, iPhone 17, iPhone 17 Pro, iPhone Air, AirPods, AirPods Pro 3, Apple Watch Series 11, Apple Watch Ultra 3, Apple Watch SE 3, A19 chip, A19 Pro chip, Vapor Chamber, Center Stage front camera, portrait selfies, landscape selfies, 8x Telephoto, Dual Capture, Crossbody Strap, heart rate sensor, Active Noise Cancellation, sleep score, satellite communications, hypertension, iOS26",28,https://i.ytimg.com/vi/31MbUHX7W8k/hqdefault.jpg,,137
https://yt3.ggpht.com/ytc/AIdro_kjbQEFDiUGUQMyo7ETYP4DZI4piL-3msIXiyhE8V9one8=s88-c-k-c0x00ffffff-no-rj,Slow Horses — Seasons 1-4 Recap | Apple TV+,https://www.youtube.com/watch?v=osgVw3T82Gc,Apple TV,'08/09/2025 16:59,00:02:28,40491,645,33,"A compromised agent, a destabilized London, and a ","slow horses, recap, slow horses season recap, trailer, trailers, slow horses trailer, trailer slow horses, official trailer, slow horses official trailer, gary oldman, jack lowden, kristin scott thomas, chris reilly, saskia reeves, rosalind eleazar, christopher chung, hugo weaving, joanna scanlan, ruth bradley, jackson lamb, spy, spies, agent, mi5, british intelligence, series, show, apple tv, apple, tv, apple tv+, apple tv plus, apple tv app, apple original, thriller, comedy",24,https://i.ytimg.com/vi/osgVw3T82Gc/hqdefault.jpg,,141
https://yt3.ggpht.com/XoPSuGDxwgLvhCATWsvXHbVJ3oN6KvK00k9Pc0IJm8vQcSbE1KVAQMGk8_d3Pfu6QOJHHoBSMn0=s88-c-k-c0x00ffffff-no-rj,DIY corporel | Tu mourras moins bête | ARTE,https://www.youtube.com/watch?v=V123lF8SVsE,Tu mourras moins bête - ARTE,'08/09/2025 15:00,00:03:27,45569,2979,74,"DIY corporel

Diverses légendes Inuits racontent ","ARTE, Série fiction, TV, tmmb, tu mourras moins bête, science, scientifique, saison 4, épisode, professeur moustache, Nathanaël, animation, humour, drôle, humouristique, apprentissage, saison, question, Légendes, climat glacial, Survie",1,https://i.ytimg.com/vi/V123lF8SVsE/hqdefault.jpg,,142
https://yt3.ggpht.com/Xh9JEQHtgriFgfP4zJ7u63tyeN1b9QUAEl_m05PKEbbkyE7JG-1lM_dW4_AV_SuXuM4Do_fKHg=s88-c-k-c0x00ffffff-no-rj,Kemar - Libre ,https://www.youtube.com/watch?v=0o1pBRmfrKY,Kemar,'07/09/2025 14:46,00:04:19,53838,4076,345,"1 instant : 2 vies


Réalisé par Benjamin Sibioude",,23,https://i.ytimg.com/vi/0o1pBRmfrKY/hqdefault.jpg,,146
https://yt3.ggpht.com/X6kguruUc4JHySApVt9fRva4Wl8TV7KTmJPBKAUW6HEe576TwB39x3aJVC4tRZlCPQfgPXerTw=s88-c-k-c0x00ffffff-no-rj,The Network Effects of Uber: Under the Hood,https://www.youtube.com/watch?v=yEminPU_7cc,NFX,'20/12/2017 19:02,00:02:58,43337,619,7,To learn how to use the Network Effects Map for yo,"network effects, nfx, nfx guild, uber, case study, investors, investments, venture capital, funds, invest, marketplace, marketplace network effect, network effects map, map, nfx case study, san francisco, sf, silicon valley, tech, startup, strategy, success, magic, houdini",22,https://i.ytimg.com/vi/yEminPU_7cc/hqdefault.jpg,,173
https://yt3.ggpht.com/NYPQOphN46jHnPatbZw_uvkQGAP3b4enN0fqvmUSTnD8Jyy2SHqIpqA1lDl2cEdtf672MrPzVA=s88-c-k-c0x00ffffff-no-rj,PTSD / SPORT (EXCLUS),https://www.youtube.com/watch?v=ZLbhdLCE4NQ,VALD,'01/09/2025 20:18,00:02:11,419375,16847,583,PTSD / SPORT produits par Vladimir Cauchemar et To,,10,https://i.ytimg.com/vi/ZLbhdLCE4NQ/hqdefault.jpg,,179
https://yt3.ggpht.com/XoPSuGDxwgLvhCATWsvXHbVJ3oN6KvK00k9Pc0IJm8vQcSbE1KVAQMGk8_d3Pfu6QOJHHoBSMn0=s88-c-k-c0x00ffffff-no-rj,Les plantes se cachent pour pourrir | Tu mourras moins bête | ARTE,https://www.youtube.com/watch?v=lA5l99R-h_8,Tu mourras moins bête - ARTE,'01/09/2025 15:01,00:03:29,78550,4510,165,"Les plantes se cachent pour pourrir

Soudain, tan","ARTE, Série fiction, TV, tmmb, tu mourras moins bête, science, scientifique, saison 4, épisode, professeur moustache, Nathanaël, animation, humour, drôle, humouristique, apprentissage, saison, question, Plantes, jardin, jardinage",1,https://i.ytimg.com/vi/lA5l99R-h_8/hqdefault.jpg,,180
https://yt3.ggpht.com/YMRZbg8UjcGgiFOj4qxIWynUkxkV9h5KcpbQGO3yuJnU34Lga3UJeCEAP3T-t7MmNj8Yxsw-EQ=s88-c-k-c0x00ffffff-no-rj,The New Model Y Performance | Tesla,https://www.youtube.com/watch?v=_XvHhFjrbn0,Tesla,'29/08/2025 05:49,00:00:59,353598,12465,1267,Now available in the US & Europe — Designed to del,"tesla, model s, model x, model 3, powerwall, electric car, elon musk, ludicrous, battery",2,https://i.ytimg.com/vi/_XvHhFjrbn0/hqdefault.jpg,,183
https://yt3.ggpht.com/ytc/AIdro_mOi592b8aS6uSjaffpWAYWESOpAmZRBrxR_9RXx7RR6cQ=s88-c-k-c0x00ffffff-no-rj,Redouanne Harjane - Le mec le plus stylé de France ,https://www.youtube.com/watch?v=kGRPO_HYwK0,Redouanne Harjane,'24/08/2025 18:17,00:01:43,2269,122,2,En spectacle à Paris et en tournée. Billetterie ou,,23,https://i.ytimg.com/vi/kGRPO_HYwK0/hqdefault.jpg,,192
https://yt3.ggpht.com/MopgmVAFV9BqlzOJ-UINtmutvEPcNe5IbKMmP_4vZZo3vnJXcZGtybUBsXaEVxkmxKyGqX9R=s88-c-k-c0x00ffffff-no-rj,Uber uses GPT-5 to balance speed and quality,https://www.youtube.com/watch?v=L--pCNSt3F4,OpenAI,'19/08/2025 17:00,00:00:43,22165,568,0,Uber's early explorations with GPT-5 have shown th,,28,https://i.ytimg.com/vi/L--pCNSt3F4/hqdefault.jpg,,200
https://yt3.ggpht.com/6Nro_o284NE8owgOZaNzChPdijwrVjQS93Bwp3ESccRTWofPcthJ3OZc4plxirmQvTFhjBO2iA=s88-c-k-c0x00ffffff-no-rj,Franjo : Entre Deux Escabeaux,https://www.youtube.com/watch?v=U9Eyd6PjKHk,billet réduc,'23/11/2024 13:40,00:03:45,6659,286,12,Merci à Franjo d’avoir eu la patience de discuter ,,22,https://i.ytimg.com/vi/U9Eyd6PjKHk/hqdefault.jpg,,212
https://yt3.ggpht.com/MopgmVAFV9BqlzOJ-UINtmutvEPcNe5IbKMmP_4vZZo3vnJXcZGtybUBsXaEVxkmxKyGqX9R=s88-c-k-c0x00ffffff-no-rj,Powering Creativity with GPT-5,https://www.youtube.com/watch?v=kjKMZZiO-lM,OpenAI,'07/08/2025 18:34,00:02:09,101388,1615,156,GPT-5 is our most creative and best writing model ,,28,https://i.ytimg.com/vi/kjKMZZiO-lM/hqdefault.jpg,,216
https://yt3.ggpht.com/MopgmVAFV9BqlzOJ-UINtmutvEPcNe5IbKMmP_4vZZo3vnJXcZGtybUBsXaEVxkmxKyGqX9R=s88-c-k-c0x00ffffff-no-rj,Empowering a Medical Researcher with GPT-5,https://www.youtube.com/watch?v=J_IvPcrTtdo,OpenAI,'07/08/2025 18:34,00:02:07,195936,6008,270,"GPT-5 is our most intelligent model to date, capab",,28,https://i.ytimg.com/vi/J_IvPcrTtdo/hqdefault.jpg,,218
https://yt3.ggpht.com/lBn7AF8kxnU7qijRluhSxlQuXCOPhVj__ialrcOH1IZMUpZ1AmuHhLadbl2HFGNOAgFjMzNGEw=s88-c-k-c0x00ffffff-no-rj,FLIPPÉ SAISON 2 #20 - L'OEIL DU CYCLONE,https://www.youtube.com/watch?v=xeofm-7xMUA,Studio Bagel,'30/07/2025 15:30,00:02:57,51381,2642,97,Après une discussion délicate qu'il a eue avec Aur,"studio bagel, studio, bagel, humour, comedie, drole, marrant, sketch, parodie, podcast",23,https://i.ytimg.com/vi/xeofm-7xMUA/hqdefault.jpg,,227
https://yt3.ggpht.com/XoPSuGDxwgLvhCATWsvXHbVJ3oN6KvK00k9Pc0IJm8vQcSbE1KVAQMGk8_d3Pfu6QOJHHoBSMn0=s88-c-k-c0x00ffffff-no-rj,"Skynet, l'inintelligence artificielle | Tu mourras moins bête avec ARTE",https://www.youtube.com/watch?v=9wfR4ApamN0,Tu mourras moins bête - ARTE,'28/07/2025 15:00,00:03:32,72074,4047,85,"Un robot peut-il remonter le temps ? 

Si les robo","ARTE, Série fiction, TV, tmmb, tu mourras moins bête, science, scientifique, saison 4, professeur moustache, Nathanaël, animation, humour, drôle, humouristique, apprentissage, saison, question, robot, ordinateur, terminator, Skynet, IA, intelligence artificielle, futur",1,https://i.ytimg.com/vi/9wfR4ApamN0/hqdefault.jpg,,230
https://yt3.ggpht.com/lBn7AF8kxnU7qijRluhSxlQuXCOPhVj__ialrcOH1IZMUpZ1AmuHhLadbl2HFGNOAgFjMzNGEw=s88-c-k-c0x00ffffff-no-rj,FLIPPÉ SAISON 2 #19 - LE JEU DES VÉRITÉS,https://www.youtube.com/watch?v=HGXnrBKdXF0,Studio Bagel,'23/07/2025 15:30,00:02:38,46446,3227,85,Théo et Auriane jouent à un jeu qui n'appartient q,"studio bagel, studio, bagel, humour, comedie, drole, marrant, sketch, parodie, podcast",23,https://i.ytimg.com/vi/HGXnrBKdXF0/hqdefault.jpg,,234
https://yt3.ggpht.com/XoPSuGDxwgLvhCATWsvXHbVJ3oN6KvK00k9Pc0IJm8vQcSbE1KVAQMGk8_d3Pfu6QOJHHoBSMn0=s88-c-k-c0x00ffffff-no-rj,La pilosité des insectes | Tu mourras moins bête avec ARTE,https://www.youtube.com/watch?v=S81C3J6udiQ,Tu mourras moins bête - ARTE,'21/07/2025 15:00,00:03:29,74971,4375,80,"Pourquoi les insectes ont-ils des poils ?

Il exis","ARTE, Série fiction, TV, tmmb, tu mourras moins bête, science, scientifique, saison 4, épisode, professeur moustache, Nathanaël, animation, humour, drôle, humouristique, apprentissage, saison, question, corps, poils, insectes",1,https://i.ytimg.com/vi/S81C3J6udiQ/hqdefault.jpg,,239
https://yt3.ggpht.com/s5hlNKKDDQWjFGzYNnh8UeOW2j2w6id-cZGx7GdAA3d5Fu7zEi7ZMXEyslysuQUKigXNxtAB=s88-c-k-c0x00ffffff-no-rj,Apple Intelligence | Clean Up Photos: Cat | iPhone 16,https://www.youtube.com/watch?v=a6RX9kJ01Kw,Apple,'17/07/2025 16:04,00:01:06,824287,15906,0,"With Apple Intelligence, you can now remove distra","A.I., AI, Apple A.I., Artificial Intelligence, Apple Intelligence, iPhone, iPhone 16, iPhone 16 Pro, Genius, hello apple intelligence, Siri, Clean Up, Apple ad, cat, Garrett",28,https://i.ytimg.com/vi/a6RX9kJ01Kw/hqdefault.jpg,,241
https://yt3.ggpht.com/XoPSuGDxwgLvhCATWsvXHbVJ3oN6KvK00k9Pc0IJm8vQcSbE1KVAQMGk8_d3Pfu6QOJHHoBSMn0=s88-c-k-c0x00ffffff-no-rj,Enlarge your Homo erectus | Tu mourras moins bête avec ARTE,https://www.youtube.com/watch?v=cgk2tOL8BoM,Tu mourras moins bête - ARTE,'14/07/2025 15:01,00:03:29,90558,5750,112,"Peut-on avoir des bras bioniques ?

Dark Vador et ","ARTE, Série fiction, TV",1,https://i.ytimg.com/vi/cgk2tOL8BoM/hqdefault.jpg,,244
https://yt3.ggpht.com/ytc/AIdro_l-3C1Ty2tIjUA-nERqLsPVbIlUJitbqM7VWXaS7kDBNA=s88-c-k-c0x00ffffff-no-rj,CHICS TYPES EP. 4 - L'INCEL,https://www.youtube.com/watch?v=M_hIuD5q9Po,Yes vous aime,'11/07/2025 16:00,00:03:17,195611,12315,835,"CHICS TYPES Ep.4 : l'incel

Coucou les amis, avec ",,23,https://i.ytimg.com/vi/M_hIuD5q9Po/hqdefault.jpg,,247
https://yt3.ggpht.com/ytc/AIdro_kD-uOjJ71ZHwOBUKxfovzXcIVd-K-ufaRvN2kZWuObvks=s88-c-k-c0x00ffffff-no-rj,Libérer de l’espace de stockage sur votre Mac | Assistance Apple,https://www.youtube.com/watch?v=B7T5KhVoruk,Apple France,'11/07/2025 11:36,00:03:08,3368,48,0,Voici quelques articles qui vous permettront d’en ,"Apple, Apple France, libérer de l’espace disque sur mac, libérer de l’espace de stockage sur mac, consulter l’espace de stockage sur mac",28,https://i.ytimg.com/vi/B7T5KhVoruk/hqdefault.jpg,,249
https://yt3.ggpht.com/ytc/AIdro_l-3C1Ty2tIjUA-nERqLsPVbIlUJitbqM7VWXaS7kDBNA=s88-c-k-c0x00ffffff-no-rj,CHICS TYPES EP.3 - Le mec parfait,https://www.youtube.com/watch?v=SWLbkiKFDs0,Yes vous aime,'04/07/2025 16:00,00:02:52,169245,9836,227,"CHICS TYPES Ep.3 : le mec parfait 🤖🦾🤵🏻‍♂️

Coucou ",,23,https://i.ytimg.com/vi/SWLbkiKFDs0/hqdefault.jpg,,263
https://yt3.ggpht.com/XoPSuGDxwgLvhCATWsvXHbVJ3oN6KvK00k9Pc0IJm8vQcSbE1KVAQMGk8_d3Pfu6QOJHHoBSMn0=s88-c-k-c0x00ffffff-no-rj,Beauty Baby | Tu mourras moins bête avec ARTE,https://www.youtube.com/watch?v=ImS45MAHIHY,Tu mourras moins bête - ARTE,'30/06/2025 15:00,00:03:29,165187,8014,499,"Pourquoi les bébés sont-ils moches ?

Parfois, qua","ARTE, Série fiction, TV, tmmb, tu mourras moins bête, science, scientifique, saison 4, épisode, professeur moustache, Nathanaël, animation, humour, drôle, humouristique, apprentissage, saison, question, corps, épisode 5, bébé, enfant, moche, jésus, nouveau né, bébés",1,https://i.ytimg.com/vi/ImS45MAHIHY/hqdefault.jpg,,270
https://yt3.ggpht.com/ytc/AIdro_m8gETDSV_0VHErh636LThB0fJZqNLaBwGDXhm-K7D6RAI=s88-c-k-c0x00ffffff-no-rj,Intéressant : pourquoi y a-t-il des pièces de 10 000 euros ? | 28 minutes | ARTE,https://www.youtube.com/watch?v=ygUlgNin1Qg,28 minutes - ARTE,'29/06/2025 10:01,00:02:38,99089,3190,204,"Vous connaissez les pièces de 5 centimes, de 10 ce","ARTE, Magazine, TV, Le club international, 28 minutes, intéressant, david castello-lopes, monnaie de paris, pièces",25,https://i.ytimg.com/vi/ygUlgNin1Qg/hqdefault.jpg,,274
https://yt3.ggpht.com/ytc/AIdro_l-3C1Ty2tIjUA-nERqLsPVbIlUJitbqM7VWXaS7kDBNA=s88-c-k-c0x00ffffff-no-rj,CHICS TYPES - Ep. 2 Le prêtre,https://www.youtube.com/watch?v=3al7Qt-mTUc,Yes vous aime,'27/06/2025 16:00,00:04:10,163396,11080,749,"CHICS TYPES Ep.2 : le prêtre 🙏

Coucou les amis, a",,23,https://i.ytimg.com/vi/3al7Qt-mTUc/hqdefault.jpg,,277
https://yt3.ggpht.com/ytc/AIdro_kD-uOjJ71ZHwOBUKxfovzXcIVd-K-ufaRvN2kZWuObvks=s88-c-k-c0x00ffffff-no-rj,iPhone | App Store | Apple,https://www.youtube.com/watch?v=4HuCYlntXSA,Apple France,'26/06/2025 09:27,00:00:14,4131,110,0,La sécurité avant tout. Découvrez comment les cons,"Apple, Apple France",28,https://i.ytimg.com/vi/4HuCYlntXSA/hqdefault.jpg,,280
https://yt3.ggpht.com/ytc/AIdro_kD-uOjJ71ZHwOBUKxfovzXcIVd-K-ufaRvN2kZWuObvks=s88-c-k-c0x00ffffff-no-rj,iPhone | Localiser | Apple,https://www.youtube.com/watch?v=jpfZHRyxdQ4,Apple France,'26/06/2025 09:28,00:00:14,3606,77,0,"Savoir tout le monde à bon port, sans avoir à dema","Apple, Apple France",28,https://i.ytimg.com/vi/jpfZHRyxdQ4/hqdefault.jpg,,281
https://yt3.ggpht.com/ytc/AIdro_kD-uOjJ71ZHwOBUKxfovzXcIVd-K-ufaRvN2kZWuObvks=s88-c-k-c0x00ffffff-no-rj,iPhone | Ceramic Shield | Apple,https://www.youtube.com/watch?v=BzvqJ81v3vk,Apple France,'26/06/2025 09:28,00:00:15,4703,115,0,L’iPhone est conçu pour durer et résister aux épre,"Apple, Apple France",28,https://i.ytimg.com/vi/BzvqJ81v3vk/hqdefault.jpg,,282
https://yt3.ggpht.com/ytc/AIdro_m8gETDSV_0VHErh636LThB0fJZqNLaBwGDXhm-K7D6RAI=s88-c-k-c0x00ffffff-no-rj,Intéressant : pourquoi les chansons sont-elles de plus en plus courtes ? | 28 minutes | ARTE,https://www.youtube.com/watch?v=nDNJ_eq0rUI,28 minutes - ARTE,'22/06/2025 10:01,00:02:44,77747,2782,216,Si l’on écoute quelques-uns des succès musicaux mo,"ARTE, Magazine, TV, Le club international, 28 minutes, intéressant, david castello-lopes, chansons courtes, analyse, succès, charts",25,https://i.ytimg.com/vi/nDNJ_eq0rUI/hqdefault.jpg,,287
https://yt3.ggpht.com/ytc/AIdro_l-3C1Ty2tIjUA-nERqLsPVbIlUJitbqM7VWXaS7kDBNA=s88-c-k-c0x00ffffff-no-rj,CHICS TYPES - Ep.1 Le mâle alpha,https://www.youtube.com/watch?v=x2XLCUZe8-g,Yes vous aime,'20/06/2025 16:01,00:03:58,243814,20309,1065,"CHICS TYPES Ep.1 : le mâle alpha 💪 

Coucou les am",,23,https://i.ytimg.com/vi/x2XLCUZe8-g/hqdefault.jpg,,290
https://yt3.ggpht.com/n5ioMBJbOUWyMrNAFUEdag6dyFwfYVBnTQj1ohpewcQILipSdd3zjJ7LHX7FnuDRZmk2e84xiw=s88-c-k-c0x00ffffff-no-rj,DAVE Season 1 Finale Freestyle,https://www.youtube.com/watch?v=YTNyG-dOuCg,Lil Dicky,'16/06/2025 18:39,00:02:00,463348,6817,409,I bend the beat over and I kiss its ears softly… t,"Lil Dicky, Music, Hip Hop Music (Musical Genre), Rap, Rapper, Funny, Rapping (Profession), DAVE on FX, FX, DAVE, Freestyle, Dave Burd",10,https://i.ytimg.com/vi/YTNyG-dOuCg/hqdefault.jpg,,291
https://yt3.ggpht.com/ytc/AIdro_m8gETDSV_0VHErh636LThB0fJZqNLaBwGDXhm-K7D6RAI=s88-c-k-c0x00ffffff-no-rj,Intéressant : comment les koalas ont-ils survécu ? | 28 minutes | ARTE,https://www.youtube.com/watch?v=asFI4TrUtVk,28 minutes - ARTE,'15/06/2025 10:00,00:02:27,79388,3292,129,Le koala est un animal chelou et qui a l’air un pe,"ARTE, Magazine, TV, Le club international, 28 minutes, intéressant, david castello-lopes, koalas, survie, espèce, nature",25,https://i.ytimg.com/vi/asFI4TrUtVk/hqdefault.jpg,,292
https://yt3.ggpht.com/s5hlNKKDDQWjFGzYNnh8UeOW2j2w6id-cZGx7GdAA3d5Fu7zEi7ZMXEyslysuQUKigXNxtAB=s88-c-k-c0x00ffffff-no-rj,New things on the way from Apple,https://www.youtube.com/watch?v=Qz8u00pX738,Apple,'09/06/2025 18:41,00:02:14,1558838,40043,0,Woah. Here’s your guide to some of the big announc,"Apple, WWDC25, Apple Event, Apple Keynote, iOS26, macOS26, Apple Intelligence, iPhone, AirPods, iPad, Live Translation, multitasking, Vision Pro, group chat, Call Screening, Liquid Glass",28,https://i.ytimg.com/vi/Qz8u00pX738/hqdefault.jpg,,297
https://yt3.ggpht.com/s5hlNKKDDQWjFGzYNnh8UeOW2j2w6id-cZGx7GdAA3d5Fu7zEi7ZMXEyslysuQUKigXNxtAB=s88-c-k-c0x00ffffff-no-rj,Introducing Liquid Glass | Apple,https://www.youtube.com/watch?v=jGztGfRujSE,Apple,'09/06/2025 18:52,00:04:34,3477870,69756,0,"Meet our next chapter in software design, built wi","wwdc25, appleevent, liquidglass, applekeynote, applespecialevent, keynote, 2025, MacOS, iPadOS, iOS, visionpro, watchOS, tvOS",28,https://i.ytimg.com/vi/jGztGfRujSE/hqdefault.jpg,,298
https://yt3.ggpht.com/ytc/AIdro_m8gETDSV_0VHErh636LThB0fJZqNLaBwGDXhm-K7D6RAI=s88-c-k-c0x00ffffff-no-rj,Intéressant : Pourquoi le Manneken-Pis fait-il pipi ? | 28 minutes | ARTE,https://www.youtube.com/watch?v=LARpos3fLeo,28 minutes - ARTE,'08/06/2025 10:00,00:02:11,94111,2779,177,"Parmi toutes les statues belges, le Manneken-Pis s","Débat, 28 minutes, Arte, Élisabeth quin, actualité, international, Benjamin Sportouch, Le club international, intéressant, david castello-lopes, statue, Belgique, Bruxelles, Manneken Pis, enfant, monument national, culture, Pourquoi le Manneken-Pis fait-il pipi ?",25,https://i.ytimg.com/vi/LARpos3fLeo/hqdefault.jpg,,299
https://yt3.ggpht.com/ytc/AIdro_m8gETDSV_0VHErh636LThB0fJZqNLaBwGDXhm-K7D6RAI=s88-c-k-c0x00ffffff-no-rj,Intéressant : comment lutter contre les feux de forêt ? | 28 minutes | ARTE,https://www.youtube.com/watch?v=PGA1q5woJHw,28 minutes - ARTE,'25/05/2025 10:00,00:01:56,43328,1914,50,Et si on était capable de détecter les feux de for,"Débat, 28 minutes, Arte, Élisabeth quin, actualité, international, Le club international, intéressant, david castello-lopes, feux de forêt, incendies, détecteurs de fumée, Dryad Networks, pompiers, Renaud Dély",25,https://i.ytimg.com/vi/PGA1q5woJHw/hqdefault.jpg,,319
https://yt3.ggpht.com/M-QEzR8s8PCQFrAq3U65oz_-VKGBf55DkQAap3UxsJAEN7z1uWcyghi-xrd--_mz_cc0PNV9Qg=s88-c-k-c0x00ffffff-no-rj,SEULs - Extrait inédit 1 de mon dernier spectacle,https://www.youtube.com/watch?v=I3w6147q-rU,Haroun,'25/05/2025 15:00,00:04:49,698148,24433,696,"C'est bien beau de faire des blagues mais moi, ce ","Haroun, stand-up français, humour engagé, humoriste indépendant, humour noir français, satire politique, stand-up complet, extrait stand-up, TikTok humoriste, punchlines stand-up, sketch drôle, regarder stand-up en ligne, Stand Up Comedy, Humour Français, Spectacle Complet, haaroun, essonne, marseille, en vrac, internet, best of, seuls, blague, humour noir, la petite souris, dent de lait, phobie des transports, blagues concrètes, blageu concrète",23,https://i.ytimg.com/vi/I3w6147q-rU/hqdefault.jpg,,320
