channelAvatar,title,link,channel,publishedAt,duration,views,likes,comments,shortDescription,tags,category,thumbnail,myCategory,playlistPosition
https://yt3.ggpht.com/ytc/AIdro_nOBqjUEct-fVVkpkWUUeca64G4GD__OiHfBB6-AApGdX4=s88-c-k-c0x00ffffff-no-rj,24H avec un lobbyiste - Broute 24 - CANAL+,https://www.youtube.com/watch?v=JtwMrWjI0bs,CANAL+,'02/12/2024 17:00,00:16:21,404036,15265,511,"Bertrand est riche, baby boomer et lobbyiste. Il d","Canal +, Canalplus, Canal, sketch, humour, blague, tv, télévision, émissions, programmes, plus, lol, broute, bertrand usclat, parodie",24,https://i.ytimg.com/vi/JtwMrWjI0bs/hqdefault.jpg,,642
https://yt3.ggpht.com/ytc/AIdro_lkjgAEFbZMHlKDrQ86LYpeFhbRZUxel3QZzvYovG8qJW8=s88-c-k-c0x00ffffff-no-rj,Réchauffement climatique : entre Injustice et Hypocrisie,https://www.youtube.com/watch?v=Ane3GRQF16k,LE ROI DES RATS,'01/12/2024 17:53,00:18:36,168898,10327,1474,Cette vidéo fait partie de la Saison 2 du projet C,,25,https://i.ytimg.com/vi/Ane3GRQF16k/hqdefault.jpg,,643
https://yt3.ggpht.com/3-bjDL31J1thvLgO6R7mN-s-pCiPi_uJRW6ELan1KiadkU-1VuveM5d1JcF9Lx3Z5mM4PvoYcg=s88-c-k-c0x00ffffff-no-rj,INSTAGRAM 2024 : LES SECRETS POUR DÉCOLLER (ft Alice Cathelineau),https://www.youtube.com/watch?v=VEObULTa47M,Caroline Mignaux ,'29/11/2024 06:00,00:16:57,14460,508,36,🔴 1 stratégie par jour pour percer sur les réseaux,"réseaux sociaux, marketing digital, personal branding, content marketing, entrepreneuriat, influence marketing, stratégie digitale, marketing de contenu, social media marketing, marketing d'influence, stratégie de marque, marketing viral, branding personnel, stratégie de communication, tendances marketing, stratégie de médias sociaux, growth marketing, instagram, strategie instagram, reseaux sociaux, creation de contenu, hook, reels, réels, instagram 2025, tiktok, tendance",27,https://i.ytimg.com/vi/VEObULTa47M/hqdefault.jpg,,645
https://yt3.ggpht.com/ytc/AIdro_nOBqjUEct-fVVkpkWUUeca64G4GD__OiHfBB6-AApGdX4=s88-c-k-c0x00ffffff-no-rj,24H dans la vie d'un jeune papa au foyer - Broute 24 - CANAL+,https://www.youtube.com/watch?v=UIYpx8hn1S0,CANAL+,'25/11/2024 17:00,00:16:14,474752,14688,312,Bertrand a décidé de prendre son congé paternité. ,"Canal +, Canalplus, Canal, sketch, humour, blague, tv, télévision, émissions, programmes, plus, lol, broute, bertrand usclat, papa, pere, parent, pere au foyer",24,https://i.ytimg.com/vi/UIYpx8hn1S0/hqdefault.jpg,,655
https://yt3.ggpht.com/_icAImHR3esvtDft6rROR5whCXjVgJ6tSzMbwZ3_4ehIQ1-N6N1C_d6glLA6Gkm4MRM3FRtYQ7Q=s88-c-k-c0x00ffffff-no-rj,Ils revendent des cigarettes illégalement I Envoyé Spécial,https://www.youtube.com/watch?v=fdBKKQ3ijEM,Elise Lucet,'20/10/2024 16:00,00:10:02,70588,929,161,"Usines clandestines, contrebande, réseaux de vente","elise lucet, envoyé spécial, cash investigation, enquête, reportage, documentaire, france 2, france.tv",25,https://i.ytimg.com/vi/fdBKKQ3ijEM/hqdefault.jpg,,656
https://yt3.ggpht.com/1xaohldFQ1Adjly_DxpS11SnIbkJGCe6uIN7GUKNWPVK_bA2pMNH2_dHAtKGTvc7kOODQBQs3A=s88-c-k-c0x00ffffff-no-rj,I shrink 10x every 21s until I'm an atom - The Micro Universe,https://www.youtube.com/watch?v=rn9dkV4sVYQ,Epic Spaceman,'17/06/2024 16:00,00:14:46,4236615,162891,6742,"If you'd like to support me making these videos, w","space, universe, vfx, science",28,https://i.ytimg.com/vi/rn9dkV4sVYQ/hqdefault.jpg,,657
https://yt3.ggpht.com/1xaohldFQ1Adjly_DxpS11SnIbkJGCe6uIN7GUKNWPVK_bA2pMNH2_dHAtKGTvc7kOODQBQs3A=s88-c-k-c0x00ffffff-no-rj,I put 4 Million Suns in a Black Hole over New York,https://www.youtube.com/watch?v=pDUUT2Y_9qk,Epic Spaceman,'31/01/2024 21:02,00:14:02,3087237,165649,10624,"If you'd like to support me making these videos, w",,28,https://i.ytimg.com/vi/pDUUT2Y_9qk/hqdefault.jpg,,658
https://yt3.ggpht.com/1xaohldFQ1Adjly_DxpS11SnIbkJGCe6uIN7GUKNWPVK_bA2pMNH2_dHAtKGTvc7kOODQBQs3A=s88-c-k-c0x00ffffff-no-rj,I poured all the galaxies in the Universe into a pool,https://www.youtube.com/watch?v=7J_Ugp8ZB4E,Epic Spaceman,'24/10/2024 17:30,00:15:34,3643776,151809,9300,"If you'd like to support me making these videos, w","science, stem, galaxy, hubble, space, universe, scale",28,https://i.ytimg.com/vi/7J_Ugp8ZB4E/hqdefault.jpg,,660
https://yt3.ggpht.com/NrKSNekPuOgFc9RWLknI-FcJQNngJ3KDSLpr81AwMZ9Zct7LKSl4He4LrN7oDXr1BGvO3s6TQjU=s88-c-k-c0x00ffffff-no-rj,Kevin Tran a une nouvelle MASCOTTE ?,https://www.youtube.com/watch?v=E5FAljgYEL4,Basti Sans MS,'22/11/2024 09:00,00:11:07,4821,284,4,❤️ Abonnez-vous pour me soutenir et atteindre les ,"ui, ux, design, web, twitch, youtube, clip, figma",28,https://i.ytimg.com/vi/E5FAljgYEL4/hqdefault.jpg,,664
https://yt3.ggpht.com/ytc/AIdro_lOrU0Hx8dg6T_x4P1cFJC2voEwSILEzXgy3pXg71FmiPg=s88-c-k-c0x00ffffff-no-rj,La FIN d'un des plus GRANDS MYSTÈRES d'internet - Findings HS,https://www.youtube.com/watch?v=SpC5Zm7pHTA,Feldup,'19/11/2024 13:37,00:14:01,1491544,99624,3362,"PRENEZ DES PLACES POUR LA TOURNÉE : 
Liens des bil","feldup, findings, creepy, creepypasta, the most mysterious song on the internet, lost media, lostwave, fex, subways of your mind, enquete, recherche, trouvaille, peur, mystère, documentaire, actualité",24,https://i.ytimg.com/vi/SpC5Zm7pHTA/hqdefault.jpg,,669
https://yt3.ggpht.com/ytc/AIdro_nOBqjUEct-fVVkpkWUUeca64G4GD__OiHfBB6-AApGdX4=s88-c-k-c0x00ffffff-no-rj,24h avec un principal de collège - Broute 24 - CANAL+,https://www.youtube.com/watch?v=MueHDtrhFJc,CANAL+,'14/11/2024 17:05,00:17:36,635307,23122,581,"Principal dans le collège Jean Moulin, Bertrand es","Canal +, Canalplus, Canal, sketch, humour, blague, tv, télévision, émissions, programmes, plus, lol",24,https://i.ytimg.com/vi/MueHDtrhFJc/hqdefault.jpg,,671
https://yt3.ggpht.com/JvG9t1fNgirmoEWieadI9gz5wm0889z8ULzCF959u1FrDykh8LJUO9BjEGUg1k_xDOZWFNb3uQ=s88-c-k-c0x00ffffff-no-rj,Silicon F***ing Valley (6/6) | À la recherche du rêve américain | ARTE,https://www.youtube.com/watch?v=2XbZdORA34Y,ARTE,'13/11/2024 16:30,00:13:52,159804,4434,239,Virée avec Luc Julia dans le Chinatown de San Fran,"ARTE, TV, silicon valley, silicon fucking valley, serie doc, serie documentaire arte, luc julia, luc julia siri, luc julia silicon valley, gafam, arte documentaire, arte documentaire 2024, arte silicon valley, baptiste giudicelli, pierre schneidermann, documentaire silicon valley, episode 6, silicone valley, silicon fucking valley episode 6, silicon f***ing valley, reve americain, konbini",28,https://i.ytimg.com/vi/2XbZdORA34Y/hqdefault.jpg,,674
https://yt3.ggpht.com/JvG9t1fNgirmoEWieadI9gz5wm0889z8ULzCF959u1FrDykh8LJUO9BjEGUg1k_xDOZWFNb3uQ=s88-c-k-c0x00ffffff-no-rj,Silicon F***ing Valley (5/6) | L'avenue aux 350 milliards | ARTE,https://www.youtube.com/watch?v=Yme5sXOnsIo,ARTE,'13/11/2024 14:00,00:12:00,158357,2729,38,"Sur Sand Hill Road, Luc Julia nous fait découvrir ","ARTE, TV, silicon valley, silicon fucking valley, serie doc, serie documentaire arte, luc julia, luc julia siri, luc julia silicon valley, gafam, arte documentaire, arte documentaire 2024, arte silicon valley, documentaire silicon valley, episode 5, silicone valley, silicon fucking valley episode 5, sand hill road, venture capitalist, venture capital, silicon f***ing valley, start up, investir dans la tech",28,https://i.ytimg.com/vi/Yme5sXOnsIo/hqdefault.jpg,,675
https://yt3.ggpht.com/JvG9t1fNgirmoEWieadI9gz5wm0889z8ULzCF959u1FrDykh8LJUO9BjEGUg1k_xDOZWFNb3uQ=s88-c-k-c0x00ffffff-no-rj,Silicon F***ing Valley (4/6) | Ce que l'IA doit aux chats | ARTE,https://www.youtube.com/watch?v=cx9Vm1dqrHI,ARTE,'12/11/2024 16:30,00:13:52,188697,3252,127,"Bravant son aversion pour les bêtes, Luc Julia ent","ARTE, TV, silicon valley, silicon fucking valley, serie doc, serie documentaire arte, luc julia, luc julia siri, luc julia silicon valley, gafam, arte documentaire, arte documentaire 2024, arte silicon valley, documentaire silicon valley, episode 4, silicone valley, silicon fucking valley episode 4, silicon f***ing valley, ce que l'ia doit aux chats, ia, barre à chats, intelligence artificielle, chat, gafam arte",28,https://i.ytimg.com/vi/cx9Vm1dqrHI/hqdefault.jpg,,679
https://yt3.ggpht.com/JvG9t1fNgirmoEWieadI9gz5wm0889z8ULzCF959u1FrDykh8LJUO9BjEGUg1k_xDOZWFNb3uQ=s88-c-k-c0x00ffffff-no-rj,Silicon F***ing Valley (3/6) | La loi du plus fort | ARTE,https://www.youtube.com/watch?v=WjuubEcwXWo,ARTE,'12/11/2024 14:00,00:14:20,231852,3729,79,"Pour révéler l'envers des GAFAM, Luc Julia part à ","ARTE, TV, silicon valley, silicon fucking valley, serie doc, serie documentaire arte, luc julia, luc julia siri, luc julia silicon valley, gafam, arte documentaire, arte documentaire 2024, arte silicon valley, baptiste giudicelli, pierre schneidermann, documentaire silicon valley, episode 3, silicone valley, silicon fucking valley episode 3, apple, google, silicon f***ing valley, la loi du plus fort, jean louis gassee, apple france, meredith whittaker",28,https://i.ytimg.com/vi/WjuubEcwXWo/hqdefault.jpg,,680
https://yt3.ggpht.com/JvG9t1fNgirmoEWieadI9gz5wm0889z8ULzCF959u1FrDykh8LJUO9BjEGUg1k_xDOZWFNb3uQ=s88-c-k-c0x00ffffff-no-rj,Silicon F***ing Valley (2/6) | L'ordi qui a tout changé | ARTE,https://www.youtube.com/watch?v=g9ZKLeyHyZA,ARTE,'11/11/2024 16:30,00:15:37,253184,4567,118,"À Menlo Park, Luc Julia replonge en enfance grâce ","ARTE, TV, silicon valley, silicon fucking valley, serie doc, serie documentaire arte, luc julia, luc julia siri, luc julia silicon valley, gafam, arte documentaire, arte documentaire 2024, arte silicon valley, baptiste giudicelli, pierre schneidermann, documentaire silicon valley, episode 2, silicone valley, silicon fucking valley episode 1, konbini, silicon f***ing valley, silicon f***ing valley episode 2, l'ordi qui a tout changé, curious marc, ordinateur, ordinateur personnel",28,https://i.ytimg.com/vi/g9ZKLeyHyZA/hqdefault.jpg,,681
https://yt3.ggpht.com/JvG9t1fNgirmoEWieadI9gz5wm0889z8ULzCF959u1FrDykh8LJUO9BjEGUg1k_xDOZWFNb3uQ=s88-c-k-c0x00ffffff-no-rj,Silicon F***ing Valley (1/6) | La fabrique des cerveaux | ARTE,https://www.youtube.com/watch?v=_tSFem3SC9I,ARTE,'11/11/2024 14:00,00:15:02,604496,10009,201,Épisode 1 : Direction le campus de Stanford où se ,"ARTE, TV, silicon valley, silicon fucking valley, serie doc, serie documentaire arte, luc julia, luc julia siri, luc julia silicon valley, stanford, université de stanford, campus stanford, gafam, arte documentaire, arte documentaire 2024, arte silicon valley, documentaire silicon valley, stanford silicon valley, la fabrique des cerveaux, episode 1, silicone valley, silicon fucking valley episode 1, silicon f***ing valley episode 1, silicon f***ing valley",28,https://i.ytimg.com/vi/_tSFem3SC9I/hqdefault.jpg,,682
https://yt3.ggpht.com/J-PBRisLNGiSPLtAeoz7Tn1qR14HP9LwcZYuYqgraNfdMcaFPBgIS6w06do2buv09f4pNZRE0Q=s88-c-k-c0x00ffffff-no-rj,"Comment parler à n'importe qui, d'après un ancien timide.",https://www.youtube.com/watch?v=Fn17-ShhG60,Charlie Haid,'14/04/2024 08:41,00:12:24,496174,31605,605,"Pour en finir avec la peur du regard des autres. 
",,24,https://i.ytimg.com/vi/Fn17-ShhG60/hqdefault.jpg,,683
https://yt3.ggpht.com/zbPzRWTIiIg_sNPoAgBf4COWvAoac3vgbiTEu1dfpqH3YPDNvnxMjDtAGftuw5EPx8wfSjMzr2I=s88-c-k-c0x00ffffff-no-rj,"Apple’s Craig Federighi Explains Apple Intelligence Delays, Siri’s Future and More | WSJ",https://www.youtube.com/watch?v=fr8ALcEiYAk,The Wall Street Journal,'23/10/2024 01:00,00:11:13,838133,19560,1601,"While others rush AI to market, Apple is taking it","apple, apple intelligence, apple news, apple ai, craig federighi, craig federighi interview, apple head of software, siri, siri ai update, ios 18.1, iphone 16, apple software, ios updates, generative ai, iphone 15 pro, privacy, private cloud compute, chatbot, ai integration, apple ai plans, future of siri, large language models, cloud servers, chatgpt, big tech, tech news, processing power, private cloud computing, siri ai updates, wsj, joanna stern, photo cleanup, techy",25,https://i.ytimg.com/vi/fr8ALcEiYAk/hqdefault.jpg,,687
https://yt3.ggpht.com/ARFA0y6gV1_8hLExcLNWwlhhBrpvFGFiKjcw4bjXjJutMFttuc59dKrJPY4ZzS_K-jCXiYPFog=s88-c-k-c0x00ffffff-no-rj,Zelda Echoes of Wisdom - TEST EN CARTON,https://www.youtube.com/watch?v=cdIEC6_AkJ0,Savun,'03/11/2024 14:31,00:13:25,402445,26533,462,"- Chaîne Twitch : https://www.twitch.tv/savun
- Ch","test, link's awakening, zelda link's awakening, the legend of zelda, zelda, the legend of zelda link's awakening fr, nintendo switch, switch, avis, critique, links awakening, zelda links awakening, savun, zelda echoes of wisdom, the legend of zelda echoes of the wisdom, the legend of zelda echoes of wisdom, echoes of wisdom avis, zelda echoes of wisdom avis fr, test echoes of wisdom, zelda echoes, test zelda echoes of wisdom, echoes of wisdom fr, zelda wisdom, link, totk, botw",20,https://i.ytimg.com/vi/cdIEC6_AkJ0/hqdefault.jpg,,689
https://yt3.ggpht.com/-e7up0qHG1yPeLe8NBc-jGFS6OKaehw06N4Ad_AOy0WvDqKieGyh-uaKxKUyQN6vALyU-WG1PA=s88-c-k-c0x00ffffff-no-rj,IL S'EST PASSÉ CERTAINES CHOSES AU TOURNAGE DE MRBEAST,https://www.youtube.com/watch?v=VntFnD63ISs,Mastu Gear 2,'24/07/2024 15:02,00:15:12,1481596,89366,762,Y'a quelques anecdotes de tournage que vous n'avez,"mastu, mastutv, matsu, mastus, humour, mastu gear, mastu mrbeast, mrbeast, mrbeast mastu",24,https://i.ytimg.com/vi/VntFnD63ISs/hqdefault.jpg,,690
https://yt3.ggpht.com/3-bjDL31J1thvLgO6R7mN-s-pCiPi_uJRW6ELan1KiadkU-1VuveM5d1JcF9Lx3Z5mM4PvoYcg=s88-c-k-c0x00ffffff-no-rj,5 TECHNIQUES POUR VENDRE (PLUS) EN BTOB ! Avec @pierreherubel9492,https://www.youtube.com/watch?v=xr8m2KA-UrM,Caroline Mignaux ,'16/09/2024 05:30,00:18:36,2207,56,0,🔴 1 stratégie par jour pour faire décoller ton bus,"réseaux sociaux, marketing digital, personal branding, growth hacking, content marketing, entrepreneuriat, influence marketing, stratégie digitale, marketing de contenu, social media marketing, marketing d'influence, création de contenu, stratégie de marque, marketing viral, marketing B2B, stratégie de communication, tendances marketing, stratégie de médias sociaux, growth marketing, vente, influence, B2B, Prospection B2B, Campagnes B2B, BtoB, Communication B2B, LinkedIn B2B",27,https://i.ytimg.com/vi/xr8m2KA-UrM/hqdefault.jpg,,693
https://yt3.ggpht.com/3-bjDL31J1thvLgO6R7mN-s-pCiPi_uJRW6ELan1KiadkU-1VuveM5d1JcF9Lx3Z5mM4PvoYcg=s88-c-k-c0x00ffffff-no-rj,COMMENT TRAITER LES OBJECTIONS & CONCLURE UNE VENTE ?,https://www.youtube.com/watch?v=qQFaixyZYZY,Caroline Mignaux ,'11/10/2024 06:12,00:19:15,6219,213,17,🔴 1 stratégie par jour pour mieux vendre ➞ https:/,"réseaux sociaux, marketing digital, personal branding, growth hacking, content marketing, entrepreneuriat, social media marketing, développement personnel, stratégie de marque, marketing viral, branding personnel, stratégie de communication, tendances marketing, stratégie de médias sociaux, growth marketing, vente, strategie de vente, Techniques de vente, SPIN Selling, Techniques commerciales, Négociation commerciale, Closing, Relation client, Closer, Appel de vente, vendre",27,https://i.ytimg.com/vi/qQFaixyZYZY/hqdefault.jpg,,699
https://yt3.ggpht.com/3-bjDL31J1thvLgO6R7mN-s-pCiPi_uJRW6ELan1KiadkU-1VuveM5d1JcF9Lx3Z5mM4PvoYcg=s88-c-k-c0x00ffffff-no-rj,I.A... LE SECRET POUR S'AUTO-MOTIVER CHAQUE MATIN ! (ft. Aurelia Scheck),https://www.youtube.com/watch?v=4For0hNlbkU,Caroline Mignaux ,'20/09/2024 07:00,00:15:12,2221,82,6,🔴 1 stratégie par jour pour faire décoller ton bus,"réseaux sociaux, marketing digital, personal branding, growth hacking, content marketing, entrepreneuriat, influence marketing, stratégie digitale, marketing de contenu, social media marketing, création de contenu, stratégie de marque, stratégie de communication, tendances marketing, stratégie de médias sociaux, growth marketing, ChatGPT, productivite, automatisation, IA, intelligence artificielle, automatiser, efficacite, gestion de projet, marketing, temps, gagner du temps, contenu",27,https://i.ytimg.com/vi/4For0hNlbkU/hqdefault.jpg,,701
https://yt3.ggpht.com/3-bjDL31J1thvLgO6R7mN-s-pCiPi_uJRW6ELan1KiadkU-1VuveM5d1JcF9Lx3Z5mM4PvoYcg=s88-c-k-c0x00ffffff-no-rj,10 étapes pour créer son Personal Branding 🚨,https://www.youtube.com/watch?v=9nv4nrpsPrA,Caroline Mignaux ,'03/06/2024 10:15,00:10:25,24778,1077,53,MON LIVRE ICI (À COMMANDER OU À OFFRIR) : https://,"business model, caroline mignaux, co-marketing, créer son personal branding, maddyness, marketing, partenariat, personal branding, personal branding français, reachmaker, social media",27,https://i.ytimg.com/vi/9nv4nrpsPrA/hqdefault.jpg,,702
https://yt3.ggpht.com/3-bjDL31J1thvLgO6R7mN-s-pCiPi_uJRW6ELan1KiadkU-1VuveM5d1JcF9Lx3Z5mM4PvoYcg=s88-c-k-c0x00ffffff-no-rj,9 TECHNIQUES POUR PRENDRE LA PAROLE COMME UN PRO,https://www.youtube.com/watch?v=Rvi02mV7NO4,Caroline Mignaux ,'06/09/2024 04:00,00:10:19,39186,1372,79,1 stratégie par jour pour te valoriser ➞ https://l,"marketing digital, personal branding, growth hacking, entrepreneuriat, influence marketing, marketing de contenu, marketing d'influence, création de contenu, stratégie de communication, tendances marketing, stratégie de médias sociaux, growth marketing, vente, influence, prise de parole, parler, prise de parole en public, Parler en public, Art oratoire, Techniques de communication, Prise de parole professionnelle, Eloquence, Discours, Communication non verbale, Stress, Presentation",27,https://i.ytimg.com/vi/Rvi02mV7NO4/hqdefault.jpg,,703
https://yt3.ggpht.com/3-bjDL31J1thvLgO6R7mN-s-pCiPi_uJRW6ELan1KiadkU-1VuveM5d1JcF9Lx3Z5mM4PvoYcg=s88-c-k-c0x00ffffff-no-rj,10 PIRES SITUATIONS FACE AU CLIENT & COMMENT LES ÉVITER / RÉPARER (ft@AlinedeTheBBoost),https://www.youtube.com/watch?v=h6k01qIKJO0,Caroline Mignaux ,'01/11/2024 06:00,00:16:13,7934,350,29,🔴 1 stratégie par jour pour faire décoller ton bus,"réseaux sociaux, marketing digital, personal branding, growth hacking, content marketing, entrepreneuriat, influence marketing, stratégie digitale, marketing de contenu, social media marketing, marketing d'influence, création de contenu, développement personnel, coaching en entrepreneuriat, stratégie de marque, marketing viral, branding personnel, marketing B2B, stratégie de communication, tendances marketing, stratégie de médias sociaux, growth marketing, vente, influence",27,https://i.ytimg.com/vi/h6k01qIKJO0/hqdefault.jpg,,706
https://yt3.ggpht.com/ytc/AIdro_n51XzWWRwxgmIy3I6GBg96kcKiQE_BeUC9epnOUIv6=s88-c-k-c0x00ffffff-no-rj,Profession Photographe - Dead Rising,https://www.youtube.com/watch?v=46dVnEIyufU,BOTCH,'27/10/2024 11:38,00:12:04,165849,14659,340,"Watashi Frank, Le cheval c'est trop génial

✉️ - C",,23,https://i.ytimg.com/vi/46dVnEIyufU/hqdefault.jpg,,711
https://yt3.ggpht.com/PxsRN8dXTNSFDCPbGNFijtTnc2SFvzEwKsNonooD3GeNnbEnDlNcHwaYiBoqCbgGroXzQsAW=s88-c-k-c0x00ffffff-no-rj,"Jouer sans rager, c’est possible ?",https://www.youtube.com/watch?v=oKSdgHIFujc,Poachimpa,'16/10/2024 14:01,00:14:04,11139,1283,176,De retour avec une vidéo sur les raisons de notre ,"gaming, jeuxvideo, jeux, video, tgr, thegreatreview, aiku, ego, storytelling, psychologie, kombo",22,https://i.ytimg.com/vi/oKSdgHIFujc/hqdefault.jpg,,715
https://yt3.ggpht.com/9r8cVmcKKGdO40hBYAMdhipsVcTrQ86ESptTPuVoMdpUQuQBSGJHkGIBGlMvjGrrag2Pu_Xe=s88-c-k-c0x00ffffff-no-rj,Review: Avatar 2 The Way of Water,https://www.youtube.com/watch?v=LfT04-vbPXM,jacksfilms,'17/12/2022 22:00,00:11:57,213482,18072,1235,,"jacksfilms, jack douglass, yiay, yesterday i asked you, avatar, avatar 2, review, avatar review, the way of water, redlettermedia, half in the bag, parody",23,https://i.ytimg.com/vi/LfT04-vbPXM/hqdefault.jpg,,724
https://yt3.ggpht.com/lbLR2SXFU8w6W1vq7XWkh4eJ-3TkWi6GSFo_NEm4DXu11Mlay8QBxWXqXZZboKiIQ3HnOSpAMIs=s88-c-k-c0x00ffffff-no-rj,BOUCHON | Episode 8 | ARTE Séries,https://www.youtube.com/watch?v=2j1n3h14oZY,ARTE Séries,'30/04/2024 16:03,00:12:50,21950,950,72,Huitième épisode : C’est l’anniversaire de Jean-Pa,"ARTE, Autre, TV, série arte, série ARTE, arte serie, drame familial, cancer, relations familiales, premier role, anniversaire, émotions contradictoires, méditataion, podcasts, entrelacs sentimentaux, tokyo, emancipation, suisse, soutien familial, acceptation, croissance personnelle, bouchon arte, bouchon série, bouchon série arte, bouchon replay, bouchon streaming, bouchon arte série, eleonore costes",24,https://i.ytimg.com/vi/2j1n3h14oZY/hqdefault.jpg,,731
https://yt3.ggpht.com/3-bjDL31J1thvLgO6R7mN-s-pCiPi_uJRW6ELan1KiadkU-1VuveM5d1JcF9Lx3Z5mM4PvoYcg=s88-c-k-c0x00ffffff-no-rj,Tous les entrepreneurs devraient écouter ça.,https://www.youtube.com/watch?v=kRYaMqwXyBY,Caroline Mignaux ,'03/10/2025 06:00,00:26:50,398,24,2,🛎 1 stratégie / jour pour progresser → https://lin,"réseaux sociaux, marketing digital, personal branding, growth hacking, content marketing, entrepreneuriat, influence marketing, stratégie digitale, marketing de contenu, social media marketing, marketing d'influence, création de contenu, coaching en entrepreneuriat, stratégie de marque, marketing viral, marketing B2B, stratégie de communication, tendances marketing, stratégie de médias sociaux, growth marketing, vente, influence, business, marque personnelle",27,https://i.ytimg.com/vi/kRYaMqwXyBY/hqdefault.jpg,,2
https://yt3.ggpht.com/ZsmiOA_7qianJlnzgnv657o6txt_wAC-Vw99yzAqfxjAPW9hojrQs_QMEHYTPR6tR3KJzYlUw2U=s88-c-k-c0x00ffffff-no-rj,"Qui aura la scène piégée ? (ft. Mister V, Théodort)",https://www.youtube.com/watch?v=8DFp8UyELEY,Maxime Biaggi,'02/10/2025 17:40,00:29:12,721724,49616,588,Je vous avais dit qu'on avait le même jeu avec Sid,,24,https://i.ytimg.com/vi/8DFp8UyELEY/hqdefault.jpg,,8
https://yt3.ggpht.com/ytc/AIdro_lRY24xCKT9seH0TYW6LcBbDVcFW3unpSvqA5Ps9Qsi4q0=s88-c-k-c0x00ffffff-no-rj,Un thème de RÊVE au 4 à la suite ! (trop facile ?),https://www.youtube.com/watch?v=P8YsNIIgr7I,Etoiles,'27/09/2025 16:00,00:25:30,36937,1372,18,Encore une petite nuit de la culture de Julien Lep,"Etoiles, Etoile, culture, quiz, nuit de la culture, question pour un champion, samuel etienne, react",24,https://i.ytimg.com/vi/P8YsNIIgr7I/hqdefault.jpg,,33
https://yt3.ggpht.com/dRDSMjwDVMxp9cCvkFVvt2Ii76AZygzF_MxFgXBxdgg22DJtuPvNg3XfEwyrbf1K5X2_Zd1ileA=s88-c-k-c0x00ffffff-no-rj,Nvidia investit 100 MILLIARDS dans Open AI ?!,https://www.youtube.com/watch?v=h4nZx4pASYc,Hardisk TV,'26/09/2025 07:31,00:22:42,10685,394,39,"La chaine @BastiUi 
La chaine @defendOFF 
🚀 Abonne","hardisk, live, vod, twitch, best of",24,https://i.ytimg.com/vi/h4nZx4pASYc/hqdefault.jpg,,47
https://yt3.ggpht.com/ytc/AIdro_lRY24xCKT9seH0TYW6LcBbDVcFW3unpSvqA5Ps9Qsi4q0=s88-c-k-c0x00ffffff-no-rj,Pourquoi personne prend JAMAIS ce thème ??? (au lieu du cinéma...),https://www.youtube.com/watch?v=D4tVlNyDK1Q,Etoiles,'24/09/2025 16:15,00:20:24,40496,1676,15,Petites vacances d'Etoiles cette semaine donc on s,"Etoiles, Etoile, culture, quiz, nuit de la culture, question pour un champion, samuel etienne, react",24,https://i.ytimg.com/vi/D4tVlNyDK1Q/hqdefault.jpg,,55
https://yt3.ggpht.com/mkxR4YNTUBJAjuq020488wM8yHSCZ4Kwn0etJyYyGTL86LnEiIzu5uhw8EwmPpRxavKYXyQ4Hmk=s88-c-k-c0x00ffffff-no-rj,LES PIRES MOTS DANS LE CARNET ! #11,https://www.youtube.com/watch?v=onkMdi2tPxc,Amixem,'21/09/2025 15:25,00:26:40,2951730,186428,2726,On juge vos pires mots dans le carnet avec Thomas ,"amixem, humour, delire",23,https://i.ytimg.com/vi/onkMdi2tPxc/hqdefault.jpg,,63
https://yt3.ggpht.com/3djzVEm99BYPivZxKHOa2z4_rfoE_bcVCjOmDM10vgp2MGH0lh67Q3Tr4uhckvpHkBMjcXin=s88-c-k-c0x00ffffff-no-rj,Test FIABLE pour mesurer son niveau de R*CISME,https://www.youtube.com/watch?v=hFerFs-mFTU,euuhhh,'21/09/2025 16:01,00:27:54,45010,1336,293,"En stream tous les mardis, jeudis et dimanches dès","react, réact, reactfr, react francais, react français, réct français, euh, euuhhh, roro, un créatif, twitch, stream, live, mascu, argent, entrepreneur, coach, complotiste, new age, société, dev perso, développement personnel, humour, divertissement",24,https://i.ytimg.com/vi/hFerFs-mFTU/hqdefault.jpg,,64
https://yt3.ggpht.com/ytc/AIdro_mpAy1O7DOtf0zssjUPu-ED15W2KnNpl9yH6CqvNCCDHQ=s88-c-k-c0x00ffffff-no-rj,TOUT SAVOIR Sur Le Dolby Vision 2 (On en parle ensemble),https://www.youtube.com/watch?v=lnjNG7ffOZc,PP World,'21/09/2025 07:59,00:27:03,39151,2248,360,"(Vidéo 4K chapitrée non sponso) Bonjour, Dolby vie","Dolby, Dolby Vision, TV, Télé, télévision, Téléviseur, Canal +, Hisense, HDR, sport, film, cinéma, PP, PP World, reportage, TOUT SAVOIR Sur Le Dolby Vision 2 ! (On en parle ensemble), enquête, streaming, sony, TCL, HDR10, image, qualité image, couleurs, IFA Show, Dolby USA, USA, Panasonic",28,https://i.ytimg.com/vi/lnjNG7ffOZc/hqdefault.jpg,,66
https://yt3.ggpht.com/uOw2e6SJwIsvq2j8rVi3vaTzGXAsgaOcnN2ixb3Sb6TKSOU3LbGhEt_glNOQJE7XHrvIsdOdCb8=s88-c-k-c0x00ffffff-no-rj,"Nos PIRES ANECDOTES entre frères (catfish sur Tinder, médecin en colère...)",https://www.youtube.com/watch?v=vVvRTEvrRV4,Elian Ventre,'21/09/2025 08:17,00:26:26,262561,18038,172,Téléchargez REVOLUT gratuitement avec mon lien htt,,22,https://i.ytimg.com/vi/vVvRTEvrRV4/hqdefault.jpg,,67
https://yt3.ggpht.com/dRDSMjwDVMxp9cCvkFVvt2Ii76AZygzF_MxFgXBxdgg22DJtuPvNg3XfEwyrbf1K5X2_Zd1ileA=s88-c-k-c0x00ffffff-no-rj,Ils font la grève de la faim contre l'IA,https://www.youtube.com/watch?v=KgrQYRFtK7g,Hardisk TV,'20/09/2025 07:30,00:21:57,6663,313,63,"La chaine @defendOFF 
La chaine @BastiUi 
🚀 Abonne","hardisk, live, vod, twitch, best of",24,https://i.ytimg.com/vi/KgrQYRFtK7g/hqdefault.jpg,,71
