channelAvatar,title,link,channel,publishedAt,duration,views,likes,comments,shortDescription,tags,category,thumbnail,myCategory,playlistPosition
https://yt3.ggpht.com/wNBgHWjZzTNMUwDcAlnnsW-xa987_eokajMQLKWovLIxxZT23v9QqsqFTObvlVx4aY3TsAwHV7c=s88-c-k-c0x00ffffff-no-rj,Les 3 Pires Expériences de Touristes en France !,https://www.youtube.com/watch?v=JBD9Of35u2Q,Conte Fécond,'22/07/2024 15:00,00:22:08,473641,15393,877,💙 Merci à CyberGhost VPN :  https://www.cyberghost,,24,https://i.ytimg.com/vi/JBD9Of35u2Q/hqdefault.jpg,,599
https://yt3.ggpht.com/16XuVw3RtRKykEbht5dkoo60kT-jUFmq0wWU2Ie61OfTqjZGpJXbTx0AMJ00t1ocQ1sGlLrf=s88-c-k-c0x00ffffff-no-rj,Pimp My Ride était (presque) FAKE!,https://www.youtube.com/watch?v=vf1cL_bfAxw,Jaihno,'16/02/2024 16:04,00:20:52,1064819,21405,676,🚀 Guide marketing musical GRATUIT: https://jaihno.,"jaihno, jaihnomusic",24,https://i.ytimg.com/vi/vf1cL_bfAxw/hqdefault.jpg,,609
https://yt3.ggpht.com/ytc/AIdro_m_C9l-Daju_CSGESNHRuzF6Bsaukk0Jmi9gz40CT8hJg=s88-c-k-c0x00ffffff-no-rj,"👍👎? ""SCRUM La méthode agile en 10 minutes (Projet agile)"" par StrategeMarketing",https://www.youtube.com/watch?v=6py-kX9yBjU,"Scrum Life - Lean, Agile, Kanban",'08/01/2024 16:00,00:24:42,8517,195,34,🎁 Le guide du Scrum Master compétent 👉 https://sl.,"agile scrum, backlog, design thinking, gestion de projet, gestion de projets, kanban, méthode agile, méthode agile cest quoi, methode agile darija, méthode agile définition, méthode agile kanban, méthode agile projet, méthode agile scrum, méthode agile scrum exemple, methode agile xp, méthodes agiles, product owner, project management, scrum, scrum guide, scrum la méthode agile en 10 minutes, scrum life, scrum master, sprint, sprint planning, sprint review, user story",27,https://i.ytimg.com/vi/6py-kX9yBjU/hqdefault.jpg,,616
https://yt3.ggpht.com/wNBgHWjZzTNMUwDcAlnnsW-xa987_eokajMQLKWovLIxxZT23v9QqsqFTObvlVx4aY3TsAwHV7c=s88-c-k-c0x00ffffff-no-rj,Les 3 Pires Histoires d’Exs (amoureux),https://www.youtube.com/watch?v=yEjgRfUwI8U,Conte Fécond,'17/11/2023 16:17,00:22:43,563277,18597,393,Tout le monde a déjà vécu au moins une histoire d’,"conte, fécond, histoires, horreur, ex, amoureux, Relations toxiques, Vengeance, Manipulation, Obsession, Amour toxique, Trahison",24,https://i.ytimg.com/vi/yEjgRfUwI8U/hqdefault.jpg,,617
https://yt3.ggpht.com/wNBgHWjZzTNMUwDcAlnnsW-xa987_eokajMQLKWovLIxxZT23v9QqsqFTObvlVx4aY3TsAwHV7c=s88-c-k-c0x00ffffff-no-rj,Les Rencontres d'Internet Les Plus Flippantes,https://www.youtube.com/watch?v=GD3mVcV43TU,Conte Fécond,'22/10/2022 15:00,00:22:30,768126,22832,516,Faites attention à qui vous décidez de rencontrer ,,22,https://i.ytimg.com/vi/GD3mVcV43TU/hqdefault.jpg,,620
https://yt3.ggpht.com/ytc/AIdro_lsk61GL6bR7LZYXweyDxtNTGy3DWAEVBEXAUHBFIfksOE=s88-c-k-c0x00ffffff-no-rj,"L'Histoire insoupçonnée de MACAULAY CULKIN - PVR#73 (Maman, j'ai raté l'avion !)",https://www.youtube.com/watch?v=WJBn-AoPieQ,La chaîne de P.A.U.L,'10/12/2024 16:46,00:25:59,219635,9360,544,"Découvrez HOLY, mon partenaire ! https://fr.weareh","Macaulay Culkin, Home Alone, Maman j'ai raté l'avion, Enfant star, documentaire, Histoire, Cinéma",24,https://i.ytimg.com/vi/WJBn-AoPieQ/hqdefault.jpg,,630
https://yt3.ggpht.com/u62BE5vPk-_2ROxBIBXbihzgSvbM7wwhqT-6dPjNAYu7KImRiKAFNzgQ4W7UClcH_D7pXjXU=s88-c-k-c0x00ffffff-no-rj,Gaslighting ChatGPT With Ethical Dilemmas,https://www.youtube.com/watch?v=UsOLlhGA9zg,Alex O'Connor,'01/12/2024 06:22,00:23:07,2737170,117335,8647,Go to https://piavpn.com/alex to get 83% off from ,"Alex O'Connor, cosmic, skeptic, cosmicskeptic, atheism, within reason, podcast, within reason podcast, religion, debate, Alex J O'Connor",27,https://i.ytimg.com/vi/UsOLlhGA9zg/hqdefault.jpg,,631
https://yt3.ggpht.com/YSlksVmSp3qf6uK2_aqoii_ZbHeHgluEAaDI_Lz5-SzEos4kXnDcdb4hafq2Efgq2KCUUlEr=s88-c-k-c0x00ffffff-no-rj,La valeur qui a changé le jeu vidéo,https://www.youtube.com/watch?v=HA3bDe-thbE,What a Fail !,'03/09/2024 15:46,00:26:46,466119,31118,1228,⚡Merci à Genshin Impact de m’accompagner pour cett,,20,https://i.ytimg.com/vi/HA3bDe-thbE/hqdefault.jpg,,634
https://yt3.ggpht.com/HP9oIpL42ufzvCEBTLzxAtpZae1rfLzdte8tnlh-Qi0yjIprNPDqHXiR-XvxMe5eyFUC5Fensl0=s88-c-k-c0x00ffffff-no-rj,J'ai automatisé mes E-mails avec ChatGPT o1 et Bolt — TUTO,https://www.youtube.com/watch?v=vE9adtV6MZw,Ludo Salenne,'06/12/2024 15:21,00:23:29,38094,974,84,"Ce matin, j'en ai eu assez → passer des heures à t","email automatisation, email chatgpt, e-mail chatgpt, automatiser e-mail, automatiser chatgpt, chatgpt o1, chatgpt o1 pro, o1 pro mode, ChatGPT Pro, Bolt, Bolt IA, automatiser Bolt, chatgpt bolt, automatiser email chatgpt, automatisation, make, make com, make.com, tuto chatgpt, rédiger email chatgpt, répondre email chatgpt, no code, bolt ai, tuto bolt, bolt français, bolt fr, bolt chatgpt, ia no code, automatisation make",28,https://i.ytimg.com/vi/vE9adtV6MZw/hqdefault.jpg,,637
https://yt3.ggpht.com/fvXH2uLgM0UHpi3RAW6Yc4NvIyVwrAK_Vp3sB1DynsaoxOW3uE-oaL1HxL-CPQgshNBJ-aU2=s88-c-k-c0x00ffffff-no-rj,EXTRAIT SPECTACLE STAND UP JEREMY NADEAU,https://www.youtube.com/watch?v=kktBTOpueoA,Jeremy Nadeau,'26/11/2024 18:21,00:22:29,317591,23021,512,"Aucune de ces blagues n'est dans le spectacle
Bill",,23,https://i.ytimg.com/vi/kktBTOpueoA/hqdefault.jpg,,651
https://yt3.ggpht.com/3-bjDL31J1thvLgO6R7mN-s-pCiPi_uJRW6ELan1KiadkU-1VuveM5d1JcF9Lx3Z5mM4PvoYcg=s88-c-k-c0x00ffffff-no-rj,COMMUNICATION DE CRISE : LE GUIDE ANTI-DÉGÂTS (ft Kato Charlot),https://www.youtube.com/watch?v=XTnIfZXZjgM,Caroline Mignaux ,'22/11/2024 06:00,00:26:40,2061,52,6,🔴 1 stratégie par jour pour mieux communiquer ➞ ht,"réseaux sociaux, marketing digital, personal branding, growth hacking, entrepreneuriat, influence marketing, stratégie digitale, marketing de contenu, social media marketing, branding personnel, stratégie de communication, tendances marketing, stratégie de médias sociaux, growth marketing, crise, gestion de crise, management, management de crise, communication de crise, gestion des conflits, crise d'entreprise, leadership, Outils de gestion de crise, Crise économique, Resilience",27,https://i.ytimg.com/vi/XTnIfZXZjgM/hqdefault.jpg,,663
https://yt3.ggpht.com/JvG9t1fNgirmoEWieadI9gz5wm0889z8ULzCF959u1FrDykh8LJUO9BjEGUg1k_xDOZWFNb3uQ=s88-c-k-c0x00ffffff-no-rj,Quand les parents se séparent | ARTE,https://www.youtube.com/watch?v=zTbBCB7Bzrc,ARTE,'20/11/2024 14:01,00:26:39,32685,531,112,"Disponible jusqu'au 19/11/2029
Lorsque les parents","ARTE, être enfant de parents séparés, quand les parents se séparent, conflit de loyauté, choisir entre ses parents, comment bien se séparer quand on a des enfants, comment se séparer quand on a des enfants, souffrance enfant, séparation de parents, divorce, parents divorcés, sauver son mariage, thérapie de couple, disputes en famille, dispute de couple, disputes devant les enfants, témoignage d'enfants de parents séparés, psychologie, psychologie enfant",24,https://i.ytimg.com/vi/zTbBCB7Bzrc/hqdefault.jpg,,666
https://yt3.ggpht.com/JvG9t1fNgirmoEWieadI9gz5wm0889z8ULzCF959u1FrDykh8LJUO9BjEGUg1k_xDOZWFNb3uQ=s88-c-k-c0x00ffffff-no-rj,"Moi, en deuil | Psycho | ARTE",https://www.youtube.com/watch?v=qnYQJjZIf6E,ARTE,'31/10/2024 16:30,00:26:30,38465,778,138,"Disponible jusqu'au 30/06/2026
Le deuil est une fa","ARTE, comment faire son deuil, étapes du deuil, aide deuil, se faire accompagner pendant un deuil, comment continuer quand on a perdu quelqu'un, ARTE Replay, Documentaire complet, Série documentaire Arte, séries documentaire arte, Psycho, Arte, Psycho Arte, Série Arte Psycho, série psychologique, psychologie, psychothérapie, arte deuil, documentaire psychologie, comprendre la psychologie, psychologie humaine, mort, vivre avec la mort de quelqu'un, parler de la mort",1,https://i.ytimg.com/vi/qnYQJjZIf6E/hqdefault.jpg,,676
https://yt3.ggpht.com/JvG9t1fNgirmoEWieadI9gz5wm0889z8ULzCF959u1FrDykh8LJUO9BjEGUg1k_xDOZWFNb3uQ=s88-c-k-c0x00ffffff-no-rj,Les intolérances alimentaires : mal du siècle ou illusion ? | Les questions qui fâchent | ARTE,https://www.youtube.com/watch?v=47hnnj_YxWw,ARTE,'10/11/2024 16:30,00:26:38,340967,4643,505,Documentaire disponible en rediffusion jusqu'au 30,"ARTE, Série documentaire, TV, intolerance alimentaire, intolerance gluten, intolérance lactose, mal du siècle, les intolerances alimentaires, les questions qui fachent, microbiote, microbiote intestinal, alimentation, aliments transformés",26,https://i.ytimg.com/vi/47hnnj_YxWw/hqdefault.jpg,,677
https://yt3.ggpht.com/0Sdwg7bb9le0FAAH4rA1Qu555lwFNsZszttsp3fS1lc3-s2aC2EFdToJjcLpDVFNsNLGXEb6wQ=s88-c-k-c0x00ffffff-no-rj,La meilleure fin de saga.,https://www.youtube.com/watch?v=dr4feJvRH3c,Sojirad,'11/09/2024 14:03,00:24:46,37870,1494,145,"Il y a pratiquement un an, je vous parlais de Unch","Test, Review, Benjam1, Sojirad, Super Héros, Marvel, MCU, DC, Dc Comics, Nathan Drake, Elena, Sam Drake, Sully, Uncharted, A Thief's End, FIn, Naughty Dogs, PS4, PS5, Xbox Series, PC, Steam, Aventure, Action, Tom Holland",20,https://i.ytimg.com/vi/dr4feJvRH3c/hqdefault.jpg,,688
https://yt3.ggpht.com/3-bjDL31J1thvLgO6R7mN-s-pCiPi_uJRW6ELan1KiadkU-1VuveM5d1JcF9Lx3Z5mM4PvoYcg=s88-c-k-c0x00ffffff-no-rj,Techniques pour Attirer des Clients - SANS Budget,https://www.youtube.com/watch?v=K8mOtDNqwiE,Caroline Mignaux ,'15/07/2024 03:29,00:29:59,4061,198,21,🎥  Techniques de Romain Bouvet pour Attirer des Cl,"Autorité Marché, Croissance Organique, Démonstration Travail, Développer Clientèle, Gross Marketing, Marketing Cognitif, Marketing Sans Budget, Mindset Marketing, Obtenir Clients, Obtenir Recommandations, Offre Gratuite, Optimisation Profil, Positionnement Marché, Psychologie Sociale, Recommandations Clients, Références Clients, Réinvente Marketing, Réseau Social, Sans Budget, Stratégies Marketing, Techniques Entrepreneur, Techniques Persuasion",27,https://i.ytimg.com/vi/K8mOtDNqwiE/hqdefault.jpg,,691
https://yt3.ggpht.com/3-bjDL31J1thvLgO6R7mN-s-pCiPi_uJRW6ELan1KiadkU-1VuveM5d1JcF9Lx3Z5mM4PvoYcg=s88-c-k-c0x00ffffff-no-rj,COMMENT OSER PARLER À N’IMPORTE QUI (grâce aux neurosciences 🧠) ? (Ft. @CharlieHaid),https://www.youtube.com/watch?v=zSzGvzHvT-0,Caroline Mignaux ,'02/08/2024 06:00,00:26:30,301535,11040,180,🔴 1 stratégie par jour pour OSER ➞ https://linktw.,"comment parler en public, l'art de parler en public, marketing, neurosciences, prise de parole en public, prise de parole en public exercices, prise de parole en public formation, shy entrepreneur, sociable, social media, timid behavior, timid behavior advice, timid networking, timid personality, comment parler en public sans stress, peur de parler en public, développement personnel, coaching, estime de soi, timidité, avoir confiance en soi, prise de parole, Confiance en soi",27,https://i.ytimg.com/vi/zSzGvzHvT-0/hqdefault.jpg,,695
https://yt3.ggpht.com/3-bjDL31J1thvLgO6R7mN-s-pCiPi_uJRW6ELan1KiadkU-1VuveM5d1JcF9Lx3Z5mM4PvoYcg=s88-c-k-c0x00ffffff-no-rj,"Construire sa marque ""en public"" sur les réseaux sociaux ? Avec Victoire Duhamel",https://www.youtube.com/watch?v=1Og_S1v8o3k,Caroline Mignaux ,'20/05/2024 05:45,00:27:11,8869,245,17,La Newsletter ➞ https://www.lessecretsdumarketing.,"business model, caroline mignaux, co-marketing, kanye west documentaire, maddyness, marketing, partenariat, reachmaker, social media",27,https://i.ytimg.com/vi/1Og_S1v8o3k/hqdefault.jpg,,697
https://yt3.ggpht.com/3-bjDL31J1thvLgO6R7mN-s-pCiPi_uJRW6ELan1KiadkU-1VuveM5d1JcF9Lx3Z5mM4PvoYcg=s88-c-k-c0x00ffffff-no-rj,LES FREELANCES NE PERÇENT PAS - AVANT D'AVOIR COMPRIS ÇA... (Ft. Remi Lauer),https://www.youtube.com/watch?v=DwuGHecLiSs,Caroline Mignaux ,'09/09/2024 04:00,00:27:25,5686,166,14,🔴 1 stratégie par jour pour faire décoller ton act,"réseaux sociaux, marketing digital, personal branding, growth hacking, content marketing, entrepreneuriat, influence marketing, stratégie digitale, marketing de contenu, social media marketing, marketing d'influence, création de contenu, stratégie de marque, stratégie de communication, tendances marketing, growth marketing, influence, hyperfreelance, remi lauer, entrepreneur, solopreneur, freelance, Freelancing, Travailler en freelance, Stratégie pour freelances, Business model",27,https://i.ytimg.com/vi/DwuGHecLiSs/hqdefault.jpg,,704
https://yt3.ggpht.com/QNQKH06vHzPRwiOVEiuFAH93OwKsv39EkVsXY_SAG6aDCADIk46b5P3_60O7CRunDh66StAIlpw=s88-c-k-c0x00ffffff-no-rj,L'Enfer Silencieux de LoL en Corée...,https://www.youtube.com/watch?v=kuMaiDADZck,PolyHeart,'27/10/2024 10:36,00:26:11,202522,8154,149,Numéro d'aide pour le harcèlement en ligne : 3018 ,,20,https://i.ytimg.com/vi/kuMaiDADZck/hqdefault.jpg,,712
https://yt3.ggpht.com/ytc/AIdro_kik7i7hId8EjFMERTw3_j8ODyhoot8JF3iUJRs53htOJc=s88-c-k-c0x00ffffff-no-rj,Who Am I? - The Zach King Story,https://www.youtube.com/watch?v=1LVC2T6gN_8,Zach King,'24/10/2024 12:00,00:29:19,158402,4862,300,Real Talk: I thought of quitting SO many times.. B,"Vine, Best of Vine, Vine Comedy, Funny, comedy, hilarious, cute, magic, vine magic, vine compilation, vine fail, watch vines, vine 2013, cool vines, special effects vines, zachking",24,https://i.ytimg.com/vi/1LVC2T6gN_8/hqdefault.jpg,,714
https://yt3.ggpht.com/y-fmx3L3KoYQZclkZQD4EsMQhjQ75FR0wB_8bkQEk6BQ4fLZ_TMhk4QjPIvF_pTgk1KcmOnL1w=s88-c-k-c0x00ffffff-no-rj,Quand des TUEURS infiltrent des JEUX télévisés.,https://www.youtube.com/watch?v=ILuO-ICDbGQ,VZION,'20/04/2024 15:46,00:27:19,561066,20502,392,Téléchargez gratuitement Wondershare Recoverit pou,"vzion, horror",24,https://i.ytimg.com/vi/ILuO-ICDbGQ/hqdefault.jpg,,716
https://yt3.ggpht.com/QNQKH06vHzPRwiOVEiuFAH93OwKsv39EkVsXY_SAG6aDCADIk46b5P3_60O7CRunDh66StAIlpw=s88-c-k-c0x00ffffff-no-rj,La descente aux enfers INJUSTE du premier roi de Valorant.,https://www.youtube.com/watch?v=Y4zCWyAHzXQ,PolyHeart,'11/10/2024 14:50,00:22:25,149716,7274,160,Pour Profiter d'Odoo !!! : https://www.odoo.com/r/,,20,https://i.ytimg.com/vi/Y4zCWyAHzXQ/hqdefault.jpg,,717
https://yt3.ggpht.com/ytc/AIdro_kcL_PnNz1KEjLIQ7veCTq_0Vv7tktG0oth4M0_NZp8PRw=s88-c-k-c0x00ffffff-no-rj,INTERROGATOIRE SOUS DÉTECTEUR DE MENSONGES #2 (Avec Inoxtag),https://www.youtube.com/watch?v=wHEqDtnHyck,Mastu,'02/07/2022 09:31,00:24:51,13927340,813016,7082,On se pose des questions ULTRA GENANTES avec Inoxt,"Mastu, Mastus, Redbox, Humour, Matsu, loat, Detecteur de mensonge, Mastu mensonge, Mastu inox, Inox, Inoxtag, Mastu inoxtag",23,https://i.ytimg.com/vi/wHEqDtnHyck/hqdefault.jpg,,721
https://yt3.ggpht.com/ytc/AIdro_kSPG3h89eFoHhkLFYl_VQ6OkFpLCfpZUSuIWkRJt0sI-E=s88-c-k-c0x00ffffff-no-rj,BATTLE DES PAYS : On déguste les spécialités tunisiennes avec Hakim Jemili,https://www.youtube.com/watch?v=rw2hicFj_U4,Mcfly et Carlito,'02/10/2025 15:30,00:35:23,550105,31191,673,Abonnez-vous à HelloFresh avec le code MCFLYCARLIT,"mcfly, carlito, golden moustache, fatshow, badass, dab, j'effectue, le, et, on, appelle, des, gens, au, hasard, banane",24,https://i.ytimg.com/vi/rw2hicFj_U4/hqdefault.jpg,,4
https://yt3.ggpht.com/3djzVEm99BYPivZxKHOa2z4_rfoE_bcVCjOmDM10vgp2MGH0lh67Q3Tr4uhckvpHkBMjcXin=s88-c-k-c0x00ffffff-no-rj,Les 7 pouvoirs des FEMMES (le 6ème va vous étonner),https://www.youtube.com/watch?v=EWZQtoYJSnU,euuhhh,'02/10/2025 16:00,00:30:17,14803,500,114,"En stream tous les mardis, jeudis et dimanches dès","react, réact, reactfr, react francais, react français, réct français, euh, euuhhh, roro, un créatif, twitch, stream, live, mascu, argent, entrepreneur, coach, complotiste, new age, société, dev perso, développement personnel, humour, divertissement",24,https://i.ytimg.com/vi/EWZQtoYJSnU/hqdefault.jpg,,6
https://yt3.ggpht.com/ytc/AIdro_kIK55ia3jcirb-DE9ihqU6MlvadGlT1Dq9JBzgMcGc=s88-c-k-c0x00ffffff-no-rj,Les arnaqueurs sont devenus beaucoup trop forts,https://www.youtube.com/watch?v=eDn6cy6Y1CU,Marketing Mania,'01/10/2025 12:01,00:36:23,51395,2148,199,Téléchargez le PDF qui résume toutes les technique,"marketing mania, stan leloup, stanislas leloup, comment convaincre, influence, manipulation, influence et manipulation, marketing, webmarketing, techniques de persuasion, persuasion, arnaques en ligne, psychologie des arnaques, scam psychologie, comment marchent les arnaques, comprendre les scams, pourquoi les arnaques marchent, arnaques 2025, escroqueries en ligne, manipulation mentale, psychologie criminelle, scam en ligne, scam psychologie humaine, Anne Brad Pitt",27,https://i.ytimg.com/vi/eDn6cy6Y1CU/hqdefault.jpg,,12
https://yt3.ggpht.com/dtqnPTfJMwpL5hUtNZLMB_RHhRmwBiQMVizhuSTSt5ykj3s2JTo_xfDJViAxwgsKz7ZO09ScAA=s88-c-k-c0x00ffffff-no-rj,Les jobs les plus fous qui existent encore (malgré l’IA),https://www.youtube.com/watch?v=-7Yeoe--zOM,Speakeasy by /influx,'29/09/2025 06:00,00:34:26,747,40,5,"Dans ce podcast Speakeasy by /influx : Henri, Paul","podcast, speakeasy, entrepreneur, romain lanéry, henri griesmar, hardisk, paul barbosa, IA, metiers, jobs, incroyables, oubliés, chatgpt, métiers incroyables, métiers oubliés, le club, club paul barbosa",26,https://i.ytimg.com/vi/-7Yeoe--zOM/hqdefault.jpg,,26
https://yt3.ggpht.com/3djzVEm99BYPivZxKHOa2z4_rfoE_bcVCjOmDM10vgp2MGH0lh67Q3Tr4uhckvpHkBMjcXin=s88-c-k-c0x00ffffff-no-rj,Ils CONTRÔLENT le vent par la PENSÉE,https://www.youtube.com/watch?v=TL7eO6bpk8I,euuhhh,'24/09/2025 16:01,00:31:27,32056,736,90,"En stream tous les mardis, jeudis et dimanches dès","react, réact, reactfr, react francais, react français, réct français, euh, euuhhh, roro, un créatif, twitch, stream, live, mascu, argent, entrepreneur, coach, complotiste, new age, société, dev perso, développement personnel, humour, divertissement",24,https://i.ytimg.com/vi/TL7eO6bpk8I/hqdefault.jpg,,54
https://yt3.ggpht.com/dtqnPTfJMwpL5hUtNZLMB_RHhRmwBiQMVizhuSTSt5ykj3s2JTo_xfDJViAxwgsKz7ZO09ScAA=s88-c-k-c0x00ffffff-no-rj,7 Secrets d’Entrepreneurs pour Réussir la Rentrée,https://www.youtube.com/watch?v=T-6EPBGeoIo,Speakeasy by /influx,'22/09/2025 06:00,00:37:50,1007,72,7,"Dans ce podcast Speakeasy by /influx : Henri, Paul","podcast, romain lanery, speakeasy, henri griesmar, hardisk, paul barbosa, rentrée, entrepreneur, conseils, 7 conseils",26,https://i.ytimg.com/vi/T-6EPBGeoIo/hqdefault.jpg,,59
https://yt3.ggpht.com/ytc/AIdro_lRDGpQ4uYJtdwyN8dSPN6MnihWZS3j_QPnXqzkpJEcjg=s88-c-k-c0x00ffffff-no-rj,ANTOINE DANIEL | BEST OF ZEVENT 2025 #2,https://www.youtube.com/watch?v=8tlu7CN6Yfs,Best Of Antoine Daniel,'21/09/2025 19:04,00:32:27,162700,8466,111,Retrouvez Antoine en live sur Twitch : https://www,"antoinedaniel, bestof, jdg, caritatif, domingo, battleboost, antoine daniel lapin, antoine daniel, best of antoine daniel, zevent, antoine daniel zevent, best of zevent, best of zevent antoine daniel, etoiles, moman, zevent 2025, gom4rt, donation goal, angle droit, bigflo, wtc, what the cut, baghera, clemovitch",24,https://i.ytimg.com/vi/8tlu7CN6Yfs/hqdefault.jpg,,61
https://yt3.ggpht.com/9waBvH5yP5jTNSGZ-n9Na5ldf3vnzmFOEjv6PUEuCiaRkfffk50GpF6nkDleoapVrR22Uupm8Lc=s88-c-k-c0x00ffffff-no-rj,DANS LA PEAU DE MCWALTER (Making Of / Partie 1),https://www.youtube.com/watch?v=rm5SG1AtCvw,Mister V,'20/09/2025 12:01,00:32:30,395024,19596,465,"Petit making of en bien ... partie 2 bientôt ...

","misterv, yvick, humour, blagues, comique, facecam, states, making of, mcwalter, bulgarie, documentaire, film, prime video, comedie, thomas cadoux, simon astier",23,https://i.ytimg.com/vi/rm5SG1AtCvw/hqdefault.jpg,,68
https://yt3.ggpht.com/y-fmx3L3KoYQZclkZQD4EsMQhjQ75FR0wB_8bkQEk6BQ4fLZ_TMhk4QjPIvF_pTgk1KcmOnL1w=s88-c-k-c0x00ffffff-no-rj,Les Hackers qui en Savaient Trop.,https://www.youtube.com/watch?v=uHnE6ZkSBh4,VZION,'17/09/2025 14:31,00:34:22,291672,12515,314,Plongez dans le monde mystérieux du cyber espionna,"vzion, horror",24,https://i.ytimg.com/vi/uHnE6ZkSBh4/hqdefault.jpg,,87
https://yt3.ggpht.com/IBgiJOen7sXZxskS-BNsDVr_T5WLHSD4-jsvPRtmb_g1BkMSigXjv0uQyySxiF3Sq0BDriJfjcc=s88-c-k-c0x00ffffff-no-rj,macOS Tahoe Released - What's New? (100+ New Features),https://www.youtube.com/watch?v=Xqa-PyY-oRU,Brandon Butch,'16/09/2025 19:58,00:32:14,133384,3264,400,macOS 26 Tahoe Released - What's New? (100+ Featur,"Brandon butch, iphone, ios, apple, iOS 17, iPhone 15, iPhone 16, iOS 18",28,https://i.ytimg.com/vi/Xqa-PyY-oRU/hqdefault.jpg,,90
https://yt3.ggpht.com/QlqvWfuwKRzbBiDYqN0oFvBfITo43Bwd764zxYkJPahA6GKT0i_32Cp29roHcYvkKKSOIZVA=s88-c-k-c0x00ffffff-no-rj,Un Yakuza m'a confié ses crimes,https://www.youtube.com/watch?v=MvprlFFLyac,Simon Puech,'16/09/2025 15:07,00:31:47,173531,10708,225,💶 Pour essayer Trade Republic : https://trade.re/S,"yakuza, japon, gang, mafia, crime, true crime, interview, charles villa, louis san, mitsu, tev, ici japon, tokyo",24,https://i.ytimg.com/vi/MvprlFFLyac/hqdefault.jpg,,92
https://yt3.ggpht.com/F5R-8dCR4OsDu1Rs_2RE20e6LUNFDJW6VemSqToit8XvdfoSj1DXJXb0Dc4aT_YEv-5TsFCF=s88-c-k-c0x00ffffff-no-rj,24H POUR RÉALISER 3 TRICKS !,https://www.youtube.com/watch?v=OcCNH9gjJ1o,JOYCA,'14/09/2025 11:09,00:39:42,3437091,180120,1702,Téléchargez REVOLUT gratuitement avec ce lien  👉 h,"Joyca, video, reaction, Français, solo leveling jeu, carte bancaire, credit card, motivation à travailler, training vidéo",24,https://i.ytimg.com/vi/OcCNH9gjJ1o/hqdefault.jpg,,105
https://yt3.ggpht.com/6rfYMXofbz_hog_NSYSYYEs4rNX9oJwArfWFRY04sB9XtuGWqWrK3Xqi_vp26ZFUxymYQm0rm08=s88-c-k-c0x00ffffff-no-rj,La face cachée de Boeing,https://www.youtube.com/watch?v=DqcXZStxduM,Hardisk,'13/09/2025 09:00,00:34:40,343232,12090,396,"On retrace l'histoire de ce constructeur mythique,","Boeing, enquête, crash 737, scandale aérien, aviation, 737 MAX, whistleblower, lanceur d'alerte, enquête Boeing, crash avion, industrie aéronautique, John Barnett, Joshua Dean, problèmes de sécurité, failles Boeing, FADEC, 737 Max, air crash, documentaire, vidéo choc, sécurité aérienne, corruption, danger, technologie, Airbus, complot, crash, mystère, conspiration, catastrophe aérienne, actualité Boeing, hardisk, hardisk boeing, crash boeing",24,https://i.ytimg.com/vi/DqcXZStxduM/hqdefault.jpg,,109
https://yt3.ggpht.com/_0aCR_brd1AV3pGH0nK77DUQ1Upgdlcv_4Pk8ZdqyTj23ATN9mDgeaq0IjVQrZOpM1UQPLp12A=s88-c-k-c0x00ffffff-no-rj,Apple CarPlay is AWESOME when USING These APPS!,https://www.youtube.com/watch?v=RawntY9IbLs,HotshotTek,'17/12/2024 22:31,00:30:57,50337,527,24,TOP Best Apple CarPlay apps for 2024. Links to the,"best carplay apps, podcast apps, apple carplay apps download, best catplay map app, best carplay podcast app, 2024 carplay app, apple carplay, carplay apps, carplay ios 18.2, ios 18.3 carplay, how to use apple carplay, best apps for carplay, best apple carplay apps, apple carplay apps, wireless carplay, new apple carplay, new carplay features, apple car play, here are the best apps for apple carplay!, apple carplay review, best apps for carplay in 2024",28,https://i.ytimg.com/vi/RawntY9IbLs/hqdefault.jpg,,136
https://yt3.ggpht.com/3djzVEm99BYPivZxKHOa2z4_rfoE_bcVCjOmDM10vgp2MGH0lh67Q3Tr4uhckvpHkBMjcXin=s88-c-k-c0x00ffffff-no-rj,PSYCHOPATHE : ils se cachent parmi vos PROCHES,https://www.youtube.com/watch?v=BVlzubK8CGE,euuhhh,'27/08/2025 16:00,00:36:01,41626,1289,171,"En stream tous les mardis, jeudis et dimanches dès","react, réact, reactfr, react francais, react français, réct français, euh, euuhhh, roro, un créatif, twitch, stream, live, mascu, argent, entrepreneur, coach, complotiste, new age, société, dev perso, développement personnel, humour, divertissement",24,https://i.ytimg.com/vi/BVlzubK8CGE/hqdefault.jpg,,188
https://yt3.ggpht.com/3djzVEm99BYPivZxKHOa2z4_rfoE_bcVCjOmDM10vgp2MGH0lh67Q3Tr4uhckvpHkBMjcXin=s88-c-k-c0x00ffffff-no-rj,Le MEILLEUR tuto de SURVIE (TW : blackface),https://www.youtube.com/watch?v=WolESfNcZLQ,euuhhh,'26/08/2025 16:01,00:35:55,30355,1123,115,"En stream tous les mardis, jeudis et dimanches dès","react, réact, reactfr, react francais, react français, réct français, euh, euuhhh, roro, un créatif, twitch, stream, live, mascu, argent, entrepreneur, coach, complotiste, new age, société, dev perso, développement personnel, humour, divertissement",24,https://i.ytimg.com/vi/WolESfNcZLQ/hqdefault.jpg,,190
https://yt3.ggpht.com/6rfYMXofbz_hog_NSYSYYEs4rNX9oJwArfWFRY04sB9XtuGWqWrK3Xqi_vp26ZFUxymYQm0rm08=s88-c-k-c0x00ffffff-no-rj,Le tueur de PDG qui fascine l’Amérique,https://www.youtube.com/watch?v=IfoTkFePFPk,Hardisk,'23/08/2025 16:26,00:36:20,564820,15835,808,"Mais qui est Luigi Mangione, ce jeune de 26 ans ac","assassinat, Luigi Mangione, PDG tué, UnitedHealthcare, Brian Thompson, true crime, scandale américain, procès, justice américaine, santé USA, thriller, mystère, Silicon Valley, New York, conspiration, fusillade, enquête, documentaire choc, complot, Unabomber, Michael Moore, histoire vraie, affaires criminelles, viral, arrestation, saga judiciaire, réseaux sociaux, viralité, hardisk, documentaire, luigi mangione, luigi mangione ceo, hardisk luigi mangione, hardisk luigi",24,https://i.ytimg.com/vi/IfoTkFePFPk/hqdefault.jpg,,193
https://yt3.ggpht.com/6rfYMXofbz_hog_NSYSYYEs4rNX9oJwArfWFRY04sB9XtuGWqWrK3Xqi_vp26ZFUxymYQm0rm08=s88-c-k-c0x00ffffff-no-rj,Le complot juridique qui a envahi la France,https://www.youtube.com/watch?v=YNqVF1WezbY,Hardisk,'09/08/2025 09:00,00:34:08,344593,9785,695,"Qui sont les ""citoyens souverains"", ces gens qui r","citoyen souverain, complot juridique, France, État illégitime, One Nation, Alice Pazalmar, fraude du nom légal, TDCFR, conspiration, QAnon, common law, mouvement secret, tribunal du droit commun, hardisk, documentaire, enquête, manipulation mentale, droits civiques, résistance, esprit critique, justice parallèle, ésotérisme, common law court, histoire vraie, je ne contracte pas, sovereign citizen",24,https://i.ytimg.com/vi/YNqVF1WezbY/hqdefault.jpg,,214
